[I 2025-07-28 22:43:33,536] Trial 0 finished with value: 0.9682259622296486 and parameters: {'depth': 6, 'learning_rate': 0.2536999076681772, 'l2_leaf_reg': 5.395030966670228, 'bootstrap_type': 'Bayesian', 'bagging_temperature': 0.15599452033620265}. Best is trial 0 with value: 0.9682259622296486.
[I 2025-07-28 22:43:37,787] Trial 1 finished with value: 0.9711823194279375 and parameters: {'depth': 4, 'learning_rate': 0.19030368381735815, 'l2_leaf_reg': 3.9913058785616786, 'bootstrap_type': 'Bayesian', 'bagging_temperature': 0.9699098521619943}. Best is trial 1 with value: 0.9711823194279375.
[I 2025-07-28 22:43:46,199] Trial 2 finished with value: 0.9419212883625597 and parameters: {'depth': 9, 'learning_rate': 0.020589728197687916, 'l2_leaf_reg': 1.5199348301309807, 'bootstrap_type': 'Bernoulli', 'subsample': 0.8}. Best is trial 1 with value: 0.9711823194279375.
[I 2025-07-28 22:43:51,660] Trial 3 finished with value: 0.9366927244411217 and parameters: {'depth': 7, 'learning_rate': 0.02692655251486473, 'l2_leaf_reg': 4.091220574443785, 'bootstrap_type': 'Bernoulli', 'subsample': 0.7}. Best is trial 1 with value: 0.9711823194279375.
[I 2025-07-28 22:43:58,034] Trial 4 finished with value: 0.9717584940371505 and parameters: {'depth': 7, 'learning_rate': 0.14447746112718687, 'l2_leaf_reg': 1.5837031559118748, 'bootstrap_type': 'Bernoulli', 'subsample': 0.6}. Best is trial 4 with value: 0.9717584940371505.
[I 2025-07-28 22:44:06,566] Trial 5 finished with value: 0.9468132303438676 and parameters: {'depth': 8, 'learning_rate': 0.0178601378893971, 'l2_leaf_reg': 1.1615865989246452, 'bootstrap_type': 'Bernoulli', 'subsample': 1.0}. Best is trial 4 with value: 0.9717584940371505.
[I 2025-07-28 22:44:11,445] Trial 6 finished with value: 0.9195065420431339 and parameters: {'depth': 6, 'learning_rate': 0.013940346079873234, 'l2_leaf_reg': 4.833180632488465, 'bootstrap_type': 'Bayesian', 'bagging_temperature': 0.4951769101112702}. Best is trial 4 with value: 0.9717584940371505.
[I 2025-07-28 22:44:15,334] Trial 7 finished with value: 0.9717703695731528 and parameters: {'depth': 4, 'learning_rate': 0.22038218939289875, 'l2_leaf_reg': 1.8145961353490248, 'bootstrap_type': 'Bayesian', 'bagging_temperature': 0.5200680211778108}. Best is trial 7 with value: 0.9717703695731528.
[I 2025-07-28 22:44:20,777] Trial 8 finished with value: 0.9262648051237269 and parameters: {'depth': 7, 'learning_rate': 0.01875220945578641, 'l2_leaf_reg': 9.32362135178148, 'bootstrap_type': 'Bernoulli', 'subsample': 1.0}. Best is trial 7 with value: 0.9717703695731528.
[I 2025-07-28 22:44:28,184] Trial 9 finished with value: 0.9702927590137463 and parameters: {'depth': 8, 'learning_rate': 0.22999586428143728, 'l2_leaf_reg': 1.2260057359187524, 'bootstrap_type': 'Bayesian', 'bagging_temperature': 0.32533033076326434}. Best is trial 7 with value: 0.9717703695731528.
[W 2025-07-28 22:44:28,322] The parameter 'bagging_temperature' in trial#10 is sampled independently instead of being sampled by multivariate TPE sampler. (optimization performance may be degraded). You can suppress this warning by setting `warn_independent_sampling` to `False` in the constructor of `TPESampler`, if this independent sampling is intended behavior.
[I 2025-07-28 22:44:32,409] Trial 10 finished with value: 0.9737703712224051 and parameters: {'depth': 4, 'learning_rate': 0.15856765689863647, 'l2_leaf_reg': 1.241939075837053, 'bootstrap_type': 'Bayesian', 'bagging_temperature': 0.6851241086247859}. Best is trial 10 with value: 0.9737703712224051.
[W 2025-07-28 22:44:32,551] The parameter 'bagging_temperature' in trial#11 is sampled independently instead of being sampled by multivariate TPE sampler. (optimization performance may be degraded). You can suppress this warning by setting `warn_independent_sampling` to `False` in the constructor of `TPESampler`, if this independent sampling is intended behavior.
[I 2025-07-28 22:44:38,175] Trial 11 finished with value: 0.9733361706366844 and parameters: {'depth': 5, 'learning_rate': 0.09620481148535415, 'l2_leaf_reg': 1.015521585571461, 'bootstrap_type': 'Bayesian', 'bagging_temperature': 0.6821291690946689}. Best is trial 10 with value: 0.9737703712224051.
[W 2025-07-28 22:44:38,316] The parameter 'bagging_temperature' in trial#12 is sampled independently instead of being sampled by multivariate TPE sampler. (optimization performance may be degraded). You can suppress this warning by setting `warn_independent_sampling` to `False` in the constructor of `TPESampler`, if this independent sampling is intended behavior.
[I 2025-07-28 22:44:42,604] Trial 12 finished with value: 0.9466576796340085 and parameters: {'depth': 5, 'learning_rate': 0.029247083395097045, 'l2_leaf_reg': 1.246436721768346, 'bootstrap_type': 'Bayesian', 'bagging_temperature': 0.7261185076213859}. Best is trial 10 with value: 0.9737703712224051.
[W 2025-07-28 22:44:42,746] The parameter 'bagging_temperature' in trial#13 is sampled independently instead of being sampled by multivariate TPE sampler. (optimization performance may be degraded). You can suppress this warning by setting `warn_independent_sampling` to `False` in the constructor of `TPESampler`, if this independent sampling is intended behavior.
[I 2025-07-28 22:44:51,532] Trial 13 finished with value: 0.9628426933900867 and parameters: {'depth': 7, 'learning_rate': 0.06764787123563229, 'l2_leaf_reg': 1.1533993663080406, 'bootstrap_type': 'Bayesian', 'bagging_temperature': 0.735518726431486}. Best is trial 10 with value: 0.9737703712224051.
[W 2025-07-28 22:44:51,668] The parameter 'subsample' in trial#14 is sampled independently instead of being sampled by multivariate TPE sampler. (optimization performance may be degraded). You can suppress this warning by setting `warn_independent_sampling` to `False` in the constructor of `TPESampler`, if this independent sampling is intended behavior.
[I 2025-07-28 22:44:56,962] Trial 14 finished with value: 0.9715967807677058 and parameters: {'depth': 5, 'learning_rate': 0.08142998912242747, 'l2_leaf_reg': 1.0250172516426246, 'bootstrap_type': 'Bernoulli', 'subsample': 0.8}. Best is trial 10 with value: 0.9737703712224051.
[W 2025-07-28 22:44:57,112] The parameter 'bagging_temperature' in trial#15 is sampled independently instead of being sampled by multivariate TPE sampler. (optimization performance may be degraded). You can suppress this warning by setting `warn_independent_sampling` to `False` in the constructor of `TPESampler`, if this independent sampling is intended behavior.
[I 2025-07-28 22:45:02,475] Trial 15 finished with value: 0.9704876313882685 and parameters: {'depth': 4, 'learning_rate': 0.05495882412854275, 'l2_leaf_reg': 2.9255099671165565, 'bootstrap_type': 'Bayesian', 'bagging_temperature': 0.7018651711152791}. Best is trial 10 with value: 0.9737703712224051.
[W 2025-07-28 22:45:02,621] The parameter 'bagging_temperature' in trial#16 is sampled independently instead of being sampled by multivariate TPE sampler. (optimization performance may be degraded). You can suppress this warning by setting `warn_independent_sampling` to `False` in the constructor of `TPESampler`, if this independent sampling is intended behavior.
[I 2025-07-28 22:45:08,301] Trial 16 finished with value: 0.973968348865942 and parameters: {'depth': 5, 'learning_rate': 0.10321004372852548, 'l2_leaf_reg': 1.4881145383472476, 'bootstrap_type': 'Bayesian', 'bagging_temperature': 0.8648495813659917}. Best is trial 16 with value: 0.973968348865942.
[W 2025-07-28 22:45:08,442] The parameter 'subsample' in trial#17 is sampled independently instead of being sampled by multivariate TPE sampler. (optimization performance may be degraded). You can suppress this warning by setting `warn_independent_sampling` to `False` in the constructor of `TPESampler`, if this independent sampling is intended behavior.
[I 2025-07-28 22:45:13,151] Trial 17 finished with value: 0.9713953941985235 and parameters: {'depth': 4, 'learning_rate': 0.10652455805201598, 'l2_leaf_reg': 3.10407305902396, 'bootstrap_type': 'Bernoulli', 'subsample': 0.6}. Best is trial 16 with value: 0.973968348865942.

Best trial: 16. Best value: 0.973968:  60%|██████    | 18/30 [01:45<01:06,  5.57s/it]
                                                                                     

Best trial: 16. Best value: 0.973968:  60%|██████    | 18/30 [02:12<01:06,  5.57s/it]
Best trial: 16. Best value: 0.973968:  60%|██████    | 18/30 [02:12<01:06,  5.57s/it]
Best trial: 16. Best value: 0.973968:  63%|██████▎   | 19/30 [02:12<02:13, 12.14s/it]
                                                                                     

Best trial: 16. Best value: 0.973968:  63%|██████▎   | 19/30 [02:12<02:13, 12.14s/it]
                                                                                     

Best trial: 16. Best value: 0.973968:  63%|██████▎   | 19/30 [02:17<02:13, 12.14s/it]
Best trial: 19. Best value: 0.976387:  63%|██████▎   | 19/30 [02:17<02:13, 12.14s/it]
Best trial: 19. Best value: 0.976387:  67%|██████▋   | 20/30 [02:17<01:39,  9.97s/it]
                                                                                     

Best trial: 19. Best value: 0.976387:  67%|██████▋   | 20/30 [02:17<01:39,  9.97s/it]
                                                                                     

Best trial: 19. Best value: 0.976387:  67%|██████▋   | 20/30 [02:22<01:39,  9.97s/it]
Best trial: 19. Best value: 0.976387:  67%|██████▋   | 20/30 [02:22<01:39,  9.97s/it]
Best trial: 19. Best value: 0.976387:  70%|███████   | 21/30 [02:22<01:16,  8.46s/it]
                                                                                     

Best trial: 19. Best value: 0.976387:  70%|███████   | 21/30 [02:22<01:16,  8.46s/it]
                                                                                     

Best trial: 19. Best value: 0.976387:  70%|███████   | 21/30 [02:27<01:16,  8.46s/it]
Best trial: 21. Best value: 0.97664:  70%|███████   | 21/30 [02:27<01:16,  8.46s/it] 
Best trial: 21. Best value: 0.97664:  73%|███████▎  | 22/30 [02:27<00:59,  7.50s/it]
                                                                                    

Best trial: 21. Best value: 0.97664:  73%|███████▎  | 22/30 [02:27<00:59,  7.50s/it]
                                                                                    

Best trial: 21. Best value: 0.97664:  73%|███████▎  | 22/30 [02:32<00:59,  7.50s/it]
Best trial: 21. Best value: 0.97664:  73%|███████▎  | 22/30 [02:32<00:59,  7.50s/it]
Best trial: 21. Best value: 0.97664:  77%|███████▋  | 23/30 [02:32<00:46,  6.62s/it]
                                                                                    

Best trial: 21. Best value: 0.97664:  77%|███████▋  | 23/30 [02:32<00:46,  6.62s/it]
                                                                                    

Best trial: 21. Best value: 0.97664:  77%|███████▋  | 23/30 [02:37<00:46,  6.62s/it]
Best trial: 21. Best value: 0.97664:  77%|███████▋  | 23/30 [02:37<00:46,  6.62s/it]
Best trial: 21. Best value: 0.97664:  80%|████████  | 24/30 [02:37<00:37,  6.17s/it]
                                                                                    

Best trial: 21. Best value: 0.97664:  80%|████████  | 24/30 [02:37<00:37,  6.17s/it]
                                                                                    

Best trial: 21. Best value: 0.97664:  80%|████████  | 24/30 [02:41<00:37,  6.17s/it]
Best trial: 21. Best value: 0.97664:  80%|████████  | 24/30 [02:41<00:37,  6.17s/it]
Best trial: 21. Best value: 0.97664:  83%|████████▎ | 25/30 [02:41<00:27,  5.57s/it]
                                                                                    

Best trial: 21. Best value: 0.97664:  83%|████████▎ | 25/30 [02:41<00:27,  5.57s/it]
                                                                                    

Best trial: 21. Best value: 0.97664:  83%|████████▎ | 25/30 [02:47<00:27,  5.57s/it]
Best trial: 21. Best value: 0.97664:  83%|████████▎ | 25/30 [02:47<00:27,  5.57s/it]
Best trial: 21. Best value: 0.97664:  87%|████████▋ | 26/30 [02:47<00:22,  5.64s/it]
                                                                                    

Best trial: 21. Best value: 0.97664:  87%|████████▋ | 26/30 [02:47<00:22,  5.64s/it]
                                                                                    

Best trial: 21. Best value: 0.97664:  87%|████████▋ | 26/30 [02:51<00:22,  5.64s/it]
Best trial: 21. Best value: 0.97664:  87%|████████▋ | 26/30 [02:51<00:22,  5.64s/it]
Best trial: 21. Best value: 0.97664:  90%|█████████ | 27/30 [02:51<00:15,  5.25s/it]
                                                                                    

Best trial: 21. Best value: 0.97664:  90%|█████████ | 27/30 [02:51<00:15,  5.25s/it]
                                                                                    

Best trial: 21. Best value: 0.97664:  90%|█████████ | 27/30 [02:57<00:15,  5.25s/it]
Best trial: 21. Best value: 0.97664:  90%|█████████ | 27/30 [02:57<00:15,  5.25s/it]
Best trial: 21. Best value: 0.97664:  93%|█████████▎| 28/30 [02:57<00:10,  5.28s/it]
                                                                                    

Best trial: 21. Best value: 0.97664:  93%|█████████▎| 28/30 [02:57<00:10,  5.28s/it]
                                                                                    

Best trial: 21. Best value: 0.97664:  93%|█████████▎| 28/30 [03:03<00:10,  5.28s/it]
Best trial: 21. Best value: 0.97664:  93%|█████████▎| 28/30 [03:03<00:10,  5.28s/it]
Best trial: 21. Best value: 0.97664:  97%|█████████▋| 29/30 [03:03<00:05,  5.66s/it]
                                                                                    

Best trial: 21. Best value: 0.97664:  97%|█████████▋| 29/30 [03:03<00:05,  5.66s/it]
                                                                                    

Best trial: 21. Best value: 0.97664:  97%|█████████▋| 29/30 [03:10<00:05,  5.66s/it]
Best trial: 21. Best value: 0.97664:  97%|█████████▋| 29/30 [03:10<00:05,  5.66s/it]
Best trial: 21. Best value: 0.97664: 100%|██████████| 30/30 [03:10<00:00,  6.05s/it]
Best trial: 21. Best value: 0.97664: 100%|██████████| 30/30 [03:10<00:00,  6.36s/it]

2025-07-28 22:46:38,693 - CatBoostTrainer - INFO - ✓ Optimization completed in 190.8 seconds!

2025-07-28 22:46:38,693 - CatBoostTrainer - INFO - Best F1-macro (CV): 0.9766 (±0.0117)

2025-07-28 22:46:38,694 - CatBoostTrainer - INFO - Final model training with best hyperparameters...
[W 2025-07-28 22:45:13,289] The parameter 'bagging_temperature' in trial#18 is sampled independently instead of being sampled by multivariate TPE sampler. (optimization performance may be degraded). You can suppress this warning by setting `warn_independent_sampling` to `False` in the constructor of `TPESampler`, if this independent sampling is intended behavior.
[I 2025-07-28 22:45:40,589] Trial 18 finished with value: 0.9721693408795493 and parameters: {'depth': 10, 'learning_rate': 0.09187963955293328, 'l2_leaf_reg': 4.647780510374128, 'bootstrap_type': 'Bayesian', 'bagging_temperature': 0.9113004823583138}. Best is trial 16 with value: 0.973968348865942.
[W 2025-07-28 22:45:40,749] The parameter 'subsample' in trial#19 is sampled independently instead of being sampled by multivariate TPE sampler. (optimization performance may be degraded). You can suppress this warning by setting `warn_independent_sampling` to `False` in the constructor of `TPESampler`, if this independent sampling is intended behavior.
[I 2025-07-28 22:45:45,519] Trial 19 finished with value: 0.9763874092201277 and parameters: {'depth': 5, 'learning_rate': 0.296209581213472, 'l2_leaf_reg': 1.1324658095380757, 'bootstrap_type': 'Bernoulli', 'subsample': 0.9}. Best is trial 19 with value: 0.9763874092201277.
[W 2025-07-28 22:45:45,658] The parameter 'subsample' in trial#20 is sampled independently instead of being sampled by multivariate TPE sampler. (optimization performance may be degraded). You can suppress this warning by setting `warn_independent_sampling` to `False` in the constructor of `TPESampler`, if this independent sampling is intended behavior.
[I 2025-07-28 22:45:50,460] Trial 20 finished with value: 0.9760844360251225 and parameters: {'depth': 5, 'learning_rate': 0.20550998862421097, 'l2_leaf_reg': 1.4834884815478733, 'bootstrap_type': 'Bernoulli', 'subsample': 0.9}. Best is trial 19 with value: 0.9763874092201277.
[W 2025-07-28 22:45:50,600] The parameter 'subsample' in trial#21 is sampled independently instead of being sampled by multivariate TPE sampler. (optimization performance may be degraded). You can suppress this warning by setting `warn_independent_sampling` to `False` in the constructor of `TPESampler`, if this independent sampling is intended behavior.
[I 2025-07-28 22:45:55,695] Trial 21 finished with value: 0.9766401841905218 and parameters: {'depth': 5, 'learning_rate': 0.27378861185756237, 'l2_leaf_reg': 1.7657590787903183, 'bootstrap_type': 'Bernoulli', 'subsample': 0.9}. Best is trial 21 with value: 0.9766401841905218.
[W 2025-07-28 22:45:55,848] The parameter 'subsample' in trial#22 is sampled independently instead of being sampled by multivariate TPE sampler. (optimization performance may be degraded). You can suppress this warning by setting `warn_independent_sampling` to `False` in the constructor of `TPESampler`, if this independent sampling is intended behavior.
[I 2025-07-28 22:46:00,257] Trial 22 finished with value: 0.9761253407087732 and parameters: {'depth': 5, 'learning_rate': 0.27090947707423363, 'l2_leaf_reg': 1.9208162249261438, 'bootstrap_type': 'Bernoulli', 'subsample': 0.9}. Best is trial 21 with value: 0.9766401841905218.
[W 2025-07-28 22:46:00,409] The parameter 'subsample' in trial#23 is sampled independently instead of being sampled by multivariate TPE sampler. (optimization performance may be degraded). You can suppress this warning by setting `warn_independent_sampling` to `False` in the constructor of `TPESampler`, if this independent sampling is intended behavior.
[I 2025-07-28 22:46:05,382] Trial 23 finished with value: 0.96038590663955 and parameters: {'depth': 6, 'learning_rate': 0.24833989096154316, 'l2_leaf_reg': 2.6731017128617953, 'bootstrap_type': 'Bernoulli', 'subsample': 0.9}. Best is trial 21 with value: 0.9766401841905218.
[W 2025-07-28 22:46:05,540] The parameter 'subsample' in trial#24 is sampled independently instead of being sampled by multivariate TPE sampler. (optimization performance may be degraded). You can suppress this warning by setting `warn_independent_sampling` to `False` in the constructor of `TPESampler`, if this independent sampling is intended behavior.
[I 2025-07-28 22:46:09,560] Trial 24 finished with value: 0.9759659039996977 and parameters: {'depth': 4, 'learning_rate': 0.2704129465822814, 'l2_leaf_reg': 1.272555148558426, 'bootstrap_type': 'Bernoulli', 'subsample': 0.9}. Best is trial 21 with value: 0.9766401841905218.
[W 2025-07-28 22:46:09,714] The parameter 'subsample' in trial#25 is sampled independently instead of being sampled by multivariate TPE sampler. (optimization performance may be degraded). You can suppress this warning by setting `warn_independent_sampling` to `False` in the constructor of `TPESampler`, if this independent sampling is intended behavior.
[I 2025-07-28 22:46:15,363] Trial 25 finished with value: 0.9670448986832557 and parameters: {'depth': 6, 'learning_rate': 0.2252789409653192, 'l2_leaf_reg': 1.2425004617433493, 'bootstrap_type': 'Bernoulli', 'subsample': 0.9}. Best is trial 21 with value: 0.9766401841905218.
[W 2025-07-28 22:46:15,504] The parameter 'subsample' in trial#26 is sampled independently instead of being sampled by multivariate TPE sampler. (optimization performance may be degraded). You can suppress this warning by setting `warn_independent_sampling` to `False` in the constructor of `TPESampler`, if this independent sampling is intended behavior.
[I 2025-07-28 22:46:19,690] Trial 26 finished with value: 0.9733045442060032 and parameters: {'depth': 4, 'learning_rate': 0.298524325160975, 'l2_leaf_reg': 4.007035941183972, 'bootstrap_type': 'Bernoulli', 'subsample': 0.9}. Best is trial 21 with value: 0.9766401841905218.
[W 2025-07-28 22:46:19,835] The parameter 'subsample' in trial#27 is sampled independently instead of being sampled by multivariate TPE sampler. (optimization performance may be degraded). You can suppress this warning by setting `warn_independent_sampling` to `False` in the constructor of `TPESampler`, if this independent sampling is intended behavior.
[I 2025-07-28 22:46:25,042] Trial 27 finished with value: 0.9763837623001846 and parameters: {'depth': 5, 'learning_rate': 0.2632128576678979, 'l2_leaf_reg': 1.9698391485271236, 'bootstrap_type': 'Bernoulli', 'subsample': 0.8}. Best is trial 21 with value: 0.9766401841905218.
[W 2025-07-28 22:46:25,203] The parameter 'subsample' in trial#28 is sampled independently instead of being sampled by multivariate TPE sampler. (optimization performance may be degraded). You can suppress this warning by setting `warn_independent_sampling` to `False` in the constructor of `TPESampler`, if this independent sampling is intended behavior.
[I 2025-07-28 22:46:31,579] Trial 28 finished with value: 0.9622140881299744 and parameters: {'depth': 7, 'learning_rate': 0.27732203994015747, 'l2_leaf_reg': 1.041695326991217, 'bootstrap_type': 'Bernoulli', 'subsample': 0.8}. Best is trial 21 with value: 0.9766401841905218.
[W 2025-07-28 22:46:31,729] The parameter 'bagging_temperature' in trial#29 is sampled independently instead of being sampled by multivariate TPE sampler. (optimization performance may be degraded). You can suppress this warning by setting `warn_independent_sampling` to `False` in the constructor of `TPESampler`, if this independent sampling is intended behavior.
