[I 2025-07-29 05:47:47,036] Trial 26 finished with value: 0.9690559974190073 and parameters: {'n_estimators': 300, 'max_depth': 20, 'min_samples_leaf': 2, 'max_features': 'sqrt'}. Best is trial 3 with value: 0.9820024999005295.
[I 2025-07-29 05:48:18,716] Trial 27 finished with value: 0.9789319706925431 and parameters: {'n_estimators': 700, 'max_depth': 20, 'min_samples_leaf': 1, 'max_features': 0.8}. Best is trial 3 with value: 0.9820024999005295.
[I 2025-07-29 05:48:25,075] Trial 28 finished with value: 0.9603517175012423 and parameters: {'n_estimators': 400, 'max_depth': 10, 'min_samples_leaf': 5, 'max_features': 'sqrt'}. Best is trial 3 with value: 0.9820024999005295.
[I 2025-07-29 05:48:37,840] Trial 29 finished with value: 0.9807005564872879 and parameters: {'n_estimators': 400, 'max_depth': 20, 'min_samples_leaf': 2, 'max_features': 0.5}. Best is trial 3 with value: 0.9820024999005295.
[I 2025-07-29 05:48:47,287] Trial 30 finished with value: 0.9646813901038463 and parameters: {'n_estimators': 600, 'max_depth': 10, 'min_samples_leaf': 3, 'max_features': 'sqrt'}. Best is trial 3 with value: 0.9820024999005295.
[I 2025-07-29 05:48:55,387] Trial 31 finished with value: 0.9722497410631725 and parameters: {'n_estimators': 500, 'max_depth': 20, 'min_samples_leaf': 1, 'max_features': 'sqrt'}. Best is trial 3 with value: 0.9820024999005295.
[I 2025-07-29 05:49:11,467] Trial 32 finished with value: 0.9820024999005295 and parameters: {'n_estimators': 500, 'max_depth': 20, 'min_samples_leaf': 1, 'max_features': 0.5}. Best is trial 3 with value: 0.9820024999005295.
[I 2025-07-29 05:49:27,576] Trial 33 finished with value: 0.9820024999005295 and parameters: {'n_estimators': 500, 'max_depth': 20, 'min_samples_leaf': 1, 'max_features': 0.5}. Best is trial 3 with value: 0.9820024999005295.
[I 2025-07-29 05:49:40,485] Trial 34 finished with value: 0.980963122206177 and parameters: {'n_estimators': 400, 'max_depth': 20, 'min_samples_leaf': 1, 'max_features': 0.5}. Best is trial 3 with value: 0.9820024999005295.
[I 2025-07-29 05:49:46,965] Trial 35 finished with value: 0.9724662454531469 and parameters: {'n_estimators': 400, 'max_depth': 10, 'min_samples_leaf': 1, 'max_features': 'sqrt'}. Best is trial 3 with value: 0.9820024999005295.

Best trial: 3. Best value: 0.982002:  72%|███████▏  | 36/50 [09:07<02:40, 11.46s/it]
Best trial: 3. Best value: 0.982002:  72%|███████▏  | 36/50 [09:07<02:40, 11.46s/it]
Best trial: 3. Best value: 0.982002:  74%|███████▍  | 37/50 [09:07<04:01, 18.59s/it]
                                                                                    

Best trial: 3. Best value: 0.982002:  74%|███████▍  | 37/50 [09:15<04:01, 18.59s/it]
Best trial: 3. Best value: 0.982002:  74%|███████▍  | 37/50 [09:15<04:01, 18.59s/it]
Best trial: 3. Best value: 0.982002:  76%|███████▌  | 38/50 [09:15<03:05, 15.42s/it]
                                                                                    

Best trial: 3. Best value: 0.982002:  76%|███████▌  | 38/50 [09:38<03:05, 15.42s/it]
Best trial: 3. Best value: 0.982002:  76%|███████▌  | 38/50 [09:38<03:05, 15.42s/it]
Best trial: 3. Best value: 0.982002:  78%|███████▊  | 39/50 [09:38<03:13, 17.62s/it]
                                                                                    

Best trial: 3. Best value: 0.982002:  78%|███████▊  | 39/50 [09:56<03:13, 17.62s/it]
Best trial: 3. Best value: 0.982002:  78%|███████▊  | 39/50 [09:56<03:13, 17.62s/it]
Best trial: 3. Best value: 0.982002:  80%|████████  | 40/50 [09:56<02:56, 17.63s/it]
                                                                                    

Best trial: 3. Best value: 0.982002:  80%|████████  | 40/50 [10:05<02:56, 17.63s/it]
Best trial: 3. Best value: 0.982002:  80%|████████  | 40/50 [10:05<02:56, 17.63s/it]
Best trial: 3. Best value: 0.982002:  82%|████████▏ | 41/50 [10:05<02:17, 15.26s/it]
                                                                                    

Best trial: 3. Best value: 0.982002:  82%|████████▏ | 41/50 [10:21<02:17, 15.26s/it]
Best trial: 3. Best value: 0.982002:  82%|████████▏ | 41/50 [10:21<02:17, 15.26s/it]
Best trial: 3. Best value: 0.982002:  84%|████████▍ | 42/50 [10:21<02:03, 15.50s/it]
                                                                                    

Best trial: 3. Best value: 0.982002:  84%|████████▍ | 42/50 [10:44<02:03, 15.50s/it]
Best trial: 3. Best value: 0.982002:  84%|████████▍ | 42/50 [10:44<02:03, 15.50s/it]
Best trial: 3. Best value: 0.982002:  86%|████████▌ | 43/50 [10:44<02:02, 17.56s/it]
                                                                                    

Best trial: 3. Best value: 0.982002:  86%|████████▌ | 43/50 [10:55<02:02, 17.56s/it]
Best trial: 3. Best value: 0.982002:  86%|████████▌ | 43/50 [10:55<02:02, 17.56s/it]
Best trial: 3. Best value: 0.982002:  88%|████████▊ | 44/50 [10:55<01:33, 15.66s/it]
                                                                                    

Best trial: 3. Best value: 0.982002:  88%|████████▊ | 44/50 [11:14<01:33, 15.66s/it]
Best trial: 3. Best value: 0.982002:  88%|████████▊ | 44/50 [11:14<01:33, 15.66s/it]
Best trial: 3. Best value: 0.982002:  90%|█████████ | 45/50 [11:14<01:23, 16.65s/it]
                                                                                    

Best trial: 3. Best value: 0.982002:  90%|█████████ | 45/50 [11:41<01:23, 16.65s/it]
Best trial: 3. Best value: 0.982002:  90%|█████████ | 45/50 [11:41<01:23, 16.65s/it]
Best trial: 3. Best value: 0.982002:  92%|█████████▏| 46/50 [11:41<01:19, 19.81s/it]
                                                                                    

Best trial: 3. Best value: 0.982002:  92%|█████████▏| 46/50 [12:07<01:19, 19.81s/it]
Best trial: 3. Best value: 0.982002:  92%|█████████▏| 46/50 [12:07<01:19, 19.81s/it]
Best trial: 3. Best value: 0.982002:  94%|█████████▍| 47/50 [12:07<01:04, 21.50s/it]
                                                                                    

Best trial: 3. Best value: 0.982002:  94%|█████████▍| 47/50 [12:26<01:04, 21.50s/it]
Best trial: 3. Best value: 0.982002:  94%|█████████▍| 47/50 [12:26<01:04, 21.50s/it]
Best trial: 3. Best value: 0.982002:  96%|█████████▌| 48/50 [12:26<00:41, 20.82s/it]
                                                                                    

Best trial: 3. Best value: 0.982002:  96%|█████████▌| 48/50 [12:29<00:41, 20.82s/it]
Best trial: 3. Best value: 0.982002:  96%|█████████▌| 48/50 [12:29<00:41, 20.82s/it]
Best trial: 3. Best value: 0.982002:  98%|█████████▊| 49/50 [12:29<00:15, 15.61s/it]
                                                                                    

Best trial: 3. Best value: 0.982002:  98%|█████████▊| 49/50 [12:52<00:15, 15.61s/it]
Best trial: 3. Best value: 0.982002:  98%|█████████▊| 49/50 [12:52<00:15, 15.61s/it]
Best trial: 3. Best value: 0.982002: 100%|██████████| 50/50 [12:52<00:00, 17.66s/it]
Best trial: 3. Best value: 0.982002: 100%|██████████| 50/50 [12:52<00:00, 15.44s/it]

2025-07-29 05:54:06,807 - RandomForestTrainer - INFO - ✓ Optimization completed in 772.2 seconds!

2025-07-29 05:54:06,808 - RandomForestTrainer - INFO - Best F1-macro (CV): 0.9820 (±0.0059)

2025-07-29 05:54:06,808 - RandomForestTrainer - INFO - Final model training with best hyperparameters...

2025-07-29 05:54:06,809 - RandomForestTrainer - INFO - Starting final fitting...

2025-07-29 05:54:10,652 - RandomForestTrainer - INFO - ✓ Final model fitting completed in 3.84 seconds!

2025-07-29 05:54:10,793 - RandomForestTrainer - INFO - ✓ Final model saved to: /results/random_forest/random_forest_model.pkl

2025-07-29 05:54:10,793 - RandomForestTrainer - INFO - Evaluating final model on the holdout set and saving results...

2025-07-29 05:54:10,918 - RandomForestTrainer - INFO - Save Results: CSV and JSON Files...

2025-07-29 05:54:10,991 - RandomForestTrainer - INFO - Generating and saving visualizations...

2025-07-29 05:54:13,422 - RandomForestTrainer - INFO - All RANDOM FOREST visualizations and results saved to: /results/random_forest

2025-07-29 05:54:13,422 - RandomForestTrainer - INFO - RANDOM FOREST COMPLETED! Total execution time: 13.0 minutes

2025-07-29 05:54:13,422 - RandomForestTrainer - INFO - All results saved to: /results/random_forest. Generating summary...

2025-07-29 05:54:13,425 - TabNetTrainer - INFO - Starting TabNet Training Pipeline...

2025-07-29 05:54:13,425 - TabNetTrainer - INFO - Loading and preprocessing dataset from ../data/aims_dataset.csv ...

2025-07-29 05:54:13,529 - TabNetTrainer - INFO - Applying Custom Weighted-Impact Labeling...

2025-07-29 05:54:14,005 - TabNetTrainer - INFO - Splitting data into temporal‑aware training and hold‑out sets...
[I 2025-07-29 05:50:22,197] Trial 36 finished with value: 0.9813088480376153 and parameters: {'n_estimators': 800, 'max_depth': 10, 'min_samples_leaf': 4, 'max_features': 0.8}. Best is trial 3 with value: 0.9820024999005295.
[I 2025-07-29 05:50:30,212] Trial 37 finished with value: 0.973394814017591 and parameters: {'n_estimators': 500, 'max_depth': None, 'min_samples_leaf': 2, 'max_features': 'sqrt'}. Best is trial 3 with value: 0.9820024999005295.
[I 2025-07-29 05:50:52,951] Trial 38 finished with value: 0.9796697098116895 and parameters: {'n_estimators': 500, 'max_depth': 30, 'min_samples_leaf': 1, 'max_features': 0.8}. Best is trial 3 with value: 0.9820024999005295.
[I 2025-07-29 05:51:10,607] Trial 39 finished with value: 0.9782080750106907 and parameters: {'n_estimators': 400, 'max_depth': 30, 'min_samples_leaf': 5, 'max_features': 0.8}. Best is trial 3 with value: 0.9820024999005295.
[I 2025-07-29 05:51:20,347] Trial 40 finished with value: 0.9819016437562192 and parameters: {'n_estimators': 300, 'max_depth': 10, 'min_samples_leaf': 1, 'max_features': 0.5}. Best is trial 3 with value: 0.9820024999005295.
[I 2025-07-29 05:51:36,395] Trial 41 finished with value: 0.9820024999005295 and parameters: {'n_estimators': 500, 'max_depth': None, 'min_samples_leaf': 1, 'max_features': 0.5}. Best is trial 3 with value: 0.9820024999005295.
[I 2025-07-29 05:51:58,757] Trial 42 finished with value: 0.9814960957501659 and parameters: {'n_estimators': 700, 'max_depth': None, 'min_samples_leaf': 1, 'max_features': 0.5}. Best is trial 3 with value: 0.9820024999005295.
[I 2025-07-29 05:52:09,988] Trial 43 finished with value: 0.9725494281635836 and parameters: {'n_estimators': 700, 'max_depth': None, 'min_samples_leaf': 1, 'max_features': 'sqrt'}. Best is trial 3 with value: 0.9820024999005295.
[I 2025-07-29 05:52:28,956] Trial 44 finished with value: 0.9807005564872879 and parameters: {'n_estimators': 600, 'max_depth': None, 'min_samples_leaf': 2, 'max_features': 0.5}. Best is trial 3 with value: 0.9820024999005295.
[I 2025-07-29 05:52:56,152] Trial 45 finished with value: 0.9789319706925431 and parameters: {'n_estimators': 600, 'max_depth': None, 'min_samples_leaf': 1, 'max_features': 0.8}. Best is trial 3 with value: 0.9820024999005295.
[I 2025-07-29 05:53:21,594] Trial 46 finished with value: 0.981702975547621 and parameters: {'n_estimators': 800, 'max_depth': 20, 'min_samples_leaf': 1, 'max_features': 0.5}. Best is trial 3 with value: 0.9820024999005295.
[I 2025-07-29 05:53:40,826] Trial 47 finished with value: 0.9820024999005295 and parameters: {'n_estimators': 600, 'max_depth': 20, 'min_samples_leaf': 1, 'max_features': 0.5}. Best is trial 3 with value: 0.9820024999005295.
[I 2025-07-29 05:53:44,274] Trial 48 finished with value: 0.9810402666068951 and parameters: {'n_estimators': 100, 'max_depth': 30, 'min_samples_leaf': 3, 'max_features': 0.5}. Best is trial 3 with value: 0.9820024999005295.
[I 2025-07-29 05:54:06,716] Trial 49 finished with value: 0.9813825597381263 and parameters: {'n_estimators': 500, 'max_depth': 20, 'min_samples_leaf': 2, 'max_features': 0.8}. Best is trial 3 with value: 0.9820024999005295.
✓ Optimization completed in 772.2 seconds!
Best trial: 3
Best parameters found:
  - n_estimators: 500
  - max_depth: 20
  - min_samples_leaf: 1
  - max_features: 0.5

Best F1-macro (CV): 0.9820 (±0.0059)
------------------------------------------------------------
[Step 7/11] Final model training with best hyperparameters...
------------------------------------------------------------
Starting final fitting...
✓ Final model fitting completed in 3.84 seconds!
✓ Final model saved to: /results/random_forest/random_forest_model.pkl
✓ Number of trees: 500
✓ Max depth: 20
------------------------------------------------------------
[Step 8/11] Evaluating final model on the holdout set and saving results...
------------------------------------------------------------

Classification Report:
              precision    recall  f1-score   support

    Adequate       1.00      0.99      0.99        71
     Warning       0.93      0.85      0.89       130
      Severe       0.94      0.97      0.95       445
    Critical       0.95      0.94      0.95       178

    accuracy                           0.95       824
   macro avg       0.96      0.94      0.95       824
weighted avg       0.95      0.95      0.95       824


Key Performance Indicators:
  • Overall Accuracy: 94.5%
  • Macro F1-Score: 94.6%
  • Weighted F1-Score: 94.5%

------------------------------------------------------------
[Step 9/11] Save Results: CSV and JSON Files...
------------------------------------------------------------

Extracting feature importance...
✓ Feature importance saved to: /results/random_forest/feature_importances_rf.csv
Saving comprehensive results...
✓ Results successfully saved to: /results/random_forest/training_results_random_forest.json
------------------------------------------------------------
[Step 10/11] Generating and saving visualizations...
------------------------------------------------------------
✓ Confusion matrix plot saved: /results/random_forest/confusion_matrix_rf_raw.png
✓ Confusion matrix plot saved: /results/random_forest/confusion_matrix_rf_normalized.png
✓ Optuna optimization history saved: /results/random_forest/optuna_history_rf.html
Generating feature importance barplot...
✓ Feature importance barplot saved: /results/random_forest/feature_importance_rf.png
Generating cumulative feature importance plot...
✓ Cumulative feature importance plot saved: /results/random_forest/feature_importance_cumulative_rf.png


✓ All RANDOM FOREST visualizations and results saved to: /results/random_forest
------------------------------------------------------------
[Step 11/11] RANDOM FOREST COMPLETED! Total execution time: 13.0 minutes
All results saved to: /results/random_forest. Generating summary...
------------------------------------------------------------

================================================================================
RANDOMFOREST TRAINING SUMMARY
================================================================================
Model Library: scikit-learn v1.7.0
Data: 4576 train / 824 holdout
CV Score (Macro F1): 0.9820
Holdout Accuracy: 0.9454
Holdout Macro F1: 0.9462
Total Run Time: 777.9s
================================================================================
================================================================================
All results saved to: /results/random_forest
================================================================================

Total execution time: 13.0 minutes
✓ Random Forest training completed.

[2/3] Training TabNet Classifier...
------------------------------------------------------------

================================================================================
TABNET TRAINING PIPELINE - AIMS FRAMEWORK
================================================================================
Configuration:
  - Dataset: ../data/aims_dataset.csv
  - CV Folds: 5
  - Optuna Trials: 50
  - Random State: 42
================================================================================
------------------------------------------------------------
[Step 1/11] Loading and preprocessing dataset...
------------------------------------------------------------
✓ Raw dataset shape: (5400, 18)
✓ Preprocessed dataset shape: (5400, 25)
------------------------------------------------------------
[Step 2/11] Applying Custom Weighted-Impact Labeling...
------------------------------------------------------------
✓ Feature matrix shape : (5400, 25)
✓ Temporal groups      : 25
✓ Impact distribution :
   count  percent (%)
0    768        14.22
1   1013        18.76
2   2715        50.28
3    904        16.74
------------------------------------------------------------
[Step 3/11] Splitting data into temporal‑aware training and hold‑out sets...
------------------------------------------------------------
✓ Training set : 4576 samples (84.7 %)
✓ Hold‑out set : 824 samples (15.3 %)
✓ Numerical features: 20

2025-07-29 05:54:14,039 - TabNetTrainer - INFO - Setting up output directory...

2025-07-29 05:54:14,206 - TabNetTrainer - INFO - Configure and Run Hyperparameter Optimization (HPO) with Optuna ...
[I 2025-07-29 05:54:14,207] A new study created in memory with name: no-name-c7a411a3-75ad-42a5-adde-a45734240e0d

2025-07-29 05:54:14,207 - TabNetTrainer - INFO - CUDA-enabled GPU detected: Tesla T4 (14.6 GB). Setting task_type to 'GPU'.

2025-07-29 05:54:15,749 - TabNetTrainer - INFO - Starting Optuna optimization with 50 trials...
✓ Categorical features: 5
------------------------------------------------------------
[Step 4/11] Setting up output directory...
------------------------------------------------------------
✓ Results will be saved to: /results/tabnet
✓ Saving artifact files (features, labels, groups, and class weights)...
✓ Features, labels, groups, and class weights saved.
------------------------------------------------------------
[Steps 5 & 6 /11] Configure and Run Tabnet Hyperparameter Optimization (HPO) with Optuna ...
------------------------------------------------------------
CUDA-enabled GPU detected: Tesla T4 (14.6 GB). Setting task_type to 'GPU'.
Starting Optuna optimization with 50 trials...

  0%|          | 0/50 [00:00<?, ?it/s]
                                      

  0%|          | 0/50 [01:39<?, ?it/s]
Best trial: 0. Best value: 0.861504:   0%|          | 0/50 [01:39<?, ?it/s]
Best trial: 0. Best value: 0.861504:   2%|▏         | 1/50 [01:39<1:21:03, 99.26s/it]
                                                                                     

Best trial: 0. Best value: 0.861504:   2%|▏         | 1/50 [02:49<1:21:03, 99.26s/it]
Best trial: 0. Best value: 0.861504:   2%|▏         | 1/50 [02:49<1:21:03, 99.26s/it]
Best trial: 0. Best value: 0.861504:   4%|▍         | 2/50 [02:49<1:05:50, 82.30s/it]
                                                                                     

Best trial: 0. Best value: 0.861504:   4%|▍         | 2/50 [04:31<1:05:50, 82.30s/it]
Best trial: 0. Best value: 0.861504:   4%|▍         | 2/50 [04:31<1:05:50, 82.30s/it]
Best trial: 0. Best value: 0.861504:   6%|▌         | 3/50 [04:31<1:11:32, 91.32s/it]
                                                                                     

Best trial: 0. Best value: 0.861504:   6%|▌         | 3/50 [07:18<1:11:32, 91.32s/it]
Best trial: 3. Best value: 0.930682:   6%|▌         | 3/50 [07:19<1:11:32, 91.32s/it]
Best trial: 3. Best value: 0.930682:   8%|▊         | 4/50 [07:19<1:33:00, 121.31s/it]
                                                                                      

Best trial: 3. Best value: 0.930682:   8%|▊         | 4/50 [08:50<1:33:00, 121.31s/it]
Best trial: 3. Best value: 0.930682:   8%|▊         | 4/50 [08:50<1:33:00, 121.31s/it]
Best trial: 3. Best value: 0.930682:  10%|█         | 5/50 [08:50<1:22:57, 110.62s/it]
                                                                                      

Best trial: 3. Best value: 0.930682:  10%|█         | 5/50 [09:37<1:22:57, 110.62s/it]
Best trial: 3. Best value: 0.930682:  10%|█         | 5/50 [09:38<1:22:57, 110.62s/it]
Best trial: 3. Best value: 0.930682:  12%|█▏        | 6/50 [09:38<1:05:22, 89.14s/it] 
                                                                                     

Best trial: 3. Best value: 0.930682:  12%|█▏        | 6/50 [10:38<1:05:22, 89.14s/it]
Best trial: 3. Best value: 0.930682:  12%|█▏        | 6/50 [10:38<1:05:22, 89.14s/it]
Best trial: 3. Best value: 0.930682:  14%|█▍        | 7/50 [10:38<57:11, 79.80s/it]  
                                                                                   

Best trial: 3. Best value: 0.930682:  14%|█▍        | 7/50 [11:31<57:11, 79.80s/it]
Best trial: 3. Best value: 0.930682:  14%|█▍        | 7/50 [11:31<57:11, 79.80s/it]
Best trial: 3. Best value: 0.930682:  16%|█▌        | 8/50 [11:31<49:46, 71.11s/it]
                                                                                   

Best trial: 3. Best value: 0.930682:  16%|█▌        | 8/50 [12:37<49:46, 71.11s/it]
Best trial: 3. Best value: 0.930682:  16%|█▌        | 8/50 [12:37<49:46, 71.11s/it]
Best trial: 3. Best value: 0.930682:  18%|█▊        | 9/50 [12:37<47:32, 69.58s/it]
                                                                                   
Early stopping occurred at epoch 50 with best_epoch = 20 and best_val_0_logloss = 0.48622

Early stopping occurred at epoch 86 with best_epoch = 56 and best_val_0_logloss = 0.24547

Early stopping occurred at epoch 54 with best_epoch = 24 and best_val_0_logloss = 0.64145

Early stopping occurred at epoch 85 with best_epoch = 55 and best_val_0_logloss = 0.33854

Early stopping occurred at epoch 61 with best_epoch = 31 and best_val_0_logloss = 0.2196
