Best trial: 3. Best value: 0.930682:  63%|██████▎   | 19/30 [32:32<23:27, 127.98s/it][I 2025-07-28 21:59:55,918] Trial 9 finished with value: 0.865974569987771 and parameters: {'n_d': 64, 'batch_size': 512, 'virtual_bs_ratio': 0.25, 'n_steps': 3, 'gamma': 1.2, 'lambda_sparse': 0.0006741074265640696, 'lr': 0.003001994695240296, 'weight_decay': 0.00010903884523201111, 'mask_type': 'sparsemax', 'cat_emb_dim': 3}. Best is trial 3 with value: 0.9306822995103655.

Early stopping occurred at epoch 84 with best_epoch = 54 and best_val_0_logloss = 0.40201

Early stopping occurred at epoch 69 with best_epoch = 39 and best_val_0_logloss = 0.33847

Early stopping occurred at epoch 59 with best_epoch = 29 and best_val_0_logloss = 0.41582

Early stopping occurred at epoch 79 with best_epoch = 49 and best_val_0_logloss = 0.3896

Early stopping occurred at epoch 87 with best_epoch = 57 and best_val_0_logloss = 0.26807
[I 2025-07-28 22:01:12,303] Trial 10 finished with value: 0.8622538012963995 and parameters: {'n_d': 64, 'batch_size': 1024, 'virtual_bs_ratio': 0.25, 'n_steps': 4, 'gamma': 1.3, 'lambda_sparse': 1.4270403521460853e-06, 'lr': 0.00257985094645041, 'weight_decay': 0.0006554382343546282, 'mask_type': 'sparsemax', 'cat_emb_dim': 2}. Best is trial 3 with value: 0.9306822995103655.

Early stopping occurred at epoch 103 with best_epoch = 73 and best_val_0_logloss = 0.40793

Early stopping occurred at epoch 55 with best_epoch = 25 and best_val_0_logloss = 0.49318

Early stopping occurred at epoch 57 with best_epoch = 27 and best_val_0_logloss = 0.71127

Early stopping occurred at epoch 133 with best_epoch = 103 and best_val_0_logloss = 0.42748

Early stopping occurred at epoch 61 with best_epoch = 31 and best_val_0_logloss = 0.38719
[I 2025-07-28 22:01:55,753] Trial 11 finished with value: 0.6782976105467471 and parameters: {'n_d': 64, 'batch_size': 2048, 'virtual_bs_ratio': 0.5, 'n_steps': 4, 'gamma': 1.3, 'lambda_sparse': 7.954064937683937e-05, 'lr': 0.006185918211556435, 'weight_decay': 1.5155823539597614e-05, 'mask_type': 'sparsemax', 'cat_emb_dim': 1}. Best is trial 3 with value: 0.9306822995103655.

Early stopping occurred at epoch 101 with best_epoch = 71 and best_val_0_logloss = 0.49385
Stop training because you reached max_epochs = 200 with best_epoch = 194 and best_val_0_logloss = 0.20057

Early stopping occurred at epoch 66 with best_epoch = 36 and best_val_0_logloss = 0.64258

Early stopping occurred at epoch 56 with best_epoch = 26 and best_val_0_logloss = 0.71608

Early stopping occurred at epoch 109 with best_epoch = 79 and best_val_0_logloss = 0.25841
[I 2025-07-28 22:03:37,159] Trial 12 finished with value: 0.8265871844548907 and parameters: {'n_d': 16, 'batch_size': 1024, 'virtual_bs_ratio': 0.25, 'n_steps': 4, 'gamma': 1.1, 'lambda_sparse': 0.00011825328508422651, 'lr': 0.003726104236509948, 'weight_decay': 0.0007472397689332936, 'mask_type': 'entmax', 'cat_emb_dim': 1}. Best is trial 3 with value: 0.9306822995103655.

Early stopping occurred at epoch 47 with best_epoch = 17 and best_val_0_logloss = 0.3045

Early stopping occurred at epoch 187 with best_epoch = 157 and best_val_0_logloss = 0.08138

Early stopping occurred at epoch 78 with best_epoch = 48 and best_val_0_logloss = 0.26581

Early stopping occurred at epoch 122 with best_epoch = 92 and best_val_0_logloss = 0.18475

Early stopping occurred at epoch 78 with best_epoch = 48 and best_val_0_logloss = 0.14747
[I 2025-07-28 22:06:34,605] Trial 13 finished with value: 0.9000659850022122 and parameters: {'n_d': 64, 'batch_size': 512, 'virtual_bs_ratio': 0.25, 'n_steps': 4, 'gamma': 1.1, 'lambda_sparse': 1.902428324748959e-06, 'lr': 0.02114932281416455, 'weight_decay': 0.0006321732490144021, 'mask_type': 'sparsemax', 'cat_emb_dim': 2}. Best is trial 3 with value: 0.9306822995103655.

Early stopping occurred at epoch 130 with best_epoch = 100 and best_val_0_logloss = 0.72164
Stop training because you reached max_epochs = 200 with best_epoch = 185 and best_val_0_logloss = 0.30746

Early stopping occurred at epoch 68 with best_epoch = 38 and best_val_0_logloss = 0.76803

Early stopping occurred at epoch 107 with best_epoch = 77 and best_val_0_logloss = 0.34178

Early stopping occurred at epoch 117 with best_epoch = 87 and best_val_0_logloss = 0.29226
[I 2025-07-28 22:09:32,996] Trial 14 finished with value: 0.8405233656841608 and parameters: {'n_d': 48, 'batch_size': 512, 'virtual_bs_ratio': 0.25, 'n_steps': 3, 'gamma': 1.5, 'lambda_sparse': 6.596099207886096e-05, 'lr': 0.0010317753795327884, 'weight_decay': 1.5956700210656615e-05, 'mask_type': 'sparsemax', 'cat_emb_dim': 1}. Best is trial 3 with value: 0.9306822995103655.

Early stopping occurred at epoch 78 with best_epoch = 48 and best_val_0_logloss = 0.22294

Early stopping occurred at epoch 111 with best_epoch = 81 and best_val_0_logloss = 0.18424

Early stopping occurred at epoch 53 with best_epoch = 23 and best_val_0_logloss = 0.35785

Early stopping occurred at epoch 73 with best_epoch = 43 and best_val_0_logloss = 0.2308

Early stopping occurred at epoch 75 with best_epoch = 45 and best_val_0_logloss = 0.14917
[I 2025-07-28 22:11:54,292] Trial 15 finished with value: 0.917253561622624 and parameters: {'n_d': 32, 'batch_size': 512, 'virtual_bs_ratio': 0.5, 'n_steps': 5, 'gamma': 1.2, 'lambda_sparse': 0.0005284384205738843, 'lr': 0.028348557934720253, 'weight_decay': 4.47608582981903e-05, 'mask_type': 'entmax', 'cat_emb_dim': 3}. Best is trial 3 with value: 0.9306822995103655.

Early stopping occurred at epoch 62 with best_epoch = 32 and best_val_0_logloss = 0.30357

Early stopping occurred at epoch 79 with best_epoch = 49 and best_val_0_logloss = 0.29083

Early stopping occurred at epoch 90 with best_epoch = 60 and best_val_0_logloss = 0.16479

Early stopping occurred at epoch 96 with best_epoch = 66 and best_val_0_logloss = 0.22096

Early stopping occurred at epoch 80 with best_epoch = 50 and best_val_0_logloss = 0.21013
[I 2025-07-28 22:13:56,668] Trial 16 finished with value: 0.9188446798120594 and parameters: {'n_d': 32, 'batch_size': 512, 'virtual_bs_ratio': 0.5, 'n_steps': 4, 'gamma': 1.2, 'lambda_sparse': 0.0007874906755535074, 'lr': 0.02949317608247478, 'weight_decay': 0.0001525342151796965, 'mask_type': 'entmax', 'cat_emb_dim': 3}. Best is trial 3 with value: 0.9306822995103655.

Early stopping occurred at epoch 58 with best_epoch = 28 and best_val_0_logloss = 0.27818

Early stopping occurred at epoch 176 with best_epoch = 146 and best_val_0_logloss = 0.13383

Early stopping occurred at epoch 90 with best_epoch = 60 and best_val_0_logloss = 0.24009

Early stopping occurred at epoch 101 with best_epoch = 71 and best_val_0_logloss = 0.20948

Early stopping occurred at epoch 66 with best_epoch = 36 and best_val_0_logloss = 0.24
[I 2025-07-28 22:16:24,854] Trial 17 finished with value: 0.9222185786637693 and parameters: {'n_d': 32, 'batch_size': 512, 'virtual_bs_ratio': 0.5, 'n_steps': 4, 'gamma': 1.1, 'lambda_sparse': 0.0009360707472765235, 'lr': 0.01226569690877057, 'weight_decay': 0.00019480005358814734, 'mask_type': 'entmax', 'cat_emb_dim': 3}. Best is trial 3 with value: 0.9306822995103655.

Early stopping occurred at epoch 63 with best_epoch = 33 and best_val_0_logloss = 0.23042

Early stopping occurred at epoch 98 with best_epoch = 68 and best_val_0_logloss = 0.18053

Early stopping occurred at epoch 71 with best_epoch = 41 and best_val_0_logloss = 0.28342

Early stopping occurred at epoch 70 with best_epoch = 40 and best_val_0_logloss = 0.15198

Early stopping occurred at epoch 70 with best_epoch = 40 and best_val_0_logloss = 0.18677
[I 2025-07-28 22:18:16,286] Trial 18 finished with value: 0.9144039598289948 and parameters: {'n_d': 48, 'batch_size': 512, 'virtual_bs_ratio': 0.5, 'n_steps': 4, 'gamma': 1.0, 'lambda_sparse': 0.0002795669459715809, 'lr': 0.010656807302676586, 'weight_decay': 0.00033321033336416837, 'mask_type': 'entmax', 'cat_emb_dim': 3}. Best is trial 3 with value: 0.9306822995103655.

Early stopping occurred at epoch 89 with best_epoch = 59 and best_val_0_logloss = 0.14651

Early stopping occurred at epoch 63 with best_epoch = 33 and best_val_0_logloss = 0.19886

Early stopping occurred at epoch 106 with best_epoch = 76 and best_val_0_logloss = 0.28525

                                                                                     

Best trial: 3. Best value: 0.930682:  63%|██████▎   | 19/30 [34:56<23:27, 127.98s/it]
Best trial: 3. Best value: 0.930682:  63%|██████▎   | 19/30 [34:56<23:27, 127.98s/it]
Best trial: 3. Best value: 0.930682:  67%|██████▋   | 20/30 [34:56<22:09, 132.97s/it]
                                                                                     

Best trial: 3. Best value: 0.930682:  67%|██████▋   | 20/30 [36:46<22:09, 132.97s/it]
Best trial: 3. Best value: 0.930682:  67%|██████▋   | 20/30 [36:47<22:09, 132.97s/it]
Best trial: 3. Best value: 0.930682:  70%|███████   | 21/30 [36:47<18:55, 126.15s/it]
                                                                                     

Best trial: 3. Best value: 0.930682:  70%|███████   | 21/30 [39:07<18:55, 126.15s/it]
Best trial: 3. Best value: 0.930682:  70%|███████   | 21/30 [39:07<18:55, 126.15s/it]
Best trial: 3. Best value: 0.930682:  73%|███████▎  | 22/30 [39:07<17:23, 130.47s/it]
                                                                                     

Best trial: 3. Best value: 0.930682:  73%|███████▎  | 22/30 [41:32<17:23, 130.47s/it]
Best trial: 3. Best value: 0.930682:  73%|███████▎  | 22/30 [41:32<17:23, 130.47s/it]
Best trial: 3. Best value: 0.930682:  77%|███████▋  | 23/30 [41:32<15:44, 134.95s/it]
                                                                                     

Best trial: 3. Best value: 0.930682:  77%|███████▋  | 23/30 [44:09<15:44, 134.95s/it]
Best trial: 3. Best value: 0.930682:  77%|███████▋  | 23/30 [44:09<15:44, 134.95s/it]
Best trial: 3. Best value: 0.930682:  80%|████████  | 24/30 [44:09<14:08, 141.46s/it]
                                                                                     

Best trial: 3. Best value: 0.930682:  80%|████████  | 24/30 [46:49<14:08, 141.46s/it]
Best trial: 3. Best value: 0.930682:  80%|████████  | 24/30 [46:49<14:08, 141.46s/it]
Best trial: 3. Best value: 0.930682:  83%|████████▎ | 25/30 [46:49<12:15, 147.06s/it]
                                                                                     

Best trial: 3. Best value: 0.930682:  83%|████████▎ | 25/30 [48:41<12:15, 147.06s/it]
Best trial: 3. Best value: 0.930682:  83%|████████▎ | 25/30 [48:41<12:15, 147.06s/it]
Best trial: 3. Best value: 0.930682:  87%|████████▋ | 26/30 [48:41<09:06, 136.59s/it]
                                                                                     

Best trial: 3. Best value: 0.930682:  87%|████████▋ | 26/30 [50:32<09:06, 136.59s/it]
Best trial: 3. Best value: 0.930682:  87%|████████▋ | 26/30 [50:32<09:06, 136.59s/it]
Best trial: 3. Best value: 0.930682:  90%|█████████ | 27/30 [50:32<06:26, 128.82s/it]
                                                                                     

Best trial: 3. Best value: 0.930682:  90%|█████████ | 27/30 [53:10<06:26, 128.82s/it]
Best trial: 3. Best value: 0.930682:  90%|█████████ | 27/30 [53:11<06:26, 128.82s/it]
Best trial: 3. Best value: 0.930682:  93%|█████████▎| 28/30 [53:11<04:35, 137.72s/it]
                                                                                     

Best trial: 3. Best value: 0.930682:  93%|█████████▎| 28/30 [55:33<04:35, 137.72s/it]
Best trial: 3. Best value: 0.930682:  93%|█████████▎| 28/30 [55:33<04:35, 137.72s/it]
Best trial: 3. Best value: 0.930682:  97%|█████████▋| 29/30 [55:33<02:19, 139.17s/it]
Early stopping occurred at epoch 139 with best_epoch = 109 and best_val_0_logloss = 0.17163

Early stopping occurred at epoch 90 with best_epoch = 60 and best_val_0_logloss = 0.12402
[I 2025-07-28 22:20:40,879] Trial 19 finished with value: 0.9258827804855073 and parameters: {'n_d': 16, 'batch_size': 512, 'virtual_bs_ratio': 0.5, 'n_steps': 4, 'gamma': 1.1, 'lambda_sparse': 0.0009087926205193971, 'lr': 0.015412556546789467, 'weight_decay': 0.00020357185830788412, 'mask_type': 'entmax', 'cat_emb_dim': 3}. Best is trial 3 with value: 0.9306822995103655.

Early stopping occurred at epoch 74 with best_epoch = 44 and best_val_0_logloss = 0.41934

Early stopping occurred at epoch 78 with best_epoch = 48 and best_val_0_logloss = 0.23041

Early stopping occurred at epoch 111 with best_epoch = 81 and best_val_0_logloss = 0.33401

Early stopping occurred at epoch 99 with best_epoch = 69 and best_val_0_logloss = 0.25997

Early stopping occurred at epoch 84 with best_epoch = 54 and best_val_0_logloss = 0.1307
[I 2025-07-28 22:22:31,135] Trial 20 finished with value: 0.9070520185082236 and parameters: {'n_d': 16, 'batch_size': 512, 'virtual_bs_ratio': 0.5, 'n_steps': 3, 'gamma': 1.1, 'lambda_sparse': 3.622276198735819e-05, 'lr': 0.017382062178166277, 'weight_decay': 0.0009211424652405641, 'mask_type': 'entmax', 'cat_emb_dim': 3}. Best is trial 3 with value: 0.9306822995103655.

Early stopping occurred at epoch 91 with best_epoch = 61 and best_val_0_logloss = 0.13688

Early stopping occurred at epoch 138 with best_epoch = 108 and best_val_0_logloss = 0.12823

Early stopping occurred at epoch 61 with best_epoch = 31 and best_val_0_logloss = 0.41022

Early stopping occurred at epoch 114 with best_epoch = 84 and best_val_0_logloss = 0.21951

Early stopping occurred at epoch 59 with best_epoch = 29 and best_val_0_logloss = 0.16924
[I 2025-07-28 22:24:51,669] Trial 21 finished with value: 0.9268915819645815 and parameters: {'n_d': 16, 'batch_size': 512, 'virtual_bs_ratio': 0.5, 'n_steps': 4, 'gamma': 1.1, 'lambda_sparse': 0.0008752413956650714, 'lr': 0.01446296394209622, 'weight_decay': 0.00019371419749259823, 'mask_type': 'entmax', 'cat_emb_dim': 3}. Best is trial 3 with value: 0.9306822995103655.

Early stopping occurred at epoch 147 with best_epoch = 117 and best_val_0_logloss = 0.1326

Early stopping occurred at epoch 101 with best_epoch = 71 and best_val_0_logloss = 0.14803

Early stopping occurred at epoch 83 with best_epoch = 53 and best_val_0_logloss = 0.30154

Early stopping occurred at epoch 65 with best_epoch = 35 and best_val_0_logloss = 0.2861

Early stopping occurred at epoch 100 with best_epoch = 70 and best_val_0_logloss = 0.1267
[I 2025-07-28 22:27:17,050] Trial 22 finished with value: 0.9121562606351652 and parameters: {'n_d': 16, 'batch_size': 512, 'virtual_bs_ratio': 0.5, 'n_steps': 4, 'gamma': 1.0, 'lambda_sparse': 0.00042386382738686683, 'lr': 0.008609659749969802, 'weight_decay': 0.0003685234000494678, 'mask_type': 'entmax', 'cat_emb_dim': 3}. Best is trial 3 with value: 0.9306822995103655.

Early stopping occurred at epoch 95 with best_epoch = 65 and best_val_0_logloss = 0.27136

Early stopping occurred at epoch 102 with best_epoch = 72 and best_val_0_logloss = 0.16598

Early stopping occurred at epoch 132 with best_epoch = 102 and best_val_0_logloss = 0.22498

Early stopping occurred at epoch 111 with best_epoch = 81 and best_val_0_logloss = 0.15983

Early stopping occurred at epoch 94 with best_epoch = 64 and best_val_0_logloss = 0.11796
[I 2025-07-28 22:29:53,717] Trial 23 finished with value: 0.927536389156811 and parameters: {'n_d': 16, 'batch_size': 512, 'virtual_bs_ratio': 0.5, 'n_steps': 4, 'gamma': 1.1, 'lambda_sparse': 0.00037435032830527236, 'lr': 0.015616720882933706, 'weight_decay': 8.806188881581683e-05, 'mask_type': 'entmax', 'cat_emb_dim': 3}. Best is trial 3 with value: 0.9306822995103655.

Early stopping occurred at epoch 125 with best_epoch = 95 and best_val_0_logloss = 0.19353

Early stopping occurred at epoch 127 with best_epoch = 97 and best_val_0_logloss = 0.139

Early stopping occurred at epoch 99 with best_epoch = 69 and best_val_0_logloss = 0.27944

Early stopping occurred at epoch 128 with best_epoch = 98 and best_val_0_logloss = 0.14624

Early stopping occurred at epoch 62 with best_epoch = 32 and best_val_0_logloss = 0.22637
[I 2025-07-28 22:32:33,833] Trial 24 finished with value: 0.9206015895347068 and parameters: {'n_d': 16, 'batch_size': 512, 'virtual_bs_ratio': 0.5, 'n_steps': 4, 'gamma': 1.0, 'lambda_sparse': 0.0003663352508147543, 'lr': 0.008676303203799444, 'weight_decay': 6.923705784164284e-05, 'mask_type': 'entmax', 'cat_emb_dim': 3}. Best is trial 3 with value: 0.9306822995103655.

Early stopping occurred at epoch 100 with best_epoch = 70 and best_val_0_logloss = 0.17961

Early stopping occurred at epoch 74 with best_epoch = 44 and best_val_0_logloss = 0.19481

Early stopping occurred at epoch 49 with best_epoch = 19 and best_val_0_logloss = 0.27971

Early stopping occurred at epoch 80 with best_epoch = 50 and best_val_0_logloss = 0.25974

Early stopping occurred at epoch 62 with best_epoch = 32 and best_val_0_logloss = 0.16112
[I 2025-07-28 22:34:26,002] Trial 25 finished with value: 0.9151493491515696 and parameters: {'n_d': 32, 'batch_size': 512, 'virtual_bs_ratio': 0.5, 'n_steps': 4, 'gamma': 1.2, 'lambda_sparse': 0.0001544686180779086, 'lr': 0.02141219321819014, 'weight_decay': 0.00011598286459788766, 'mask_type': 'entmax', 'cat_emb_dim': 3}. Best is trial 3 with value: 0.9306822995103655.

Early stopping occurred at epoch 65 with best_epoch = 35 and best_val_0_logloss = 0.31459

Early stopping occurred at epoch 78 with best_epoch = 48 and best_val_0_logloss = 0.22447

Early stopping occurred at epoch 59 with best_epoch = 29 and best_val_0_logloss = 0.4058

Early stopping occurred at epoch 140 with best_epoch = 110 and best_val_0_logloss = 0.29404

Early stopping occurred at epoch 104 with best_epoch = 74 and best_val_0_logloss = 0.15194
[I 2025-07-28 22:36:16,698] Trial 26 finished with value: 0.8983157912736969 and parameters: {'n_d': 16, 'batch_size': 512, 'virtual_bs_ratio': 0.5, 'n_steps': 3, 'gamma': 1.1, 'lambda_sparse': 0.0004741576959477325, 'lr': 0.016099761562166845, 'weight_decay': 5.894859472152521e-05, 'mask_type': 'entmax', 'cat_emb_dim': 3}. Best is trial 3 with value: 0.9306822995103655.

Early stopping occurred at epoch 67 with best_epoch = 37 and best_val_0_logloss = 0.3548

Early stopping occurred at epoch 196 with best_epoch = 166 and best_val_0_logloss = 0.16082

Early stopping occurred at epoch 103 with best_epoch = 73 and best_val_0_logloss = 0.28736

Early stopping occurred at epoch 94 with best_epoch = 64 and best_val_0_logloss = 0.24984

Early stopping occurred at epoch 58 with best_epoch = 28 and best_val_0_logloss = 0.22501
[I 2025-07-28 22:38:55,169] Trial 27 finished with value: 0.8978798711974563 and parameters: {'n_d': 16, 'batch_size': 512, 'virtual_bs_ratio': 0.5, 'n_steps': 4, 'gamma': 1.1, 'lambda_sparse': 0.00021465808212791726, 'lr': 0.004817133183574748, 'weight_decay': 0.0004177147055336219, 'mask_type': 'entmax', 'cat_emb_dim': 3}. Best is trial 3 with value: 0.9306822995103655.

Early stopping occurred at epoch 76 with best_epoch = 46 and best_val_0_logloss = 0.26289

Early stopping occurred at epoch 104 with best_epoch = 74 and best_val_0_logloss = 0.1643

Early stopping occurred at epoch 159 with best_epoch = 129 and best_val_0_logloss = 0.19541

Early stopping occurred at epoch 70 with best_epoch = 40 and best_val_0_logloss = 0.33089

Early stopping occurred at epoch 76 with best_epoch = 46 and best_val_0_logloss = 0.12908
[I 2025-07-28 22:41:17,751] Trial 28 finished with value: 0.912219674361878 and parameters: {'n_d': 32, 'batch_size': 512, 'virtual_bs_ratio': 0.5, 'n_steps': 4, 'gamma': 1.2, 'lambda_sparse': 0.0009971787362150154, 'lr': 0.008802805560762354, 'weight_decay': 0.00012268871692225412, 'mask_type': 'sparsemax', 'cat_emb_dim': 2}. Best is trial 3 with value: 0.9306822995103655.

Early stopping occurred at epoch 54 with best_epoch = 24 and best_val_0_logloss = 0.37023

2025-07-28 22:42:26,408 - TabNetTrainer - WARNING - Trial 29 fold 3 failed: 

2025-07-28 22:42:50,965 - TabNetTrainer - WARNING - Trial 29 fold 4 failed: 

                                                                                     

Best trial: 3. Best value: 0.930682:  97%|█████████▋| 29/30 [57:06<02:19, 139.17s/it]
Best trial: 3. Best value: 0.930682:  97%|█████████▋| 29/30 [57:06<02:19, 139.17s/it]
Best trial: 3. Best value: 0.930682: 100%|██████████| 30/30 [57:06<00:00, 125.39s/it]
Best trial: 3. Best value: 0.930682: 100%|██████████| 30/30 [57:06<00:00, 114.23s/it]

2025-07-28 22:42:51,104 - TabNetTrainer - INFO - ✓ Optimization completed in 3426.9 seconds!

2025-07-28 22:42:51,104 - TabNetTrainer - INFO - Best F1-macro (CV): 0.9307 (±0.0222)

2025-07-28 22:42:51,105 - TabNetTrainer - INFO - Final model training with best hyperparameters...

2025-07-28 22:42:51,108 - TabNetTrainer - INFO - Training final TabNet model with optimized parameters...

Early stopping occurred at epoch 99 with best_epoch = 69 and best_val_0_logloss = 0.23439

Early stopping occurred at epoch 82 with best_epoch = 52 and best_val_0_logloss = 0.3671

Early stopping occurred at epoch 53 with best_epoch = 23 and best_val_0_logloss = 0.3333

Early stopping occurred at epoch 102 with best_epoch = 72 and best_val_0_logloss = 0.16005
