+ python main.py --compare --csv ../data/aims_dataset.csv --n-trials 50 --n-trials-tabnet 50

2025-07-29 05:41:12,356 - RandomForestTrainer - INFO - Starting Random Forest Training Pipeline...

2025-07-29 05:41:12,356 - RandomForestTrainer - INFO - Loading and preprocessing dataset from ../data/aims_dataset.csv ...

2025-07-29 05:41:12,494 - RandomForestTrainer - INFO - Applying Custom Weighted-Impact Labeling...

2025-07-29 05:41:12,919 - RandomForestTrainer - INFO - Splitting data into temporal-aware training and holdout sets...

2025-07-29 05:41:12,925 - RandomForestTrainer - INFO - Setting up output directory...

2025-07-29 05:41:14,584 - RandomForestTrainer - INFO - Creating base model pipeline...

2025-07-29 05:41:14,584 - RandomForestTrainer - INFO - Configure and Run Hyperparameter Optimization (HPO) with Optuna ...
[I 2025-07-29 05:41:14,585] A new study created in memory with name: no-name-eac06bef-7af2-4e85-9d06-c0674dc2dc31

2025-07-29 05:41:14,585 - RandomForestTrainer - INFO - Starting Optuna optimization with 50 trials...
================================================================================
AIMS FRAMEWORK - MODEL TRAINING ORCHESTRATOR
================================================================================
Start Time: 2025-07-29 05:41:12
Dataset: ../data/aims_dataset.csv
Random State: 42
--------------------------------------------------------------------------------

[1/3] Training Random Forest Classifier...
------------------------------------------------------------

================================================================================
RANDOM FOREST TRAINING PIPELINE - AIMS FRAMEWORK
================================================================================
Configuration:
  - Dataset: ../data/aims_dataset.csv
  - CV Folds: 5
  - Optuna Trials: 50
  - Random State: 42
  - Parallel Jobs: -1
================================================================================
------------------------------------------------------------
[Step 1/11] Loading and preprocessing dataset...
------------------------------------------------------------
✓ Raw dataset shape: (5400, 18)
✓ Preprocessed dataset shape: (5400, 25)
------------------------------------------------------------
[Step 2/11] Applying Custom Weighted-Impact Labeling...
------------------------------------------------------------
✓ Feature matrix shape : (5400, 25)
✓ Temporal groups      : 25
✓ Impact distribution :
   count  percent (%)
0    768        14.22
1   1013        18.76
2   2715        50.28
3    904        16.74
------------------------------------------------------------
[Step 3/11] Splitting data into temporal-aware training and holdout sets...
------------------------------------------------------------
✓ Numerical features: 20
✓ Categorical features: 5
✓ Training set : 4576 samples (84.7%)
✓ Holdout set  : 824 samples (15.3%)
------------------------------------------------------------
[Step 4/11] Setting up output directory...
------------------------------------------------------------
✓ Results will be saved to: /results/random_forest
✓ Saving artifact files (features, labels, groups, and class weights)...
✓ Features, labels, groups, and class weights saved.
------------------------------------------------------------
[Step 5/11] Creating base model pipeline...
------------------------------------------------------------
✓ Base model pipeline created: Preprocessor → RandomForestClassifier
------------------------------------------------------------
[Step 6/11] Configure and Run Hyperparameter Optimization (HPO) with Optuna ...
------------------------------------------------------------
Starting Optuna optimization with 50 trials...

  0%|          | 0/50 [00:00<?, ?it/s]
                                      

  0%|          | 0/50 [00:09<?, ?it/s]
Best trial: 0. Best value: 0.981586:   0%|          | 0/50 [00:09<?, ?it/s]
Best trial: 0. Best value: 0.981586:   2%|▏         | 1/50 [00:09<08:05,  9.91s/it]
                                                                                   

Best trial: 0. Best value: 0.981586:   2%|▏         | 1/50 [00:36<08:05,  9.91s/it]
Best trial: 0. Best value: 0.981586:   2%|▏         | 1/50 [00:37<08:05,  9.91s/it]
Best trial: 0. Best value: 0.981586:   4%|▍         | 2/50 [00:37<16:02, 20.05s/it]
                                                                                   

Best trial: 0. Best value: 0.981586:   4%|▍         | 2/50 [00:49<16:02, 20.05s/it]
Best trial: 0. Best value: 0.981586:   4%|▍         | 2/50 [00:49<16:02, 20.05s/it]
Best trial: 0. Best value: 0.981586:   6%|▌         | 3/50 [00:49<13:05, 16.71s/it]
                                                                                   

Best trial: 0. Best value: 0.981586:   6%|▌         | 3/50 [01:06<13:05, 16.71s/it]
Best trial: 3. Best value: 0.982002:   6%|▌         | 3/50 [01:06<13:05, 16.71s/it]
Best trial: 3. Best value: 0.982002:   8%|▊         | 4/50 [01:06<12:48, 16.71s/it]
                                                                                   

Best trial: 3. Best value: 0.982002:   8%|▊         | 4/50 [01:15<12:48, 16.71s/it]
Best trial: 3. Best value: 0.982002:   8%|▊         | 4/50 [01:16<12:48, 16.71s/it]
Best trial: 3. Best value: 0.982002:  10%|█         | 5/50 [01:16<10:35, 14.12s/it]
                                                                                   

Best trial: 3. Best value: 0.982002:  10%|█         | 5/50 [01:34<10:35, 14.12s/it]
Best trial: 3. Best value: 0.982002:  10%|█         | 5/50 [01:34<10:35, 14.12s/it]
Best trial: 3. Best value: 0.982002:  12%|█▏        | 6/50 [01:34<11:27, 15.63s/it]
                                                                                   

Best trial: 3. Best value: 0.982002:  12%|█▏        | 6/50 [01:56<11:27, 15.63s/it]
Best trial: 3. Best value: 0.982002:  12%|█▏        | 6/50 [01:57<11:27, 15.63s/it]
Best trial: 3. Best value: 0.982002:  14%|█▍        | 7/50 [01:57<12:47, 17.85s/it]
                                                                                   

Best trial: 3. Best value: 0.982002:  14%|█▍        | 7/50 [02:01<12:47, 17.85s/it]
Best trial: 3. Best value: 0.982002:  14%|█▍        | 7/50 [02:01<12:47, 17.85s/it]
Best trial: 3. Best value: 0.982002:  16%|█▌        | 8/50 [02:01<09:37, 13.75s/it]
                                                                                   

Best trial: 3. Best value: 0.982002:  16%|█▌        | 8/50 [02:06<09:37, 13.75s/it]
Best trial: 3. Best value: 0.982002:  16%|█▌        | 8/50 [02:06<09:37, 13.75s/it]
Best trial: 3. Best value: 0.982002:  18%|█▊        | 9/50 [02:06<07:29, 10.97s/it]
                                                                                   

Best trial: 3. Best value: 0.982002:  18%|█▊        | 9/50 [02:22<07:29, 10.97s/it]
Best trial: 3. Best value: 0.982002:  18%|█▊        | 9/50 [02:22<07:29, 10.97s/it]
Best trial: 3. Best value: 0.982002:  20%|██        | 10/50 [02:22<08:16, 12.41s/it]
                                                                                    

Best trial: 3. Best value: 0.982002:  20%|██        | 10/50 [02:38<08:16, 12.41s/it]
Best trial: 3. Best value: 0.982002:  20%|██        | 10/50 [02:38<08:16, 12.41s/it]
Best trial: 3. Best value: 0.982002:  22%|██▏       | 11/50 [02:38<08:47, 13.54s/it]
                                                                                    

Best trial: 3. Best value: 0.982002:  22%|██▏       | 11/50 [02:57<08:47, 13.54s/it]
Best trial: 3. Best value: 0.982002:  22%|██▏       | 11/50 [02:57<08:47, 13.54s/it]
Best trial: 3. Best value: 0.982002:  24%|██▍       | 12/50 [02:57<09:40, 15.26s/it]
                                                                                    

Best trial: 3. Best value: 0.982002:  24%|██▍       | 12/50 [03:04<09:40, 15.26s/it]
Best trial: 3. Best value: 0.982002:  24%|██▍       | 12/50 [03:04<09:40, 15.26s/it]
Best trial: 3. Best value: 0.982002:  26%|██▌       | 13/50 [03:04<07:48, 12.66s/it]
                                                                                    

Best trial: 3. Best value: 0.982002:  26%|██▌       | 13/50 [03:17<07:48, 12.66s/it]
Best trial: 3. Best value: 0.982002:  26%|██▌       | 13/50 [03:17<07:48, 12.66s/it]
Best trial: 3. Best value: 0.982002:  28%|██▊       | 14/50 [03:17<07:35, 12.66s/it]
                                                                                    

Best trial: 3. Best value: 0.982002:  28%|██▊       | 14/50 [03:35<07:35, 12.66s/it]
Best trial: 3. Best value: 0.982002:  28%|██▊       | 14/50 [03:35<07:35, 12.66s/it]
Best trial: 3. Best value: 0.982002:  30%|███       | 15/50 [03:35<08:22, 14.35s/it]
                                                                                    

Best trial: 3. Best value: 0.982002:  30%|███       | 15/50 [04:00<08:22, 14.35s/it]
Best trial: 3. Best value: 0.982002:  30%|███       | 15/50 [04:00<08:22, 14.35s/it]
Best trial: 3. Best value: 0.982002:  32%|███▏      | 16/50 [04:00<10:01, 17.69s/it]
                                                                                    

Best trial: 3. Best value: 0.982002:  32%|███▏      | 16/50 [04:16<10:01, 17.69s/it]
Best trial: 3. Best value: 0.982002:  32%|███▏      | 16/50 [04:16<10:01, 17.69s/it]
Best trial: 3. Best value: 0.982002:  34%|███▍      | 17/50 [04:16<09:24, 17.10s/it]
                                                                                    

Best trial: 3. Best value: 0.982002:  34%|███▍      | 17/50 [04:28<09:24, 17.10s/it]
Best trial: 3. Best value: 0.982002:  34%|███▍      | 17/50 [04:29<09:24, 17.10s/it]
Best trial: 3. Best value: 0.982002:  36%|███▌      | 18/50 [04:29<08:22, 15.72s/it]
                                                                                    

Best trial: 3. Best value: 0.982002:  36%|███▌      | 18/50 [04:30<08:22, 15.72s/it]
Best trial: 3. Best value: 0.982002:  36%|███▌      | 18/50 [04:30<08:22, 15.72s/it]
Best trial: 3. Best value: 0.982002:  38%|███▊      | 19/50 [04:30<05:58, 11.55s/it]
                                                                                    

Best trial: 3. Best value: 0.982002:  38%|███▊      | 19/50 [04:35<05:58, 11.55s/it]
Best trial: 3. Best value: 0.982002:  38%|███▊      | 19/50 [04:35<05:58, 11.55s/it]
Best trial: 3. Best value: 0.982002:  40%|████      | 20/50 [04:35<04:44,  9.50s/it]
                                                                                    

Best trial: 3. Best value: 0.982002:  40%|████      | 20/50 [04:48<04:44,  9.50s/it]
Best trial: 3. Best value: 0.982002:  40%|████      | 20/50 [04:48<04:44,  9.50s/it]
Best trial: 3. Best value: 0.982002:  42%|████▏     | 21/50 [04:48<05:06, 10.56s/it]
                                                                                    

Best trial: 3. Best value: 0.982002:  42%|████▏     | 21/50 [05:10<05:06, 10.56s/it]
Best trial: 3. Best value: 0.982002:  42%|████▏     | 21/50 [05:10<05:06, 10.56s/it]
Best trial: 3. Best value: 0.982002:  44%|████▍     | 22/50 [05:10<06:33, 14.05s/it]
                                                                                    

Best trial: 3. Best value: 0.982002:  44%|████▍     | 22/50 [05:26<06:33, 14.05s/it]
Best trial: 3. Best value: 0.982002:  44%|████▍     | 22/50 [05:26<06:33, 14.05s/it]
Best trial: 3. Best value: 0.982002:  46%|████▌     | 23/50 [05:26<06:35, 14.65s/it]
                                                                                    

Best trial: 3. Best value: 0.982002:  46%|████▌     | 23/50 [05:49<06:35, 14.65s/it]
Best trial: 3. Best value: 0.982002:  46%|████▌     | 23/50 [05:49<06:35, 14.65s/it]
Best trial: 3. Best value: 0.982002:  48%|████▊     | 24/50 [05:49<07:20, 16.96s/it]
                                                                                    

Best trial: 3. Best value: 0.982002:  48%|████▊     | 24/50 [06:08<07:20, 16.96s/it]
Best trial: 3. Best value: 0.982002:  48%|████▊     | 24/50 [06:08<07:20, 16.96s/it]
Best trial: 3. Best value: 0.982002:  50%|█████     | 25/50 [06:08<07:20, 17.63s/it]
                                                                                    

Best trial: 3. Best value: 0.982002:  50%|█████     | 25/50 [06:27<07:20, 17.63s/it]
Best trial: 3. Best value: 0.982002:  50%|█████     | 25/50 [06:27<07:20, 17.63s/it]
Best trial: 3. Best value: 0.982002:  52%|█████▏    | 26/50 [06:27<07:14, 18.09s/it]
                                                                                    

Best trial: 3. Best value: 0.982002:  52%|█████▏    | 26/50 [06:32<07:14, 18.09s/it]
Best trial: 3. Best value: 0.982002:  52%|█████▏    | 26/50 [06:32<07:14, 18.09s/it]
Best trial: 3. Best value: 0.982002:  54%|█████▍    | 27/50 [06:32<05:25, 14.15s/it]
                                                                                    

Best trial: 3. Best value: 0.982002:  54%|█████▍    | 27/50 [07:04<05:25, 14.15s/it]
Best trial: 3. Best value: 0.982002:  54%|█████▍    | 27/50 [07:04<05:25, 14.15s/it]
Best trial: 3. Best value: 0.982002:  56%|█████▌    | 28/50 [07:04<07:06, 19.41s/it]
                                                                                    

Best trial: 3. Best value: 0.982002:  56%|█████▌    | 28/50 [07:10<07:06, 19.41s/it]
Best trial: 3. Best value: 0.982002:  56%|█████▌    | 28/50 [07:10<07:06, 19.41s/it]
Best trial: 3. Best value: 0.982002:  58%|█████▊    | 29/50 [07:10<05:25, 15.49s/it]
                                                                                    

Best trial: 3. Best value: 0.982002:  58%|█████▊    | 29/50 [07:23<05:25, 15.49s/it]
Best trial: 3. Best value: 0.982002:  58%|█████▊    | 29/50 [07:23<05:25, 15.49s/it]
Best trial: 3. Best value: 0.982002:  60%|██████    | 30/50 [07:23<04:53, 14.67s/it]
                                                                                    

Best trial: 3. Best value: 0.982002:  60%|██████    | 30/50 [07:32<04:53, 14.67s/it]
Best trial: 3. Best value: 0.982002:  60%|██████    | 30/50 [07:32<04:53, 14.67s/it]
Best trial: 3. Best value: 0.982002:  62%|██████▏   | 31/50 [07:32<04:08, 13.10s/it]
                                                                                    

Best trial: 3. Best value: 0.982002:  62%|██████▏   | 31/50 [07:40<04:08, 13.10s/it]
Best trial: 3. Best value: 0.982002:  62%|██████▏   | 31/50 [07:40<04:08, 13.10s/it]
Best trial: 3. Best value: 0.982002:  64%|██████▍   | 32/50 [07:40<03:28, 11.60s/it]
                                                                                    

Best trial: 3. Best value: 0.982002:  64%|██████▍   | 32/50 [07:56<03:28, 11.60s/it]
Best trial: 3. Best value: 0.982002:  64%|██████▍   | 32/50 [07:56<03:28, 11.60s/it]
Best trial: 3. Best value: 0.982002:  66%|██████▌   | 33/50 [07:56<03:40, 12.95s/it]
                                                                                    

Best trial: 3. Best value: 0.982002:  66%|██████▌   | 33/50 [08:12<03:40, 12.95s/it]
Best trial: 3. Best value: 0.982002:  66%|██████▌   | 33/50 [08:13<03:40, 12.95s/it]
Best trial: 3. Best value: 0.982002:  68%|██████▊   | 34/50 [08:13<03:42, 13.89s/it]
                                                                                    

Best trial: 3. Best value: 0.982002:  68%|██████▊   | 34/50 [08:25<03:42, 13.89s/it]
Best trial: 3. Best value: 0.982002:  68%|██████▊   | 34/50 [08:25<03:42, 13.89s/it]
Best trial: 3. Best value: 0.982002:  70%|███████   | 35/50 [08:25<03:24, 13.60s/it]
                                                                                    

Best trial: 3. Best value: 0.982002:  70%|███████   | 35/50 [08:32<03:24, 13.60s/it]
Best trial: 3. Best value: 0.982002:  70%|███████   | 35/50 [08:32<03:24, 13.60s/it]
Best trial: 3. Best value: 0.982002:  72%|███████▏  | 36/50 [08:32<02:40, 11.46s/it]
                                                                                    
[I 2025-07-29 05:41:24,411] Trial 0 finished with value: 0.9815863628513164 and parameters: {'n_estimators': 300, 'max_depth': None, 'min_samples_leaf': 1, 'max_features': 0.5}. Best is trial 0 with value: 0.9815863628513164.
[I 2025-07-29 05:41:51,550] Trial 1 finished with value: 0.9789526389559473 and parameters: {'n_estimators': 600, 'max_depth': 10, 'min_samples_leaf': 1, 'max_features': 0.8}. Best is trial 0 with value: 0.9815863628513164.
[I 2025-07-29 05:42:04,290] Trial 2 finished with value: 0.9803581391760755 and parameters: {'n_estimators': 400, 'max_depth': 10, 'min_samples_leaf': 2, 'max_features': 0.5}. Best is trial 0 with value: 0.9815863628513164.
[I 2025-07-29 05:42:21,014] Trial 3 finished with value: 0.9820024999005295 and parameters: {'n_estimators': 500, 'max_depth': 20, 'min_samples_leaf': 1, 'max_features': 0.5}. Best is trial 3 with value: 0.9820024999005295.
[I 2025-07-29 05:42:30,535] Trial 4 finished with value: 0.9809656052597084 and parameters: {'n_estimators': 300, 'max_depth': 10, 'min_samples_leaf': 3, 'max_features': 0.5}. Best is trial 3 with value: 0.9820024999005295.
[I 2025-07-29 05:42:49,094] Trial 5 finished with value: 0.979432226306732 and parameters: {'n_estimators': 600, 'max_depth': 20, 'min_samples_leaf': 5, 'max_features': 0.5}. Best is trial 3 with value: 0.9820024999005295.
[I 2025-07-29 05:43:11,528] Trial 6 finished with value: 0.9813825597381263 and parameters: {'n_estimators': 500, 'max_depth': None, 'min_samples_leaf': 2, 'max_features': 0.8}. Best is trial 3 with value: 0.9820024999005295.
[I 2025-07-29 05:43:16,488] Trial 7 finished with value: 0.9721231090872227 and parameters: {'n_estimators': 300, 'max_depth': 30, 'min_samples_leaf': 1, 'max_features': 'sqrt'}. Best is trial 3 with value: 0.9820024999005295.
[I 2025-07-29 05:43:21,348] Trial 8 finished with value: 0.9788509115892785 and parameters: {'n_estimators': 100, 'max_depth': None, 'min_samples_leaf': 1, 'max_features': 0.8}. Best is trial 3 with value: 0.9820024999005295.
[I 2025-07-29 05:43:36,981] Trial 9 finished with value: 0.9791937640491017 and parameters: {'n_estimators': 500, 'max_depth': None, 'min_samples_leaf': 4, 'max_features': 0.5}. Best is trial 3 with value: 0.9820024999005295.
[I 2025-07-29 05:43:53,073] Trial 10 finished with value: 0.9820024999005295 and parameters: {'n_estimators': 500, 'max_depth': 20, 'min_samples_leaf': 1, 'max_features': 0.5}. Best is trial 3 with value: 0.9820024999005295.
[I 2025-07-29 05:44:12,291] Trial 11 finished with value: 0.9820024999005295 and parameters: {'n_estimators': 600, 'max_depth': 20, 'min_samples_leaf': 1, 'max_features': 0.5}. Best is trial 3 with value: 0.9820024999005295.
[I 2025-07-29 05:44:18,944] Trial 12 finished with value: 0.9787027396082921 and parameters: {'n_estimators': 200, 'max_depth': 20, 'min_samples_leaf': 1, 'max_features': 0.5}. Best is trial 3 with value: 0.9820024999005295.
[I 2025-07-29 05:44:31,601] Trial 13 finished with value: 0.9721672355654934 and parameters: {'n_estimators': 800, 'max_depth': 20, 'min_samples_leaf': 1, 'max_features': 'sqrt'}. Best is trial 3 with value: 0.9820024999005295.
[I 2025-07-29 05:44:49,878] Trial 14 finished with value: 0.9794074427421646 and parameters: {'n_estimators': 400, 'max_depth': 20, 'min_samples_leaf': 1, 'max_features': 0.8}. Best is trial 3 with value: 0.9820024999005295.
[I 2025-07-29 05:45:15,311] Trial 15 finished with value: 0.981702975547621 and parameters: {'n_estimators': 800, 'max_depth': 30, 'min_samples_leaf': 1, 'max_features': 0.5}. Best is trial 3 with value: 0.9820024999005295.
[I 2025-07-29 05:45:31,047] Trial 16 finished with value: 0.9808156340246915 and parameters: {'n_estimators': 500, 'max_depth': 20, 'min_samples_leaf': 3, 'max_features': 0.5}. Best is trial 3 with value: 0.9820024999005295.
[I 2025-07-29 05:45:43,542] Trial 17 finished with value: 0.9595070414313713 and parameters: {'n_estimators': 800, 'max_depth': None, 'min_samples_leaf': 4, 'max_features': 'sqrt'}. Best is trial 3 with value: 0.9820024999005295.
[I 2025-07-29 05:45:45,400] Trial 18 finished with value: 0.959873337200904 and parameters: {'n_estimators': 100, 'max_depth': None, 'min_samples_leaf': 4, 'max_features': 'sqrt'}. Best is trial 3 with value: 0.9820024999005295.
[I 2025-07-29 05:45:50,114] Trial 19 finished with value: 0.9789647060417839 and parameters: {'n_estimators': 100, 'max_depth': 30, 'min_samples_leaf': 4, 'max_features': 0.8}. Best is trial 3 with value: 0.9820024999005295.
[I 2025-07-29 05:46:03,158] Trial 20 finished with value: 0.980963122206177 and parameters: {'n_estimators': 400, 'max_depth': 30, 'min_samples_leaf': 1, 'max_features': 0.5}. Best is trial 3 with value: 0.9820024999005295.
[I 2025-07-29 05:46:25,334] Trial 21 finished with value: 0.9808734987742914 and parameters: {'n_estimators': 700, 'max_depth': 20, 'min_samples_leaf': 2, 'max_features': 0.5}. Best is trial 3 with value: 0.9820024999005295.
[I 2025-07-29 05:46:41,398] Trial 22 finished with value: 0.9820024999005295 and parameters: {'n_estimators': 500, 'max_depth': 20, 'min_samples_leaf': 1, 'max_features': 0.5}. Best is trial 3 with value: 0.9820024999005295.
[I 2025-07-29 05:47:03,738] Trial 23 finished with value: 0.9815804402737536 and parameters: {'n_estimators': 700, 'max_depth': 10, 'min_samples_leaf': 1, 'max_features': 0.5}. Best is trial 3 with value: 0.9820024999005295.
[I 2025-07-29 05:47:22,920] Trial 24 finished with value: 0.9820024999005295 and parameters: {'n_estimators': 600, 'max_depth': None, 'min_samples_leaf': 1, 'max_features': 0.5}. Best is trial 3 with value: 0.9820024999005295.
[I 2025-07-29 05:47:42,081] Trial 25 finished with value: 0.9820024999005295 and parameters: {'n_estimators': 600, 'max_depth': 20, 'min_samples_leaf': 1, 'max_features': 0.5}. Best is trial 3 with value: 0.9820024999005295.
