[I 2025-07-28 21:45:35,430] Trial 29 finished with value: 0.9807005564872879 and parameters: {'n_estimators': 400, 'max_depth': 20, 'min_samples_leaf': 2, 'max_features': 0.5}. Best is trial 3 with value: 0.9820024999005295.
✓ Optimization completed in 443.8 seconds!
Best trial: 3
Best parameters found:
  - n_estimators: 500
  - max_depth: 20
  - min_samples_leaf: 1
  - max_features: 0.5

Best F1-macro (CV): 0.9820 (±0.0059)
------------------------------------------------------------
[Step 7/11] Final model training with best hyperparameters...
------------------------------------------------------------
Starting final fitting...
✓ Final model fitting completed in 3.85 seconds!
✓ Final model saved to: /results/random_forest/random_forest_model.pkl
✓ Number of trees: 500
✓ Max depth: 20
------------------------------------------------------------
[Step 8/11] Evaluating final model on the holdout set and saving results...
------------------------------------------------------------

Classification Report:
              precision    recall  f1-score   support

    Adequate       1.00      0.99      0.99        71
     Warning       0.93      0.85      0.89       130
      Severe       0.94      0.97      0.95       445
    Critical       0.95      0.94      0.95       178

    accuracy                           0.95       824
   macro avg       0.96      0.94      0.95       824
weighted avg       0.95      0.95      0.95       824


Key Performance Indicators:
  • Overall Accuracy: 94.5%
  • Macro F1-Score: 94.6%
  • Weighted F1-Score: 94.5%

------------------------------------------------------------

2025-07-28 21:45:39,727 - RandomForestTrainer - INFO - Generating and saving visualizations...

2025-07-28 21:45:42,071 - RandomForestTrainer - INFO - All RANDOM FOREST visualizations and results saved to: /results/random_forest

2025-07-28 21:45:42,071 - RandomForestTrainer - INFO - RANDOM FOREST COMPLETED! Total execution time: 7.5 minutes

2025-07-28 21:45:42,071 - RandomForestTrainer - INFO - All results saved to: /results/random_forest. Generating summary...

2025-07-28 21:45:42,074 - TabNetTrainer - INFO - Starting TabNet Training Pipeline...

2025-07-28 21:45:42,074 - TabNetTrainer - INFO - Loading and preprocessing dataset from ../data/aims_dataset.csv ...

2025-07-28 21:45:42,174 - TabNetTrainer - INFO - Applying Custom Weighted-Impact Labeling...

2025-07-28 21:45:42,597 - TabNetTrainer - INFO - Splitting data into temporal‑aware training and hold‑out sets...

2025-07-28 21:45:42,630 - TabNetTrainer - INFO - Setting up output directory...

2025-07-28 21:45:42,794 - TabNetTrainer - INFO - Configure and Run Hyperparameter Optimization (HPO) with Optuna ...
[I 2025-07-28 21:45:42,795] A new study created in memory with name: no-name-51ff2542-4cda-4a8a-8bdb-589f751f7334

2025-07-28 21:45:42,795 - TabNetTrainer - INFO - CUDA-enabled GPU detected: Tesla T4 (14.6 GB). Setting task_type to 'GPU'.

2025-07-28 21:45:44,250 - TabNetTrainer - INFO - Starting Optuna optimization with 30 trials...
[Step 9/11] Save Results: CSV and JSON Files...
------------------------------------------------------------

Extracting feature importance...
✓ Feature importance saved to: /results/random_forest/feature_importances_rf.csv
Saving comprehensive results...
✓ Results successfully saved to: /results/random_forest/training_results_random_forest.json
------------------------------------------------------------
[Step 10/11] Generating and saving visualizations...
------------------------------------------------------------
✓ Confusion matrix plot saved: /results/random_forest/confusion_matrix_rf_raw.png
✓ Confusion matrix plot saved: /results/random_forest/confusion_matrix_rf_normalized.png
✓ Optuna optimization history saved: /results/random_forest/optuna_history_rf.html
Generating feature importance barplot...
✓ Feature importance barplot saved: /results/random_forest/feature_importance_rf.png
Generating cumulative feature importance plot...
✓ Cumulative feature importance plot saved: /results/random_forest/feature_importance_cumulative_rf.png


✓ All RANDOM FOREST visualizations and results saved to: /results/random_forest
------------------------------------------------------------
[Step 11/11] RANDOM FOREST COMPLETED! Total execution time: 7.5 minutes
All results saved to: /results/random_forest. Generating summary...
------------------------------------------------------------

================================================================================
RANDOMFOREST TRAINING SUMMARY
================================================================================
Model Library: scikit-learn v1.7.0
Data: 4576 train / 824 holdout
CV Score (Macro F1): 0.9820
Holdout Accuracy: 0.9454
Holdout Macro F1: 0.9462
Total Run Time: 449.5s
================================================================================
================================================================================
All results saved to: /results/random_forest
================================================================================

Total execution time: 7.5 minutes
✓ Random Forest training completed.

[2/3] Training TabNet Classifier...
------------------------------------------------------------

================================================================================
TABNET TRAINING PIPELINE - AIMS FRAMEWORK
================================================================================
Configuration:
  - Dataset: ../data/aims_dataset.csv
  - CV Folds: 5
  - Optuna Trials: 30
  - Random State: 42
================================================================================
------------------------------------------------------------
[Step 1/11] Loading and preprocessing dataset...
------------------------------------------------------------
✓ Raw dataset shape: (5400, 18)
✓ Preprocessed dataset shape: (5400, 25)
------------------------------------------------------------
[Step 2/11] Applying Custom Weighted-Impact Labeling...
------------------------------------------------------------
✓ Feature matrix shape : (5400, 25)
✓ Temporal groups      : 25
✓ Impact distribution :
   count  percent (%)
0    768        14.22
1   1013        18.76
2   2715        50.28
3    904        16.74
------------------------------------------------------------
[Step 3/11] Splitting data into temporal‑aware training and hold‑out sets...
------------------------------------------------------------
✓ Training set : 4576 samples (84.7 %)
✓ Hold‑out set : 824 samples (15.3 %)
✓ Numerical features: 20
✓ Categorical features: 5
------------------------------------------------------------
[Step 4/11] Setting up output directory...
------------------------------------------------------------
✓ Results will be saved to: /results/tabnet
✓ Saving artifact files (features, labels, groups, and class weights)...
✓ Features, labels, groups, and class weights saved.
------------------------------------------------------------
[Steps 5 & 6 /11] Configure and Run Tabnet Hyperparameter Optimization (HPO) with Optuna ...
------------------------------------------------------------
CUDA-enabled GPU detected: Tesla T4 (14.6 GB). Setting task_type to 'GPU'.
Starting Optuna optimization with 30 trials...

  0%|          | 0/30 [00:00<?, ?it/s]
                                      

  0%|          | 0/30 [01:37<?, ?it/s]
Best trial: 0. Best value: 0.861504:   0%|          | 0/30 [01:37<?, ?it/s]
Best trial: 0. Best value: 0.861504:   3%|▎         | 1/30 [01:37<47:05, 97.44s/it]
                                                                                   

Best trial: 0. Best value: 0.861504:   3%|▎         | 1/30 [02:49<47:05, 97.44s/it]
Best trial: 0. Best value: 0.861504:   3%|▎         | 1/30 [02:49<47:05, 97.44s/it]
Best trial: 0. Best value: 0.861504:   7%|▋         | 2/30 [02:49<38:33, 82.62s/it]
                                                                                   

Best trial: 0. Best value: 0.861504:   7%|▋         | 2/30 [04:33<38:33, 82.62s/it]
Best trial: 0. Best value: 0.861504:   7%|▋         | 2/30 [04:33<38:33, 82.62s/it]
Best trial: 0. Best value: 0.861504:  10%|█         | 3/30 [04:33<41:29, 92.20s/it]
                                                                                   

Best trial: 0. Best value: 0.861504:  10%|█         | 3/30 [07:26<41:29, 92.20s/it]
Best trial: 3. Best value: 0.930682:  10%|█         | 3/30 [07:26<41:29, 92.20s/it]
Best trial: 3. Best value: 0.930682:  13%|█▎        | 4/30 [07:26<53:52, 124.34s/it]
                                                                                    

Best trial: 3. Best value: 0.930682:  13%|█▎        | 4/30 [08:57<53:52, 124.34s/it]
Best trial: 3. Best value: 0.930682:  13%|█▎        | 4/30 [08:57<53:52, 124.34s/it]
Best trial: 3. Best value: 0.930682:  17%|█▋        | 5/30 [08:57<46:47, 112.28s/it]
                                                                                    

Best trial: 3. Best value: 0.930682:  17%|█▋        | 5/30 [09:46<46:47, 112.28s/it]
Best trial: 3. Best value: 0.930682:  17%|█▋        | 5/30 [09:46<46:47, 112.28s/it]
Best trial: 3. Best value: 0.930682:  20%|██        | 6/30 [09:46<36:18, 90.76s/it] 
                                                                                   

Best trial: 3. Best value: 0.930682:  20%|██        | 6/30 [10:45<36:18, 90.76s/it]
Best trial: 3. Best value: 0.930682:  20%|██        | 6/30 [10:45<36:18, 90.76s/it]
Best trial: 3. Best value: 0.930682:  23%|██▎       | 7/30 [10:45<30:47, 80.33s/it]
                                                                                   

Best trial: 3. Best value: 0.930682:  23%|██▎       | 7/30 [11:37<30:47, 80.33s/it]
Best trial: 3. Best value: 0.930682:  23%|██▎       | 7/30 [11:37<30:47, 80.33s/it]
Best trial: 3. Best value: 0.930682:  27%|██▋       | 8/30 [11:37<26:05, 71.17s/it]
                                                                                   

Best trial: 3. Best value: 0.930682:  27%|██▋       | 8/30 [12:35<26:05, 71.17s/it]
Best trial: 3. Best value: 0.930682:  27%|██▋       | 8/30 [12:35<26:05, 71.17s/it]
Best trial: 3. Best value: 0.930682:  30%|███       | 9/30 [12:35<23:29, 67.10s/it]
                                                                                   
Early stopping occurred at epoch 50 with best_epoch = 20 and best_val_0_logloss = 0.48622

Early stopping occurred at epoch 86 with best_epoch = 56 and best_val_0_logloss = 0.24547

Early stopping occurred at epoch 54 with best_epoch = 24 and best_val_0_logloss = 0.64145

Early stopping occurred at epoch 85 with best_epoch = 55 and best_val_0_logloss = 0.33854

Early stopping occurred at epoch 61 with best_epoch = 31 and best_val_0_logloss = 0.2196
[I 2025-07-28 21:47:21,556] Trial 0 finished with value: 0.8615035335832664 and parameters: {'n_d': 32, 'batch_size': 512, 'virtual_bs_ratio': 0.25, 'n_steps': 3, 'gamma': 1.5, 'lambda_sparse': 6.358358856676247e-05, 'lr': 0.01111498944309497, 'weight_decay': 1.0994335574766187e-05, 'mask_type': 'sparsemax', 'cat_emb_dim': 1}. Best is trial 0 with value: 0.8615035335832664.

Early stopping occurred at epoch 154 with best_epoch = 124 and best_val_0_logloss = 0.37681

Early stopping occurred at epoch 103 with best_epoch = 73 and best_val_0_logloss = 0.36618

Early stopping occurred at epoch 112 with best_epoch = 82 and best_val_0_logloss = 0.55279

Early stopping occurred at epoch 105 with best_epoch = 75 and best_val_0_logloss = 0.37628

Early stopping occurred at epoch 117 with best_epoch = 87 and best_val_0_logloss = 0.27702
[I 2025-07-28 21:48:33,830] Trial 1 finished with value: 0.8542075374559218 and parameters: {'n_d': 16, 'batch_size': 2048, 'virtual_bs_ratio': 0.25, 'n_steps': 4, 'gamma': 1.0, 'lambda_sparse': 7.523742884534855e-06, 'lr': 0.0034766491505926187, 'weight_decay': 8.168455894760161e-05, 'mask_type': 'sparsemax', 'cat_emb_dim': 2}. Best is trial 0 with value: 0.8615035335832664.

Early stopping occurred at epoch 57 with best_epoch = 27 and best_val_0_logloss = 0.50771

Early stopping occurred at epoch 140 with best_epoch = 110 and best_val_0_logloss = 0.35337

Early stopping occurred at epoch 120 with best_epoch = 90 and best_val_0_logloss = 0.49341

Early stopping occurred at epoch 70 with best_epoch = 40 and best_val_0_logloss = 0.57814

Early stopping occurred at epoch 125 with best_epoch = 95 and best_val_0_logloss = 0.37493
[I 2025-07-28 21:50:17,401] Trial 2 finished with value: 0.8316802431362091 and parameters: {'n_d': 48, 'batch_size': 1024, 'virtual_bs_ratio': 0.5, 'n_steps': 5, 'gamma': 1.4, 'lambda_sparse': 8.200518402245835e-06, 'lr': 0.0013940346079873232, 'weight_decay': 0.000233596350262616, 'mask_type': 'sparsemax', 'cat_emb_dim': 2}. Best is trial 0 with value: 0.8615035335832664.

Early stopping occurred at epoch 131 with best_epoch = 101 and best_val_0_logloss = 0.18337

Early stopping occurred at epoch 156 with best_epoch = 126 and best_val_0_logloss = 0.16342

Early stopping occurred at epoch 145 with best_epoch = 115 and best_val_0_logloss = 0.20296

Early stopping occurred at epoch 63 with best_epoch = 33 and best_val_0_logloss = 0.26922

Early stopping occurred at epoch 89 with best_epoch = 59 and best_val_0_logloss = 0.11371
[I 2025-07-28 21:53:11,017] Trial 3 finished with value: 0.9306822995103655 and parameters: {'n_d': 16, 'batch_size': 512, 'virtual_bs_ratio': 0.5, 'n_steps': 4, 'gamma': 1.1, 'lambda_sparse': 0.0008105016126411582, 'lr': 0.013962563737015753, 'weight_decay': 0.0007568292060167617, 'mask_type': 'sparsemax', 'cat_emb_dim': 3}. Best is trial 3 with value: 0.9306822995103655.

Early stopping occurred at epoch 136 with best_epoch = 106 and best_val_0_logloss = 0.29639
Stop training because you reached max_epochs = 200 with best_epoch = 199 and best_val_0_logloss = 0.23428

Early stopping occurred at epoch 160 with best_epoch = 130 and best_val_0_logloss = 0.44291

Early stopping occurred at epoch 62 with best_epoch = 32 and best_val_0_logloss = 0.46917

Early stopping occurred at epoch 135 with best_epoch = 105 and best_val_0_logloss = 0.20895
[I 2025-07-28 21:54:41,906] Trial 4 finished with value: 0.8885314855388105 and parameters: {'n_d': 16, 'batch_size': 2048, 'virtual_bs_ratio': 0.25, 'n_steps': 5, 'gamma': 1.2, 'lambda_sparse': 6.963114377829292e-06, 'lr': 0.006333268775321841, 'weight_decay': 1.913588048769229e-05, 'mask_type': 'sparsemax', 'cat_emb_dim': 3}. Best is trial 3 with value: 0.9306822995103655.

Early stopping occurred at epoch 61 with best_epoch = 31 and best_val_0_logloss = 0.56471

Early stopping occurred at epoch 89 with best_epoch = 59 and best_val_0_logloss = 0.43877

Early stopping occurred at epoch 74 with best_epoch = 44 and best_val_0_logloss = 0.58206

Early stopping occurred at epoch 84 with best_epoch = 54 and best_val_0_logloss = 0.48003

Early stopping occurred at epoch 92 with best_epoch = 62 and best_val_0_logloss = 0.25533
[I 2025-07-28 21:55:30,889] Trial 5 finished with value: 0.8270657916989614 and parameters: {'n_d': 64, 'batch_size': 2048, 'virtual_bs_ratio': 0.5, 'n_steps': 5, 'gamma': 1.0, 'lambda_sparse': 1.1895896737553539e-05, 'lr': 0.0014830392684568009, 'weight_decay': 0.0005323617594751496, 'mask_type': 'sparsemax', 'cat_emb_dim': 1}. Best is trial 3 with value: 0.9306822995103655.

Early stopping occurred at epoch 48 with best_epoch = 18 and best_val_0_logloss = 0.47888

Early stopping occurred at epoch 131 with best_epoch = 101 and best_val_0_logloss = 0.2588

Early stopping occurred at epoch 53 with best_epoch = 23 and best_val_0_logloss = 0.61057

Early stopping occurred at epoch 57 with best_epoch = 27 and best_val_0_logloss = 0.42637

Early stopping occurred at epoch 79 with best_epoch = 49 and best_val_0_logloss = 0.20814
[I 2025-07-28 21:56:29,735] Trial 6 finished with value: 0.8392538386272197 and parameters: {'n_d': 32, 'batch_size': 1024, 'virtual_bs_ratio': 0.25, 'n_steps': 3, 'gamma': 1.4, 'lambda_sparse': 0.00019158219548093185, 'lr': 0.006746437142284307, 'weight_decay': 0.0003482846706526881, 'mask_type': 'entmax', 'cat_emb_dim': 2}. Best is trial 3 with value: 0.9306822995103655.

Early stopping occurred at epoch 89 with best_epoch = 59 and best_val_0_logloss = 0.42291

Early stopping occurred at epoch 118 with best_epoch = 88 and best_val_0_logloss = 0.23724

Early stopping occurred at epoch 66 with best_epoch = 36 and best_val_0_logloss = 0.41757

Early stopping occurred at epoch 53 with best_epoch = 23 and best_val_0_logloss = 0.56415

Early stopping occurred at epoch 122 with best_epoch = 92 and best_val_0_logloss = 0.36022
[I 2025-07-28 21:57:21,317] Trial 7 finished with value: 0.849515446256748 and parameters: {'n_d': 16, 'batch_size': 2048, 'virtual_bs_ratio': 0.5, 'n_steps': 5, 'gamma': 1.1, 'lambda_sparse': 1.7027416886764403e-05, 'lr': 0.013062931388340918, 'weight_decay': 2.8681134821030064e-05, 'mask_type': 'entmax', 'cat_emb_dim': 1}. Best is trial 3 with value: 0.9306822995103655.

Early stopping occurred at epoch 88 with best_epoch = 58 and best_val_0_logloss = 0.2524

Early stopping occurred at epoch 99 with best_epoch = 69 and best_val_0_logloss = 0.22093

Early stopping occurred at epoch 91 with best_epoch = 61 and best_val_0_logloss = 0.40067

Early stopping occurred at epoch 77 with best_epoch = 47 and best_val_0_logloss = 0.23639

Early stopping occurred at epoch 95 with best_epoch = 65 and best_val_0_logloss = 0.22985
[I 2025-07-28 21:58:19,473] Trial 8 finished with value: 0.9138715342496079 and parameters: {'n_d': 64, 'batch_size': 2048, 'virtual_bs_ratio': 0.25, 'n_steps': 5, 'gamma': 1.3, 'lambda_sparse': 0.00026443593078398644, 'lr': 0.021068591627429092, 'weight_decay': 4.325207525386527e-05, 'mask_type': 'entmax', 'cat_emb_dim': 2}. Best is trial 3 with value: 0.9306822995103655.

Early stopping occurred at epoch 60 with best_epoch = 30 and best_val_0_logloss = 0.37202

Early stopping occurred at epoch 83 with best_epoch = 53 and best_val_0_logloss = 0.30621

Early stopping occurred at epoch 74 with best_epoch = 44 and best_val_0_logloss = 0.50126

Early stopping occurred at epoch 68 with best_epoch = 38 and best_val_0_logloss = 0.34052

Early stopping occurred at epoch 48 with best_epoch = 18 and best_val_0_logloss = 0.23765

Best trial: 3. Best value: 0.930682:  30%|███       | 9/30 [14:11<23:29, 67.10s/it]
Best trial: 3. Best value: 0.930682:  30%|███       | 9/30 [14:11<23:29, 67.10s/it]
Best trial: 3. Best value: 0.930682:  33%|███▎      | 10/30 [14:11<25:23, 76.16s/it]
                                                                                    

Best trial: 3. Best value: 0.930682:  33%|███▎      | 10/30 [15:28<25:23, 76.16s/it]
Best trial: 3. Best value: 0.930682:  33%|███▎      | 10/30 [15:28<25:23, 76.16s/it]
Best trial: 3. Best value: 0.930682:  37%|███▋      | 11/30 [15:28<24:08, 76.23s/it]
2025-07-28 22:01:55,752 - TabNetTrainer - WARNING - Trial 11 fold 4 failed: 

                                                                                    

Best trial: 3. Best value: 0.930682:  37%|███▋      | 11/30 [16:11<24:08, 76.23s/it]
Best trial: 3. Best value: 0.930682:  37%|███▋      | 11/30 [16:11<24:08, 76.23s/it]
Best trial: 3. Best value: 0.930682:  40%|████      | 12/30 [16:11<19:52, 66.26s/it]
                                                                                    

Best trial: 3. Best value: 0.930682:  40%|████      | 12/30 [17:52<19:52, 66.26s/it]
Best trial: 3. Best value: 0.930682:  40%|████      | 12/30 [17:53<19:52, 66.26s/it]
Best trial: 3. Best value: 0.930682:  43%|████▎     | 13/30 [17:53<21:47, 76.90s/it]
                                                                                    

Best trial: 3. Best value: 0.930682:  43%|████▎     | 13/30 [20:50<21:47, 76.90s/it]
Best trial: 3. Best value: 0.930682:  43%|████▎     | 13/30 [20:50<21:47, 76.90s/it]
Best trial: 3. Best value: 0.930682:  47%|████▋     | 14/30 [20:50<28:36, 107.28s/it]
                                                                                     

Best trial: 3. Best value: 0.930682:  47%|████▋     | 14/30 [23:48<28:36, 107.28s/it]
Best trial: 3. Best value: 0.930682:  47%|████▋     | 14/30 [23:48<28:36, 107.28s/it]
Best trial: 3. Best value: 0.930682:  50%|█████     | 15/30 [23:48<32:10, 128.71s/it]
                                                                                     

Best trial: 3. Best value: 0.930682:  50%|█████     | 15/30 [26:10<32:10, 128.71s/it]
Best trial: 3. Best value: 0.930682:  50%|█████     | 15/30 [26:10<32:10, 128.71s/it]
Best trial: 3. Best value: 0.930682:  53%|█████▎    | 16/30 [26:10<30:55, 132.50s/it]
                                                                                     

Best trial: 3. Best value: 0.930682:  53%|█████▎    | 16/30 [28:12<30:55, 132.50s/it]
Best trial: 3. Best value: 0.930682:  53%|█████▎    | 16/30 [28:12<30:55, 132.50s/it]
Best trial: 3. Best value: 0.930682:  57%|█████▋    | 17/30 [28:12<28:02, 129.45s/it]
                                                                                     

Best trial: 3. Best value: 0.930682:  57%|█████▋    | 17/30 [30:40<28:02, 129.45s/it]
Best trial: 3. Best value: 0.930682:  57%|█████▋    | 17/30 [30:40<28:02, 129.45s/it]
Best trial: 3. Best value: 0.930682:  60%|██████    | 18/30 [30:40<27:00, 135.08s/it]
                                                                                     

Best trial: 3. Best value: 0.930682:  60%|██████    | 18/30 [32:32<27:00, 135.08s/it]
Best trial: 3. Best value: 0.930682:  60%|██████    | 18/30 [32:32<27:00, 135.08s/it]
