[I 2025-07-30 01:34:48,935] Trial 11 finished with value: 0.6782976105467471 and parameters: {'n_d': 64, 'batch_size': 2048, 'virtual_bs_ratio': 0.5, 'n_steps': 4, 'gamma': 1.3, 'lambda_sparse': 7.954064937683937e-05, 'lr': 0.006185918211556435, 'weight_decay': 1.5155823539597614e-05, 'mask_type': 'sparsemax', 'cat_emb_dim': 1}. Best is trial 3 with value: 0.9306822995103655.

Early stopping occurred at epoch 101 with best_epoch = 71 and best_val_0_logloss = 0.49385
Stop training because you reached max_epochs = 200 with best_epoch = 194 and best_val_0_logloss = 0.20057

Early stopping occurred at epoch 66 with best_epoch = 36 and best_val_0_logloss = 0.64258

Early stopping occurred at epoch 56 with best_epoch = 26 and best_val_0_logloss = 0.71608

Early stopping occurred at epoch 109 with best_epoch = 79 and best_val_0_logloss = 0.25841
[I 2025-07-30 01:36:16,318] Trial 12 finished with value: 0.8265871844548907 and parameters: {'n_d': 16, 'batch_size': 1024, 'virtual_bs_ratio': 0.25, 'n_steps': 4, 'gamma': 1.1, 'lambda_sparse': 0.00011825328508422651, 'lr': 0.003726104236509948, 'weight_decay': 0.0007472397689332936, 'mask_type': 'entmax', 'cat_emb_dim': 1}. Best is trial 3 with value: 0.9306822995103655.

Early stopping occurred at epoch 47 with best_epoch = 17 and best_val_0_logloss = 0.3045

Early stopping occurred at epoch 187 with best_epoch = 157 and best_val_0_logloss = 0.08138

Early stopping occurred at epoch 78 with best_epoch = 48 and best_val_0_logloss = 0.26581

Early stopping occurred at epoch 122 with best_epoch = 92 and best_val_0_logloss = 0.18475

Early stopping occurred at epoch 78 with best_epoch = 48 and best_val_0_logloss = 0.14747
[I 2025-07-30 01:38:45,379] Trial 13 finished with value: 0.9000659850022122 and parameters: {'n_d': 64, 'batch_size': 512, 'virtual_bs_ratio': 0.25, 'n_steps': 4, 'gamma': 1.1, 'lambda_sparse': 1.902428324748959e-06, 'lr': 0.02114932281416455, 'weight_decay': 0.0006321732490144021, 'mask_type': 'sparsemax', 'cat_emb_dim': 2}. Best is trial 3 with value: 0.9306822995103655.

Early stopping occurred at epoch 130 with best_epoch = 100 and best_val_0_logloss = 0.72164
Stop training because you reached max_epochs = 200 with best_epoch = 185 and best_val_0_logloss = 0.30746

Early stopping occurred at epoch 68 with best_epoch = 38 and best_val_0_logloss = 0.76803

Early stopping occurred at epoch 107 with best_epoch = 77 and best_val_0_logloss = 0.34178

Early stopping occurred at epoch 117 with best_epoch = 87 and best_val_0_logloss = 0.29226
