[I 2025-07-28 22:46:38,553] Trial 29 finished with value: 0.961612528883568 and parameters: {'depth': 7, 'learning_rate': 0.21138676621899408, 'l2_leaf_reg': 2.659639328893289, 'bootstrap_type': 'Bayesian', 'bagging_temperature': 0.08210490446393415}. Best is trial 21 with value: 0.9766401841905218.
✓ Optimization completed in 190.8 seconds!
Best trial: 21
Best parameters found:
  - depth: 5
  - learning_rate: 0.27378861185756237
  - l2_leaf_reg: 1.7657590787903183
  - bootstrap_type: Bernoulli
  - subsample: 0.9

Best F1-macro (CV): 0.9766 (±0.0117)
------------------------------------------------------------
[Step 7/11] Final model training with best hyperparameters...
------------------------------------------------------------
0:	learn: 0.9336343	test: 0.9267163	best: 0.9267163 (0)	total: 6.23ms	remaining: 12.5s

2025-07-28 22:46:39,374 - CatBoostTrainer - INFO - ✓ Final model fitting completed in 0.68 seconds!

2025-07-28 22:46:39,379 - CatBoostTrainer - INFO - ✓ Final model saved to: /results/catboost/catboost_model.pkl

2025-07-28 22:46:39,379 - CatBoostTrainer - INFO - Evaluating final model on the holdout set

2025-07-28 22:46:39,401 - CatBoostTrainer - INFO - Save Results: CSV and JSON Files...

2025-07-28 22:46:39,425 - CatBoostTrainer - INFO - Generating and saving visualizations...

2025-07-28 22:46:42,482 - CatBoostTrainer - INFO - All CATBOOST visualizations and results saved to: /results/catboost

2025-07-28 22:46:42,482 - CatBoostTrainer - INFO - CATBOOST COMPLETED! Total execution time: 3.3 minutes

2025-07-28 22:46:42,483 - CatBoostTrainer - INFO - All results saved to: /results/catboost. Generating summary...
2:	learn: 0.9384618	test: 0.9349354	best: 0.9349354 (2)	total: 16ms	remaining: 10.7s
4:	learn: 0.9383849	test: 0.9327950	best: 0.9349354 (2)	total: 25.5ms	remaining: 10.2s
6:	learn: 0.9722547	test: 0.9649607	best: 0.9649607 (6)	total: 35.3ms	remaining: 10s
8:	learn: 0.9757226	test: 0.9718368	best: 0.9718368 (8)	total: 45.2ms	remaining: 10s
10:	learn: 0.9763550	test: 0.9740070	best: 0.9740070 (9)	total: 55ms	remaining: 9.94s
12:	learn: 0.9782174	test: 0.9750918	best: 0.9750918 (11)	total: 64.9ms	remaining: 9.93s
14:	learn: 0.9824608	test: 0.9729220	best: 0.9750918 (11)	total: 74.9ms	remaining: 9.91s
16:	learn: 0.9835473	test: 0.9758161	best: 0.9758161 (16)	total: 84.7ms	remaining: 9.88s
18:	learn: 0.9842728	test: 0.9769017	best: 0.9769017 (17)	total: 94.3ms	remaining: 9.83s
20:	learn: 0.9865661	test: 0.9769017	best: 0.9769017 (17)	total: 104ms	remaining: 9.8s
22:	learn: 0.9871709	test: 0.9790722	best: 0.9790722 (22)	total: 114ms	remaining: 9.79s
24:	learn: 0.9878157	test: 0.9790722	best: 0.9790722 (22)	total: 123ms	remaining: 9.74s
26:	learn: 0.9885802	test: 0.9790722	best: 0.9790722 (22)	total: 133ms	remaining: 9.73s
28:	learn: 0.9906128	test: 0.9790722	best: 0.9790722 (22)	total: 143ms	remaining: 9.71s
30:	learn: 0.9912117	test: 0.9801571	best: 0.9801571 (30)	total: 153ms	remaining: 9.69s
32:	learn: 0.9916537	test: 0.9801571	best: 0.9801571 (30)	total: 162ms	remaining: 9.68s
34:	learn: 0.9930312	test: 0.9801571	best: 0.9801571 (30)	total: 172ms	remaining: 9.68s
36:	learn: 0.9931567	test: 0.9801571	best: 0.9801571 (30)	total: 182ms	remaining: 9.67s
38:	learn: 0.9930427	test: 0.9801571	best: 0.9801571 (30)	total: 192ms	remaining: 9.66s
40:	learn: 0.9927404	test: 0.9801571	best: 0.9801571 (30)	total: 202ms	remaining: 9.64s
42:	learn: 0.9944380	test: 0.9790722	best: 0.9801571 (30)	total: 211ms	remaining: 9.62s
44:	learn: 0.9941527	test: 0.9790722	best: 0.9801571 (30)	total: 219ms	remaining: 9.52s
46:	learn: 0.9945523	test: 0.9801571	best: 0.9801571 (30)	total: 227ms	remaining: 9.43s
48:	learn: 0.9947558	test: 0.9801571	best: 0.9801571 (30)	total: 236ms	remaining: 9.39s
50:	learn: 0.9949814	test: 0.9801571	best: 0.9801571 (30)	total: 246ms	remaining: 9.39s
52:	learn: 0.9950652	test: 0.9801571	best: 0.9801571 (30)	total: 256ms	remaining: 9.39s
54:	learn: 0.9952668	test: 0.9801571	best: 0.9801571 (30)	total: 265ms	remaining: 9.38s
56:	learn: 0.9952668	test: 0.9801571	best: 0.9801571 (30)	total: 275ms	remaining: 9.38s
58:	learn: 0.9955883	test: 0.9790722	best: 0.9801571 (30)	total: 285ms	remaining: 9.38s
60:	learn: 0.9965966	test: 0.9790722	best: 0.9801571 (30)	total: 295ms	remaining: 9.37s
62:	learn: 0.9965605	test: 0.9790722	best: 0.9801571 (30)	total: 305ms	remaining: 9.36s
64:	learn: 0.9968821	test: 0.9801571	best: 0.9801571 (30)	total: 314ms	remaining: 9.36s
66:	learn: 0.9965605	test: 0.9790722	best: 0.9801571 (30)	total: 324ms	remaining: 9.36s
68:	learn: 0.9968005	test: 0.9790722	best: 0.9801571 (30)	total: 334ms	remaining: 9.35s
70:	learn: 0.9968005	test: 0.9790722	best: 0.9801571 (30)	total: 344ms	remaining: 9.34s
72:	learn: 0.9965605	test: 0.9801571	best: 0.9801571 (30)	total: 354ms	remaining: 9.33s
74:	learn: 0.9965605	test: 0.9801571	best: 0.9801571 (30)	total: 363ms	remaining: 9.32s
76:	learn: 0.9966859	test: 0.9801571	best: 0.9801571 (30)	total: 373ms	remaining: 9.32s
78:	learn: 0.9968112	test: 0.9801571	best: 0.9801571 (30)	total: 383ms	remaining: 9.31s
80:	learn: 0.9969311	test: 0.9801571	best: 0.9801571 (30)	total: 393ms	remaining: 9.3s
bestTest = 0.9801570803
bestIteration = 30
Shrink model to first 31 iterations.
✓ Final model fitting completed in 0.68 seconds!
✓ Final model saved to: /results/catboost/catboost_model.pkl
✓ Best iteration: 30
✓ Number of trees: 31
✓ Max depth: 5
✓ Best epoch: -1
------------------------------------------------------------
[Step 8/11] Evaluating final model on the holdout set
------------------------------------------------------------

Classification Report:
              precision    recall  f1-score   support

    Adequate       1.00      0.99      0.99        71
     Warning       0.86      0.85      0.86       130
      Severe       0.95      0.94      0.94       445
    Critical       0.95      0.97      0.96       178

    accuracy                           0.94       824
   macro avg       0.94      0.94      0.94       824
weighted avg       0.94      0.94      0.94       824


Key Performance Indicators:
  • Overall Accuracy: 93.8%
  • Macro F1-Score: 93.9%
  • Weighted F1-Score: 93.8%

------------------------------------------------------------
[Step 9/11] Save Results: CSV and JSON Files...
------------------------------------------------------------
✓ Feature importance saved to: /results/catboost/feature_importance_catboost.csv
Saving comprehensive results...
✓ Results successfully saved to: /results/catboost/training_results_catboost.json
------------------------------------------------------------
[Step 10/11] Generating and saving visualizations...
------------------------------------------------------------
✓ Confusion matrix plot saved: /results/catboost/confusion_matrix_cb_raw.png
✓ Confusion matrix plot saved: /results/catboost/confusion_matrix_cb_normalized.png
✓ Optuna optimization history saved: /results/catboost/optuna_history_catboost.html
Generating feature importance barplot...
✓ Feature importance barplot saved: /results/catboost/feature_importance_catboost.png
Generating cumulative feature importance plot...
✓ Cumulative feature importance plot saved: /results/catboost/feature_importance_cumulative_catboost.png
Generating Final CatBoost Training Curves (Loss/Accuracy)...
✓ Final CatBoost Training & Validation Curves Plots Saved: /results/catboost/catboost_training_curves.png


✓ All CATBOOST visualizations and results saved to: /results/catboost
------------------------------------------------------------
[Step 11/11] CATBOOST COMPLETED! Total execution time: 3.3 minutes
All results saved to: /results/catboost. Generating summary...
------------------------------------------------------------

================================================================================
CATBOOST TRAINING SUMMARY
================================================================================
Model Library: catboost v1.2.8
Data: 4576 train / 824 holdout
CV Score (Macro F1): 0.9766
Holdout Accuracy: 0.9381
Holdout Macro F1: 0.9387
Total Run Time: 191.5s
================================================================================
✓ CatBoost training completed.

================================================================================
PIPELINE EXECUTION SUMMARY
================================================================================
Models successfully trained: 3/3 (RandomForest, TabNet, CatBoost)
Total execution time: 01:08:32
Results have been saved in their respective directories under '../results/'

================================================================================
MODEL COMPARISON ANALYSIS
================================================================================

================================================================================
MODEL COMPARISON SUMMARY
================================================================================

🏆 BEST PERFORMERS:
  • Best Test Accuracy: RandomForest (0.9454)
  • Best Test F1-Macro: RandomForest (0.9462)
  • Best F1 Critical: CatBoost (0.961)
  • Best Total Time (s): CatBoost (191.5)

📊 METRICS TABLE:
+--------------+-----------------+-----------------+---------------+--------------+-------------+---------------+------------------+----------+
| Model        |   Test Accuracy |   Test F1-Macro |   F1 Adequate |   F1 Warning |   F1 Severe |   F1 Critical |   Total Time (s) | Device   |
+==============+=================+=================+===============+==============+=============+===============+==================+==========+
| CatBoost     |          0.9381 |          0.9387 |         0.993 |        0.857 |       0.944 |         0.961 |            191.5 | GPU      |
+--------------+-----------------+-----------------+---------------+--------------+-------------+---------------+------------------+----------+
| RandomForest |          0.9454 |          0.9462 |         0.993 |        0.892 |       0.951 |         0.949 |            449.5 | CPU      |
+--------------+-----------------+-----------------+---------------+--------------+-------------+---------------+------------------+----------+
| TabNet       |          0.8216 |          0.812  |         0.959 |        0.496 |       0.84  |         0.953 |           3461.4 | GPU      |
+--------------+-----------------+-----------------+---------------+--------------+-------------+---------------+------------------+----------+
✓ Saved comparison plot to: ../results/model_comparison.png
✓ Exported comparison table to: ../results/model_comparison.csv
✓ Comparison report generated successfully.
================================================================================
Orchestration complete.
