[I 2025-07-29 07:33:38,478] Trial 49 finished with value: 0.9160277705085942 and parameters: {'n_d': 16, 'batch_size': 512, 'virtual_bs_ratio': 0.5, 'n_steps': 5, 'gamma': 1.5, 'lambda_sparse': 2.7193454047236375e-06, 'lr': 0.009938778043174704, 'weight_decay': 0.00022570320899795653, 'mask_type': 'entmax', 'cat_emb_dim': 3}. Best is trial 35 with value: 0.9465010950818717.
✓ Optimization completed in 5962.9 seconds!
Best trial: 35
Best parameters found:
  - n_d: 16
  - batch_size: 512
  - virtual_bs_ratio: 0.5
  - n_steps: 5
  - gamma: 1.0
  - lambda_sparse: 6.2969708438241455e-06
  - lr: 0.024287373208247236
  - weight_decay: 0.0004912248276550453
  - mask_type: sparsemax
  - cat_emb_dim: 3

Best F1-macro (CV): 0.9465 (±0.0225)
------------------------------------------------------------
[Step 7/11] Final model training with best hyperparameters...
------------------------------------------------------------
epoch 0  | loss: 1.41215 | valid_accuracy: 0.33958 | valid_logloss: 1.63911 |  0:00:00s
epoch 1  | loss: 0.64521 | valid_accuracy: 0.42292 | valid_logloss: 1.17731 |  0:00:00s
epoch 2  | loss: 0.36493 | valid_accuracy: 0.5125  | valid_logloss: 1.17755 |  0:00:00s
epoch 3  | loss: 0.31935 | valid_accuracy: 0.56875 | valid_logloss: 0.88212 |  0:00:01s
epoch 4  | loss: 0.2503  | valid_accuracy: 0.76667 | valid_logloss: 0.58561 |  0:00:01s
epoch 5  | loss: 0.25746 | valid_accuracy: 0.7875  | valid_logloss: 0.59307 |  0:00:01s
epoch 6  | loss: 0.22476 | valid_accuracy: 0.80208 | valid_logloss: 0.5042  |  0:00:02s
epoch 7  | loss: 0.17641 | valid_accuracy: 0.87083 | valid_logloss: 0.38713 |  0:00:02s
epoch 8  | loss: 0.16296 | valid_accuracy: 0.86042 | valid_logloss: 0.37405 |  0:00:02s
epoch 9  | loss: 0.17354 | valid_accuracy: 0.86667 | valid_logloss: 0.42784 |  0:00:02s
epoch 10 | loss: 0.15325 | valid_accuracy: 0.87917 | valid_logloss: 0.36055 |  0:00:03s
epoch 11 | loss: 0.1406  | valid_accuracy: 0.83542 | valid_logloss: 0.45061 |  0:00:03s
epoch 12 | loss: 0.13198 | valid_accuracy: 0.84583 | valid_logloss: 0.4198  |  0:00:03s
epoch 13 | loss: 0.11684 | valid_accuracy: 0.84375 | valid_logloss: 0.36744 |  0:00:04s
epoch 14 | loss: 0.11199 | valid_accuracy: 0.8625  | valid_logloss: 0.35961 |  0:00:04s
epoch 15 | loss: 0.10456 | valid_accuracy: 0.86042 | valid_logloss: 0.32591 |  0:00:04s
epoch 16 | loss: 0.10666 | valid_accuracy: 0.88542 | valid_logloss: 0.28734 |  0:00:05s
epoch 17 | loss: 0.11161 | valid_accuracy: 0.85208 | valid_logloss: 0.32022 |  0:00:05s
epoch 18 | loss: 0.09452 | valid_accuracy: 0.85417 | valid_logloss: 0.33588 |  0:00:05s
epoch 19 | loss: 0.09371 | valid_accuracy: 0.85833 | valid_logloss: 0.33491 |  0:00:06s
epoch 20 | loss: 0.09103 | valid_accuracy: 0.79792 | valid_logloss: 0.47308 |  0:00:06s
epoch 21 | loss: 0.09306 | valid_accuracy: 0.8625  | valid_logloss: 0.32765 |  0:00:06s
epoch 22 | loss: 0.11462 | valid_accuracy: 0.84167 | valid_logloss: 0.31241 |  0:00:07s
epoch 23 | loss: 0.09588 | valid_accuracy: 0.84792 | valid_logloss: 0.40459 |  0:00:07s
epoch 24 | loss: 0.08702 | valid_accuracy: 0.86875 | valid_logloss: 0.3095  |  0:00:07s
epoch 25 | loss: 0.09026 | valid_accuracy: 0.84375 | valid_logloss: 0.35758 |  0:00:08s
epoch 26 | loss: 0.09846 | valid_accuracy: 0.86458 | valid_logloss: 0.47002 |  0:00:08s
epoch 27 | loss: 0.08584 | valid_accuracy: 0.85625 | valid_logloss: 0.32833 |  0:00:09s
epoch 28 | loss: 0.09796 | valid_accuracy: 0.85208 | valid_logloss: 0.48753 |  0:00:09s
epoch 29 | loss: 0.10027 | valid_accuracy: 0.925   | valid_logloss: 0.21775 |  0:00:09s
epoch 30 | loss: 0.08952 | valid_accuracy: 0.92083 | valid_logloss: 0.24051 |  0:00:10s
epoch 31 | loss: 0.07587 | valid_accuracy: 0.89583 | valid_logloss: 0.25871 |  0:00:10s
epoch 32 | loss: 0.08287 | valid_accuracy: 0.91875 | valid_logloss: 0.24049 |  0:00:10s
epoch 33 | loss: 0.07515 | valid_accuracy: 0.89792 | valid_logloss: 0.26017 |  0:00:11s
epoch 34 | loss: 0.07985 | valid_accuracy: 0.9125  | valid_logloss: 0.31162 |  0:00:11s
epoch 35 | loss: 0.07308 | valid_accuracy: 0.86875 | valid_logloss: 0.38036 |  0:00:11s
epoch 36 | loss: 0.0742  | valid_accuracy: 0.9125  | valid_logloss: 0.30691 |  0:00:12s
epoch 37 | loss: 0.07799 | valid_accuracy: 0.82708 | valid_logloss: 0.48001 |  0:00:12s
epoch 38 | loss: 0.07462 | valid_accuracy: 0.87917 | valid_logloss: 0.3756  |  0:00:12s
epoch 39 | loss: 0.06696 | valid_accuracy: 0.88333 | valid_logloss: 0.3777  |  0:00:13s
epoch 40 | loss: 0.06603 | valid_accuracy: 0.87708 | valid_logloss: 0.3072  |  0:00:13s
epoch 41 | loss: 0.07292 | valid_accuracy: 0.89167 | valid_logloss: 0.26683 |  0:00:13s
epoch 42 | loss: 0.06877 | valid_accuracy: 0.91042 | valid_logloss: 0.23466 |  0:00:13s
epoch 43 | loss: 0.06163 | valid_accuracy: 0.89375 | valid_logloss: 0.23234 |  0:00:14s
epoch 44 | loss: 0.06257 | valid_accuracy: 0.88125 | valid_logloss: 0.29014 |  0:00:14s
epoch 45 | loss: 0.05755 | valid_accuracy: 0.86875 | valid_logloss: 0.3222  |  0:00:14s
epoch 46 | loss: 0.06445 | valid_accuracy: 0.92292 | valid_logloss: 0.2453  |  0:00:15s
epoch 47 | loss: 0.07141 | valid_accuracy: 0.91667 | valid_logloss: 0.20722 |  0:00:15s
epoch 48 | loss: 0.06239 | valid_accuracy: 0.88958 | valid_logloss: 0.23042 |  0:00:15s
epoch 49 | loss: 0.06031 | valid_accuracy: 0.9125  | valid_logloss: 0.21963 |  0:00:16s
epoch 50 | loss: 0.0725  | valid_accuracy: 0.91875 | valid_logloss: 0.20641 |  0:00:16s
epoch 51 | loss: 0.06871 | valid_accuracy: 0.90833 | valid_logloss: 0.23135 |  0:00:16s
epoch 52 | loss: 0.05751 | valid_accuracy: 0.91458 | valid_logloss: 0.23254 |  0:00:17s
epoch 53 | loss: 0.06009 | valid_accuracy: 0.91042 | valid_logloss: 0.23906 |  0:00:17s
epoch 54 | loss: 0.06035 | valid_accuracy: 0.94167 | valid_logloss: 0.17539 |  0:00:17s
epoch 55 | loss: 0.06798 | valid_accuracy: 0.93333 | valid_logloss: 0.20004 |  0:00:18s
epoch 56 | loss: 0.05561 | valid_accuracy: 0.91042 | valid_logloss: 0.255   |  0:00:18s
epoch 57 | loss: 0.06593 | valid_accuracy: 0.92708 | valid_logloss: 0.20661 |  0:00:18s
epoch 58 | loss: 0.06196 | valid_accuracy: 0.95417 | valid_logloss: 0.16422 |  0:00:19s
epoch 59 | loss: 0.06245 | valid_accuracy: 0.92917 | valid_logloss: 0.22184 |  0:00:19s
epoch 60 | loss: 0.06566 | valid_accuracy: 0.93125 | valid_logloss: 0.18962 |  0:00:19s
epoch 61 | loss: 0.06097 | valid_accuracy: 0.93125 | valid_logloss: 0.24964 |  0:00:20s
epoch 62 | loss: 0.0665  | valid_accuracy: 0.93542 | valid_logloss: 0.18601 |  0:00:20s
epoch 63 | loss: 0.05852 | valid_accuracy: 0.91875 | valid_logloss: 0.20603 |  0:00:20s
epoch 64 | loss: 0.05934 | valid_accuracy: 0.95625 | valid_logloss: 0.17034 |  0:00:21s
epoch 65 | loss: 0.04811 | valid_accuracy: 0.90417 | valid_logloss: 0.25851 |  0:00:21s
epoch 66 | loss: 0.06892 | valid_accuracy: 0.9375  | valid_logloss: 0.18528 |  0:00:21s
epoch 67 | loss: 0.06689 | valid_accuracy: 0.89583 | valid_logloss: 0.30555 |  0:00:22s
epoch 68 | loss: 0.06157 | valid_accuracy: 0.91875 | valid_logloss: 0.21774 |  0:00:22s
epoch 69 | loss: 0.06482 | valid_accuracy: 0.87708 | valid_logloss: 0.33343 |  0:00:23s
epoch 70 | loss: 0.06141 | valid_accuracy: 0.92708 | valid_logloss: 0.20223 |  0:00:23s
2025-07-29 07:34:21,050 - TabNetTrainer - INFO - Final model training completed in 42.42 seconds.

2025-07-29 07:34:21,050 - TabNetTrainer - INFO - ✓ Final model fitting completed in 42.42 seconds!

2025-07-29 07:34:21,198 - TabNetTrainer - INFO - ✓ Final model saved to: /results/tabnet/tabnet_model.pkl

2025-07-29 07:34:21,198 - TabNetTrainer - INFO - Evaluating final model on the holdout set...

2025-07-29 07:34:21,241 - TabNetTrainer - INFO - Save Results: CSV and JSON Files...

2025-07-29 07:34:21,264 - TabNetTrainer - INFO - Generating and saving visualizations...

2025-07-29 07:34:24,127 - TabNetTrainer - INFO - All TABNET visualizations and results saved to: /results/tabnet

2025-07-29 07:34:24,127 - TabNetTrainer - INFO - TABNET COMPLETED! Total execution time: 100.2 minutes

2025-07-29 07:34:24,127 - TabNetTrainer - INFO - All results saved to: /results/tabnet. Generating summary...

epoch 71 | loss: 0.06126 | valid_accuracy: 0.93333 | valid_logloss: 0.20647 |  0:00:23s
epoch 72 | loss: 0.06268 | valid_accuracy: 0.90833 | valid_logloss: 0.26167 |  0:00:24s
epoch 73 | loss: 0.05604 | valid_accuracy: 0.93958 | valid_logloss: 0.20926 |  0:00:24s
epoch 74 | loss: 0.05051 | valid_accuracy: 0.91875 | valid_logloss: 0.23671 |  0:00:24s
epoch 75 | loss: 0.05403 | valid_accuracy: 0.92292 | valid_logloss: 0.20045 |  0:00:25s
epoch 76 | loss: 0.05531 | valid_accuracy: 0.93542 | valid_logloss: 0.18251 |  0:00:25s
epoch 77 | loss: 0.05008 | valid_accuracy: 0.93958 | valid_logloss: 0.17047 |  0:00:25s
epoch 78 | loss: 0.04376 | valid_accuracy: 0.97083 | valid_logloss: 0.14427 |  0:00:26s
epoch 79 | loss: 0.04678 | valid_accuracy: 0.94375 | valid_logloss: 0.17904 |  0:00:26s
epoch 80 | loss: 0.05191 | valid_accuracy: 0.92292 | valid_logloss: 0.19568 |  0:00:26s
epoch 81 | loss: 0.04895 | valid_accuracy: 0.93333 | valid_logloss: 0.19201 |  0:00:27s
epoch 82 | loss: 0.05352 | valid_accuracy: 0.95833 | valid_logloss: 0.15496 |  0:00:27s
epoch 83 | loss: 0.04718 | valid_accuracy: 0.93125 | valid_logloss: 0.18095 |  0:00:27s
epoch 84 | loss: 0.04834 | valid_accuracy: 0.95417 | valid_logloss: 0.14886 |  0:00:28s
epoch 85 | loss: 0.04947 | valid_accuracy: 0.94583 | valid_logloss: 0.16431 |  0:00:28s
epoch 86 | loss: 0.04551 | valid_accuracy: 0.92917 | valid_logloss: 0.19467 |  0:00:28s
epoch 87 | loss: 0.04907 | valid_accuracy: 0.95208 | valid_logloss: 0.14656 |  0:00:29s
epoch 88 | loss: 0.06148 | valid_accuracy: 0.93542 | valid_logloss: 0.17584 |  0:00:29s
epoch 89 | loss: 0.04855 | valid_accuracy: 0.92917 | valid_logloss: 0.19176 |  0:00:29s
epoch 90 | loss: 0.0408  | valid_accuracy: 0.92708 | valid_logloss: 0.20373 |  0:00:29s
epoch 91 | loss: 0.05238 | valid_accuracy: 0.93125 | valid_logloss: 0.18826 |  0:00:30s
epoch 92 | loss: 0.04743 | valid_accuracy: 0.95833 | valid_logloss: 0.14615 |  0:00:30s
epoch 93 | loss: 0.04457 | valid_accuracy: 0.94792 | valid_logloss: 0.16156 |  0:00:31s
epoch 94 | loss: 0.04707 | valid_accuracy: 0.93542 | valid_logloss: 0.17388 |  0:00:31s
epoch 95 | loss: 0.054   | valid_accuracy: 0.93333 | valid_logloss: 0.17923 |  0:00:31s
epoch 96 | loss: 0.0509  | valid_accuracy: 0.94375 | valid_logloss: 0.15262 |  0:00:32s
epoch 97 | loss: 0.0428  | valid_accuracy: 0.9625  | valid_logloss: 0.13171 |  0:00:32s
epoch 98 | loss: 0.04388 | valid_accuracy: 0.94792 | valid_logloss: 0.14377 |  0:00:32s
epoch 99 | loss: 0.04955 | valid_accuracy: 0.96875 | valid_logloss: 0.12597 |  0:00:33s
epoch 100| loss: 0.0475  | valid_accuracy: 0.96667 | valid_logloss: 0.13453 |  0:00:33s
epoch 101| loss: 0.04045 | valid_accuracy: 0.95    | valid_logloss: 0.14469 |  0:00:33s
epoch 102| loss: 0.04853 | valid_accuracy: 0.94167 | valid_logloss: 0.16741 |  0:00:34s
epoch 103| loss: 0.04247 | valid_accuracy: 0.95417 | valid_logloss: 0.14374 |  0:00:34s
epoch 104| loss: 0.04349 | valid_accuracy: 0.95    | valid_logloss: 0.14696 |  0:00:34s
epoch 105| loss: 0.0395  | valid_accuracy: 0.95    | valid_logloss: 0.1459  |  0:00:34s
epoch 106| loss: 0.04056 | valid_accuracy: 0.95208 | valid_logloss: 0.14471 |  0:00:35s
epoch 107| loss: 0.04234 | valid_accuracy: 0.94167 | valid_logloss: 0.16184 |  0:00:35s
epoch 108| loss: 0.04094 | valid_accuracy: 0.96042 | valid_logloss: 0.14018 |  0:00:35s
epoch 109| loss: 0.04533 | valid_accuracy: 0.95    | valid_logloss: 0.14503 |  0:00:36s
epoch 110| loss: 0.03955 | valid_accuracy: 0.94792 | valid_logloss: 0.14958 |  0:00:36s
epoch 111| loss: 0.03785 | valid_accuracy: 0.95417 | valid_logloss: 0.14452 |  0:00:36s
epoch 112| loss: 0.04251 | valid_accuracy: 0.95417 | valid_logloss: 0.14725 |  0:00:36s
epoch 113| loss: 0.03686 | valid_accuracy: 0.95417 | valid_logloss: 0.14255 |  0:00:37s
epoch 114| loss: 0.04068 | valid_accuracy: 0.95417 | valid_logloss: 0.14193 |  0:00:37s
epoch 115| loss: 0.03492 | valid_accuracy: 0.95417 | valid_logloss: 0.14459 |  0:00:37s
epoch 116| loss: 0.03719 | valid_accuracy: 0.95    | valid_logloss: 0.15543 |  0:00:38s
epoch 117| loss: 0.04752 | valid_accuracy: 0.94792 | valid_logloss: 0.15034 |  0:00:38s
epoch 118| loss: 0.03895 | valid_accuracy: 0.94583 | valid_logloss: 0.15828 |  0:00:38s
epoch 119| loss: 0.04086 | valid_accuracy: 0.93958 | valid_logloss: 0.17346 |  0:00:39s
epoch 120| loss: 0.04232 | valid_accuracy: 0.94583 | valid_logloss: 0.16127 |  0:00:39s
epoch 121| loss: 0.03636 | valid_accuracy: 0.95625 | valid_logloss: 0.13888 |  0:00:39s
epoch 122| loss: 0.03729 | valid_accuracy: 0.95417 | valid_logloss: 0.1444  |  0:00:40s
epoch 123| loss: 0.04711 | valid_accuracy: 0.94792 | valid_logloss: 0.16112 |  0:00:40s
epoch 124| loss: 0.03314 | valid_accuracy: 0.94792 | valid_logloss: 0.16231 |  0:00:40s
epoch 125| loss: 0.04108 | valid_accuracy: 0.94792 | valid_logloss: 0.16479 |  0:00:40s
epoch 126| loss: 0.04424 | valid_accuracy: 0.95417 | valid_logloss: 0.15044 |  0:00:41s
epoch 127| loss: 0.0474  | valid_accuracy: 0.95417 | valid_logloss: 0.15047 |  0:00:41s
epoch 128| loss: 0.03762 | valid_accuracy: 0.94792 | valid_logloss: 0.16177 |  0:00:41s
epoch 129| loss: 0.04408 | valid_accuracy: 0.94792 | valid_logloss: 0.1657  |  0:00:42s

Early stopping occurred at epoch 129 with best_epoch = 99 and best_valid_logloss = 0.12597
✓ Final model fitting completed in 42.42 seconds!
✓ Final model saved to: /results/tabnet/tabnet_model.pkl
✓ Best epoch: 99
✓ Number of epochs trained: 130
------------------------------------------------------------
[Step 8/11] Evaluating final model on the holdout set...
------------------------------------------------------------

Classification Report:
              precision    recall  f1-score   support

    Adequate       0.91      0.99      0.95        71
     Warning       0.57      0.43      0.49       130
      Severe       0.84      0.87      0.86       445
    Critical       0.93      0.97      0.95       178

    accuracy                           0.83       824
   macro avg       0.81      0.82      0.81       824
weighted avg       0.82      0.83      0.83       824


Key Performance Indicators:
  • Overall Accuracy: 83.5%
  • Macro F1-Score: 81.1%
  • Weighted F1-Score: 82.7%

------------------------------------------------------------
[Step 9/11] Save Results: CSV and JSON Files...
------------------------------------------------------------
✓ Feature importance saved to: /results/tabnet/feature_importances_tabnet.csv
Saving comprehensive results...
✓ Results successfully saved to: /results/tabnet/training_results_tabnet.json
------------------------------------------------------------
[Step 10/11] Generating and saving visualizations...
------------------------------------------------------------
✓ Confusion matrix plot saved: /results/tabnet/confusion_matrix_tb_raw.png
✓ Confusion matrix plot saved: /results/tabnet/confusion_matrix_tb_normalized.png
✓ Optuna optimization history saved: /results/tabnet/optuna_history_tb.html
Generating feature importance barplot...
✓ Feature importance barplot saved: /results/tabnet/feature_importance_tabnet.png
✓ Cumulative feature importance plot saved: /results/tabnet/feature_importance_cumulative_tabnet.png
Generating Final TabNet Training Curves (Loss/Accuracy)...
✓ Final TabNet Training & Validation Curves Plots Saved: /results/tabnet/tabnet_training_curves.png


✓ All TABNET visualizations and results saved to: /results/tabnet
------------------------------------------------------------
[Step 11/11] TABNET COMPLETED! Total execution time: 100.2 minutes
All results saved to: /results/tabnet. Generating summary...
------------------------------------------------------------

================================================================================
TABNET TRAINING SUMMARY
================================================================================
Model Library: pytorch-tabnet v4.1.0
Data: 4576 train / 824 holdout
CV Score (Macro F1): 0.9465
Holdout Accuracy: 0.8350
Holdout Macro F1: 0.8108
Total Run Time: 6007.1s
================================================================================
✓ TabNet training completed.

2025-07-29 07:34:24,128 - CatBoostTrainer - INFO - Starting Catboost Training Pipeline...

2025-07-29 07:34:24,128 - CatBoostTrainer - INFO - Loading and preprocessing dataset from ../data/aims_dataset.csv ...

2025-07-29 07:34:24,228 - CatBoostTrainer - INFO - Applying Custom Weighted-Impact Labeling...

2025-07-29 07:34:24,636 - CatBoostTrainer - INFO - Splitting data into temporal-aware training and holdout sets...

2025-07-29 07:34:24,642 - CatBoostTrainer - INFO - Setting up output directory...

2025-07-29 07:34:24,806 - CatBoostTrainer - INFO - Creating base model...

2025-07-29 07:34:24,806 - CatBoostTrainer - INFO - CUDA-enabled GPU detected: Tesla T4 (14.6 GB). Setting task_type to 'GPU'.

2025-07-29 07:34:24,806 - CatBoostTrainer - INFO - Configure and Run Hyperparameter Optimization (HPO) with Optuna ...
[I 2025-07-29 07:34:24,807] A new study created in memory with name: no-name-47b7e7a0-3066-4f6f-9e00-2ade5dbc4e2c

2025-07-29 07:34:24,807 - CatBoostTrainer - INFO - Starting Optuna optimization with 50 trials...

[3/3] Training CatBoost Classifier...
------------------------------------------------------------

================================================================================
CATBOOST TRAINING PIPELINE - AIMS FRAMEWORK
================================================================================
Configuration:
  - Dataset: ../data/aims_dataset.csv
  - CV Folds: 5
  - Optuna Trials: 50
  - Random State: 42
  - Parallel Jobs: -1
================================================================================
------------------------------------------------------------
[Step 1/11] Loading and preprocessing dataset...
------------------------------------------------------------
✓ Raw dataset shape: (5400, 18)
✓ Preprocessed dataset shape: (5400, 25)
------------------------------------------------------------
[Step 2/11] Applying Custom Weighted-Impact Labeling...
------------------------------------------------------------
✓ Feature matrix shape : (5400, 25)
✓ Temporal groups      : 25
✓ Impact distribution :
   count  percent (%)
0    768        14.22
1   1013        18.76
2   2715        50.28
3    904        16.74
------------------------------------------------------------
[Step 3/11] Splitting data into temporal-aware training and holdout sets...
------------------------------------------------------------
✓ Numerical features: 20
✓ Categorical features: 5
✓ Training set : 4576 samples (84.7%)
✓ Holdout set  : 824 samples (15.3%)
------------------------------------------------------------
[Step 4/11] Setting up output directory...
------------------------------------------------------------
✓ Results will be saved to: /results/catboost
✓ Saving artifact files (features, labels, groups, and class weights)...
✓ Features, labels, groups, and class weights saved.
------------------------------------------------------------
[Step 5/11] Creating base model...
------------------------------------------------------------
CUDA-enabled GPU detected: Tesla T4 (14.6 GB). Setting task_type to 'GPU'.
✓ Using GPU acceleration
------------------------------------------------------------
[Step 6/11] Configure and Run Hyperparameter Optimization (HPO) with Optuna ...
------------------------------------------------------------
Starting Optuna optimization with 50 trials...

  0%|          | 0/50 [00:00<?, ?it/s]
                                      

  0%|          | 0/50 [00:05<?, ?it/s]
Best trial: 0. Best value: 0.968226:   0%|          | 0/50 [00:05<?, ?it/s]
Best trial: 0. Best value: 0.968226:   2%|▏         | 1/50 [00:05<04:47,  5.86s/it]
                                                                                   

Best trial: 0. Best value: 0.968226:   2%|▏         | 1/50 [00:09<04:47,  5.86s/it]
Best trial: 1. Best value: 0.971182:   2%|▏         | 1/50 [00:10<04:47,  5.86s/it]
Best trial: 1. Best value: 0.971182:   4%|▍         | 2/50 [00:10<03:56,  4.92s/it]
                                                                                   

Best trial: 1. Best value: 0.971182:   4%|▍         | 2/50 [00:18<03:56,  4.92s/it]
Best trial: 1. Best value: 0.971182:   4%|▍         | 2/50 [00:18<03:56,  4.92s/it]
Best trial: 1. Best value: 0.971182:   6%|▌         | 3/50 [00:18<05:01,  6.42s/it]
                                                                                   

Best trial: 1. Best value: 0.971182:   6%|▌         | 3/50 [00:23<05:01,  6.42s/it]
Best trial: 1. Best value: 0.971182:   6%|▌         | 3/50 [00:23<05:01,  6.42s/it]
Best trial: 1. Best value: 0.971182:   8%|▊         | 4/50 [00:23<04:37,  6.03s/it]
                                                                                   

Best trial: 1. Best value: 0.971182:   8%|▊         | 4/50 [00:31<04:37,  6.03s/it]
Best trial: 4. Best value: 0.973304:   8%|▊         | 4/50 [00:31<04:37,  6.03s/it]
Best trial: 4. Best value: 0.973304:  10%|█         | 5/50 [00:31<04:55,  6.56s/it]
                                                                                   

Best trial: 4. Best value: 0.973304:  10%|█         | 5/50 [00:39<04:55,  6.56s/it]
Best trial: 4. Best value: 0.973304:  10%|█         | 5/50 [00:40<04:55,  6.56s/it]
Best trial: 4. Best value: 0.973304:  12%|█▏        | 6/50 [00:40<05:21,  7.32s/it]
                                                                                   

Best trial: 4. Best value: 0.973304:  12%|█▏        | 6/50 [00:44<05:21,  7.32s/it]
Best trial: 4. Best value: 0.973304:  12%|█▏        | 6/50 [00:44<05:21,  7.32s/it]
Best trial: 4. Best value: 0.973304:  14%|█▍        | 7/50 [00:44<04:40,  6.53s/it]
                                                                                   

Best trial: 4. Best value: 0.973304:  14%|█▍        | 7/50 [0