[I 2025-07-29 07:40:33,251] Trial 29 finished with value: 0.9649574608017494 and parameters: {'depth': 10, 'learning_rate': 0.04570600977609851, 'l2_leaf_reg': 5.187841454625394, 'bootstrap_type': 'Bayesian', 'bagging_temperature': 0.32033973525791665}. Best is trial 13 with value: 0.9782146894128813.
[W 2025-07-29 07:40:33,399] The parameter 'bagging_temperature' in trial#30 is sampled independently instead of being sampled by multivariate TPE sampler. (optimization performance may be degraded). You can suppress this warning by setting `warn_independent_sampling` to `False` in the constructor of `TPESampler`, if this independent sampling is intended behavior.

Best trial: 13. Best value: 0.978215:  60%|██████    | 30/50 [06:12<05:10, 15.54s/it]
Best trial: 13. Best value: 0.978215:  60%|██████    | 30/50 [06:12<05:10, 15.54s/it]
Best trial: 13. Best value: 0.978215:  62%|██████▏   | 31/50 [06:12<03:50, 12.12s/it]
                                                                                     

Best trial: 13. Best value: 0.978215:  62%|██████▏   | 31/50 [06:12<03:50, 12.12s/it]
                                                                                     

Best trial: 13. Best value: 0.978215:  62%|██████▏   | 31/50 [06:24<03:50, 12.12s/it]
Best trial: 13. Best value: 0.978215:  62%|██████▏   | 31/50 [06:25<03:50, 12.12s/it]
Best trial: 13. Best value: 0.978215:  64%|██████▍   | 32/50 [06:25<03:39, 12.21s/it]
                                                                                     

Best trial: 13. Best value: 0.978215:  64%|██████▍   | 32/50 [06:25<03:39, 12.21s/it]
                                                                                     

Best trial: 13. Best value: 0.978215:  64%|██████▍   | 32/50 [06:46<03:39, 12.21s/it]
Best trial: 13. Best value: 0.978215:  64%|██████▍   | 32/50 [06:46<03:39, 12.21s/it]
Best trial: 13. Best value: 0.978215:  66%|██████▌   | 33/50 [06:46<04:12, 14.86s/it]
                                                                                     

Best trial: 13. Best value: 0.978215:  66%|██████▌   | 33/50 [06:46<04:12, 14.86s/it]
                                                                                     

Best trial: 13. Best value: 0.978215:  66%|██████▌   | 33/50 [06:59<04:12, 14.86s/it]
Best trial: 13. Best value: 0.978215:  66%|██████▌   | 33/50 [06:59<04:12, 14.86s/it]
Best trial: 13. Best value: 0.978215:  68%|██████▊   | 34/50 [06:59<03:49, 14.33s/it]
                                                                                     

Best trial: 13. Best value: 0.978215:  68%|██████▊   | 34/50 [06:59<03:49, 14.33s/it]
                                                                                     

Best trial: 13. Best value: 0.978215:  68%|██████▊   | 34/50 [07:03<03:49, 14.33s/it]
Best trial: 13. Best value: 0.978215:  68%|██████▊   | 34/50 [07:03<03:49, 14.33s/it]
Best trial: 13. Best value: 0.978215:  70%|███████   | 35/50 [07:03<02:49, 11.32s/it]
                                                                                     

Best trial: 13. Best value: 0.978215:  70%|███████   | 35/50 [07:03<02:49, 11.32s/it]
                                                                                     

Best trial: 13. Best value: 0.978215:  70%|███████   | 35/50 [07:17<02:49, 11.32s/it]
Best trial: 13. Best value: 0.978215:  70%|███████   | 35/50 [07:17<02:49, 11.32s/it]
Best trial: 13. Best value: 0.978215:  72%|███████▏  | 36/50 [07:17<02:49, 12.14s/it]
                                                                                     

Best trial: 13. Best value: 0.978215:  72%|███████▏  | 36/50 [07:17<02:49, 12.14s/it]
                                                                                     

Best trial: 13. Best value: 0.978215:  72%|███████▏  | 36/50 [07:39<02:49, 12.14s/it]
Best trial: 13. Best value: 0.978215:  72%|███████▏  | 36/50 [07:39<02:49, 12.14s/it]
Best trial: 13. Best value: 0.978215:  74%|███████▍  | 37/50 [07:39<03:15, 15.02s/it]
                                                                                     

Best trial: 13. Best value: 0.978215:  74%|███████▍  | 37/50 [07:39<03:15, 15.02s/it]
                                                                                     

Best trial: 13. Best value: 0.978215:  74%|███████▍  | 37/50 [07:57<03:15, 15.02s/it]
Best trial: 13. Best value: 0.978215:  74%|███████▍  | 37/50 [07:57<03:15, 15.02s/it]
Best trial: 13. Best value: 0.978215:  76%|███████▌  | 38/50 [07:57<03:10, 15.89s/it]
                                                                                     

Best trial: 13. Best value: 0.978215:  76%|███████▌  | 38/50 [07:57<03:10, 15.89s/it]
                                                                                     

Best trial: 13. Best value: 0.978215:  76%|███████▌  | 38/50 [08:01<03:10, 15.89s/it]
Best trial: 13. Best value: 0.978215:  76%|███████▌  | 38/50 [08:01<03:10, 15.89s/it]
Best trial: 13. Best value: 0.978215:  78%|███████▊  | 39/50 [08:01<02:16, 12.37s/it]
                                                                                     

Best trial: 13. Best value: 0.978215:  78%|███████▊  | 39/50 [08:01<02:16, 12.37s/it]
                                                                                     

Best trial: 13. Best value: 0.978215:  78%|███████▊  | 39/50 [08:05<02:16, 12.37s/it]
Best trial: 13. Best value: 0.978215:  78%|███████▊  | 39/50 [08:05<02:16, 12.37s/it]
Best trial: 13. Best value: 0.978215:  80%|████████  | 40/50 [08:05<01:38,  9.87s/it]
                                                                                     

Best trial: 13. Best value: 0.978215:  80%|████████  | 40/50 [08:05<01:38,  9.87s/it]
                                                                                     

Best trial: 13. Best value: 0.978215:  80%|████████  | 40/50 [08:10<01:38,  9.87s/it]
Best trial: 13. Best value: 0.978215:  80%|████████  | 40/50 [08:10<01:38,  9.87s/it]
Best trial: 13. Best value: 0.978215:  82%|████████▏ | 41/50 [08:10<01:15,  8.44s/it]
                                                                                     

Best trial: 13. Best value: 0.978215:  82%|████████▏ | 41/50 [08:10<01:15,  8.44s/it]
                                                                                     

Best trial: 13. Best value: 0.978215:  82%|████████▏ | 41/50 [08:38<01:15,  8.44s/it]
Best trial: 13. Best value: 0.978215:  82%|████████▏ | 41/50 [08:38<01:15,  8.44s/it]
Best trial: 13. Best value: 0.978215:  84%|████████▍ | 42/50 [08:38<01:53, 14.24s/it]
                                                                                     

Best trial: 13. Best value: 0.978215:  84%|████████▍ | 42/50 [08:38<01:53, 14.24s/it]
                                                                                     
[I 2025-07-29 07:40:37,395] Trial 30 finished with value: 0.9461319246926655 and parameters: {'depth': 4, 'learning_rate': 0.026148658136233696, 'l2_leaf_reg': 1.7248520229761224, 'bootstrap_type': 'Bayesian', 'bagging_temperature': 0.06678635273132338}. Best is trial 13 with value: 0.9782146894128813.
[W 2025-07-29 07:40:37,545] The parameter 'bagging_temperature' in trial#31 is sampled independently instead of being sampled by multivariate TPE sampler. (optimization performance may be degraded). You can suppress this warning by setting `warn_independent_sampling` to `False` in the constructor of `TPESampler`, if this independent sampling is intended behavior.
[I 2025-07-29 07:40:49,796] Trial 31 finished with value: 0.9685547539876833 and parameters: {'depth': 9, 'learning_rate': 0.09184072881345658, 'l2_leaf_reg': 1.9651101800351722, 'bootstrap_type': 'Bayesian', 'bagging_temperature': 0.008637579739690059}. Best is trial 13 with value: 0.9782146894128813.
[W 2025-07-29 07:40:49,944] The parameter 'bagging_temperature' in trial#32 is sampled independently instead of being sampled by multivariate TPE sampler. (optimization performance may be degraded). You can suppress this warning by setting `warn_independent_sampling` to `False` in the constructor of `TPESampler`, if this independent sampling is intended behavior.
[I 2025-07-29 07:41:10,847] Trial 32 finished with value: 0.9592095972890753 and parameters: {'depth': 10, 'learning_rate': 0.027957843818359394, 'l2_leaf_reg': 1.0826652905316665, 'bootstrap_type': 'Bayesian', 'bagging_temperature': 0.030804330278812006}. Best is trial 13 with value: 0.9782146894128813.
[W 2025-07-29 07:41:11,001] The parameter 'bagging_temperature' in trial#33 is sampled independently instead of being sampled by multivariate TPE sampler. (optimization performance may be degraded). You can suppress this warning by setting `warn_independent_sampling` to `False` in the constructor of `TPESampler`, if this independent sampling is intended behavior.
[I 2025-07-29 07:41:23,923] Trial 33 finished with value: 0.972495968327068 and parameters: {'depth': 9, 'learning_rate': 0.07921242913405686, 'l2_leaf_reg': 1.347640226103107, 'bootstrap_type': 'Bayesian', 'bagging_temperature': 0.32008434617418263}. Best is trial 13 with value: 0.9782146894128813.
[W 2025-07-29 07:41:24,081] The parameter 'bagging_temperature' in trial#34 is sampled independently instead of being sampled by multivariate TPE sampler. (optimization performance may be degraded). You can suppress this warning by setting `warn_independent_sampling` to `False` in the constructor of `TPESampler`, if this independent sampling is intended behavior.
[I 2025-07-29 07:41:28,228] Trial 34 finished with value: 0.9674942513284661 and parameters: {'depth': 5, 'learning_rate': 0.09309853455548747, 'l2_leaf_reg': 7.654877281734038, 'bootstrap_type': 'Bayesian', 'bagging_temperature': 0.23662615585652572}. Best is trial 13 with value: 0.9782146894128813.
[W 2025-07-29 07:41:28,379] The parameter 'bagging_temperature' in trial#35 is sampled independently instead of being sampled by multivariate TPE sampler. (optimization performance may be degraded). You can suppress this warning by setting `warn_independent_sampling` to `False` in the constructor of `TPESampler`, if this independent sampling is intended behavior.
[I 2025-07-29 07:41:42,295] Trial 35 finished with value: 0.9727805157979734 and parameters: {'depth': 10, 'learning_rate': 0.19955035330675416, 'l2_leaf_reg': 1.4731535674713232, 'bootstrap_type': 'Bayesian', 'bagging_temperature': 0.19191201478634762}. Best is trial 13 with value: 0.9782146894128813.
[W 2025-07-29 07:41:42,442] The parameter 'bagging_temperature' in trial#36 is sampled independently instead of being sampled by multivariate TPE sampler. (optimization performance may be degraded). You can suppress this warning by setting `warn_independent_sampling` to `False` in the constructor of `TPESampler`, if this independent sampling is intended behavior.
[I 2025-07-29 07:42:04,038] Trial 36 finished with value: 0.9756778080894886 and parameters: {'depth': 10, 'learning_rate': 0.05688780060163178, 'l2_leaf_reg': 1.8090549758613081, 'bootstrap_type': 'Bayesian', 'bagging_temperature': 0.024395410712956145}. Best is trial 13 with value: 0.9782146894128813.
[W 2025-07-29 07:42:04,194] The parameter 'subsample' in trial#37 is sampled independently instead of being sampled by multivariate TPE sampler. (optimization performance may be degraded). You can suppress this warning by setting `warn_independent_sampling` to `False` in the constructor of `TPESampler`, if this independent sampling is intended behavior.
[I 2025-07-29 07:42:21,946] Trial 37 finished with value: 0.9731277190213147 and parameters: {'depth': 10, 'learning_rate': 0.09209730859874364, 'l2_leaf_reg': 1.2074127432419102, 'bootstrap_type': 'Bernoulli', 'subsample': 0.9}. Best is trial 13 with value: 0.9782146894128813.
[W 2025-07-29 07:42:22,094] The parameter 'subsample' in trial#38 is sampled independently instead of being sampled by multivariate TPE sampler. (optimization performance may be degraded). You can suppress this warning by setting `warn_independent_sampling` to `False` in the constructor of `TPESampler`, if this independent sampling is intended behavior.
[I 2025-07-29 07:42:26,100] Trial 38 finished with value: 0.9723532840159406 and parameters: {'depth': 4, 'learning_rate': 0.2366441935150801, 'l2_leaf_reg': 8.911057037781871, 'bootstrap_type': 'Bernoulli', 'subsample': 0.8}. Best is trial 13 with value: 0.9782146894128813.
[W 2025-07-29 07:42:26,247] The parameter 'subsample' in trial#39 is sampled independently instead of being sampled by multivariate TPE sampler. (optimization performance may be degraded). You can suppress this warning by setting `warn_independent_sampling` to `False` in the constructor of `TPESampler`, if this independent sampling is intended behavior.
[I 2025-07-29 07:42:30,131] Trial 39 finished with value: 0.9177273334865976 and parameters: {'depth': 6, 'learning_rate': 0.010034951971297201, 'l2_leaf_reg': 2.8335164802393185, 'bootstrap_type': 'Bernoulli', 'subsample': 0.7}. Best is trial 13 with value: 0.9782146894128813.
[W 2025-07-29 07:42:30,278] The parameter 'subsample' in trial#40 is sampled independently instead of being sampled by multivariate TPE sampler. (optimization performance may be degraded). You can suppress this warning by setting `warn_independent_sampling` to `False` in the constructor of `TPESampler`, if this independent sampling is intended behavior.
[I 2025-07-29 07:42:35,221] Trial 40 finished with value: 0.9733943050829608 and parameters: {'depth': 4, 'learning_rate': 0.20856320179559476, 'l2_leaf_reg': 3.063448883030609, 'bootstrap_type': 'Bernoulli', 'subsample': 0.9}. Best is trial 13 with value: 0.9782146894128813.
[W 2025-07-29 07:42:35,376] The parameter 'bagging_temperature' in trial#41 is sampled independently instead of being sampled by multivariate TPE sampler. (optimization performance may be degraded). You can suppress this warning by setting `warn_independent_sampling` to `False` in the constructor of `TPESampler`, if this independent sampling is intended behavior.
[I 2025-07-29 07:43:03,021] Trial 41 finished with value: 0.9741827842189361 and parameters: {'depth': 10, 'learning_rate': 0.053525469486479016, 'l2_leaf_reg': 2.144724315543804, 'bootstrap_type': 'Bayesian', 'bagging_temperature': 0.057694455482253354}. Best is trial 13 with value: 0.9782146894128813.
[W 2025-07-29 07:43:03,169] The parameter 'bagging_temperature' in trial#42 is sampled independently instead of being sampled by multivariate TPE sampler. (optimization performance may be degraded). You can suppress this warning by setting `warn_independent_sampling` to `False` in the constructor of `TPESampler`, if this independent sampling is intended behavior.

Best trial: 13. Best value: 0.978215:  84%|████████▍ | 42/50 [08:55<01:53, 14.24s/it]
Best trial: 13. Best value: 0.978215:  84%|████████▍ | 42/50 [08:55<01:53, 14.24s/it]
Best trial: 13. Best value: 0.978215:  86%|████████▌ | 43/50 [08:55<01:45, 15.10s/it]
                                                                                     

Best trial: 13. Best value: 0.978215:  86%|████████▌ | 43/50 [08:55<01:45, 15.10s/it]
                                                                                     

Best trial: 13. Best value: 0.978215:  86%|████████▌ | 43/50 [09:12<01:45, 15.10s/it]
Best trial: 13. Best value: 0.978215:  86%|████████▌ | 43/50 [09:12<01:45, 15.10s/it]
Best trial: 13. Best value: 0.978215:  88%|████████▊ | 44/50 [09:12<01:34, 15.68s/it]
                                                                                     

Best trial: 13. Best value: 0.978215:  88%|████████▊ | 44/50 [09:12<01:34, 15.68s/it]
                                                                                     

Best trial: 13. Best value: 0.978215:  88%|████████▊ | 44/50 [09:33<01:34, 15.68s/it]
Best trial: 13. Best value: 0.978215:  88%|████████▊ | 44/50 [09:33<01:34, 15.68s/it]
Best trial: 13. Best value: 0.978215:  90%|█████████ | 45/50 [09:33<01:26, 17.35s/it]
                                                                                     

Best trial: 13. Best value: 0.978215:  90%|█████████ | 45/50 [09:33<01:26, 17.35s/it]
                                                                                     

Best trial: 13. Best value: 0.978215:  90%|█████████ | 45/50 [09:44<01:26, 17.35s/it]
Best trial: 13. Best value: 0.978215:  90%|█████████ | 45/50 [09:44<01:26, 17.35s/it]
Best trial: 13. Best value: 0.978215:  92%|█████████▏| 46/50 [09:44<01:01, 15.36s/it]
                                                                                     

Best trial: 13. Best value: 0.978215:  92%|█████████▏| 46/50 [09:44<01:01, 15.36s/it]
                                                                                     

Best trial: 13. Best value: 0.978215:  92%|█████████▏| 46/50 [10:02<01:01, 15.36s/it]
Best trial: 13. Best value: 0.978215:  92%|█████████▏| 46/50 [10:02<01:01, 15.36s/it]
Best trial: 13. Best value: 0.978215:  94%|█████████▍| 47/50 [10:02<00:48, 16.32s/it]
                                                                                     

Best trial: 13. Best value: 0.978215:  94%|█████████▍| 47/50 [10:03<00:48, 16.32s/it]
                                                                                     

Best trial: 13. Best value: 0.978215:  94%|█████████▍| 47/50 [10:16<00:48, 16.32s/it]
Best trial: 13. Best value: 0.978215:  94%|█████████▍| 47/50 [10:16<00:48, 16.32s/it]
Best trial: 13. Best value: 0.978215:  96%|█████████▌| 48/50 [10:16<00:30, 15.42s/it]
                                                                                     

Best trial: 13. Best value: 0.978215:  96%|█████████▌| 48/50 [10:16<00:30, 15.42s/it]
                                                                                     

Best trial: 13. Best value: 0.978215:  96%|█████████▌| 48/50 [10:34<00:30, 15.42s/it]
Best trial: 13. Best value: 0.978215:  96%|█████████▌| 48/50 [10:34<00:30, 15.42s/it]
Best trial: 13. Best value: 0.978215:  98%|█████████▊| 49/50 [10:34<00:16, 16.33s/it]
                                                                                     

Best trial: 13. Best value: 0.978215:  98%|█████████▊| 49/50 [10:34<00:16, 16.33s/it]
                                                                                     

Best trial: 13. Best value: 0.978215:  98%|█████████▊| 49/50 [10:52<00:16, 16.33s/it]
Best trial: 13. Best value: 0.978215:  98%|█████████▊| 49/50 [10:52<00:16, 16.33s/it]
Best trial: 13. Best value: 0.978215: 100%|██████████| 50/50 [10:52<00:00, 16.73s/it]
Best trial: 13. Best value: 0.978215: 100%|██████████| 50/50 [10:52<00:00, 13.05s/it]

2025-07-29 07:45:17,241 - CatBoostTrainer - INFO - ✓ Optimization completed in 652.4 seconds!

2025-07-29 07:45:17,241 - CatBoostTrainer - INFO - Best F1-macro (CV): 0.9782 (±0.0126)

2025-07-29 07:45:17,242 - CatBoostTrainer - INFO - Final model training with best hyperparameters...
[I 2025-07-29 07:43:20,127] Trial 42 finished with value: 0.9715926758401968 and parameters: {'depth': 10, 'learning_rate': 0.08867459367914904, 'l2_leaf_reg': 1.2513227240654505, 'bootstrap_type': 'Bayesian', 'bagging_temperature': 0.011974805311240837}. Best is trial 13 with value: 0.9782146894128813.
[W 2025-07-29 07:43:20,285] The parameter 'subsample' in trial#43 is sampled independently instead of being sampled by multivariate TPE sampler. (optimization performance may be degraded). You can suppress this warning by setting `warn_independent_sampling` to `False` in the constructor of `TPESampler`, if this independent sampling is intended behavior.
[I 2025-07-29 07:43:37,148] Trial 43 finished with value: 0.9571508467366069 and parameters: {'depth': 10, 'learning_rate': 0.02145418073853736, 'l2_leaf_reg': 1.9247582725583798, 'bootstrap_type': 'Bernoulli', 'subsample': 1.0}. Best is trial 13 with value: 0.9782146894128813.
[W 2025-07-29 07:43:37,298] The parameter 'subsample' in trial#44 is sampled independently instead of being sampled by multivariate TPE sampler. (optimization performance may be degraded). You can suppress this warning by setting `warn_independent_sampling` to `False` in the constructor of `TPESampler`, if this independent sampling is intended behavior.
[I 2025-07-29 07:43:58,386] Trial 44 finished with value: 0.9765524167661717 and parameters: {'depth': 10, 'learning_rate': 0.10401915469885706, 'l2_leaf_reg': 4.3822310337690125, 'bootstrap_type': 'Bernoulli', 'subsample': 0.8}. Best is trial 13 with value: 0.9782146894128813.
[W 2025-07-29 07:43:58,547] The parameter 'subsample' in trial#45 is sampled independently instead of being sampled by multivariate TPE sampler. (optimization performance may be degraded). You can suppress this warning by setting `warn_independent_sampling` to `False` in the constructor of `TPESampler`, if this independent sampling is intended behavior.
[I 2025-07-29 07:44:09,117] Trial 45 finished with value: 0.9724612248783948 and parameters: {'depth': 9, 'learning_rate': 0.11166624611723222, 'l2_leaf_reg': 3.9861807544749603, 'bootstrap_type': 'Bernoulli', 'subsample': 0.8}. Best is trial 13 with value: 0.9782146894128813.
[W 2025-07-29 07:44:09,270] The parameter 'subsample' in trial#46 is sampled independently instead of being sampled by multivariate TPE sampler. (optimization performance may be degraded). You can suppress this warning by setting `warn_independent_sampling` to `False` in the constructor of `TPESampler`, if this independent sampling is intended behavior.
