[I 2025-07-29 07:05:34,966] Trial 35 finished with value: 0.9465010950818717 and parameters: {'n_d': 16, 'batch_size': 512, 'virtual_bs_ratio': 0.5, 'n_steps': 5, 'gamma': 1.0, 'lambda_sparse': 6.2969708438241455e-06, 'lr': 0.024287373208247236, 'weight_decay': 0.0004912248276550453, 'mask_type': 'sparsemax', 'cat_emb_dim': 3}. Best is trial 35 with value: 0.9465010950818717.

Early stopping occurred at epoch 100 with best_epoch = 70 and best_val_0_logloss = 0.17166

Early stopping occurred at epoch 90 with best_epoch = 60 and best_val_0_logloss = 0.18106

Early stopping occurred at epoch 75 with best_epoch = 45 and best_val_0_logloss = 0.34499

Early stopping occurred at epoch 88 with best_epoch = 58 and best_val_0_logloss = 0.25634

Early stopping occurred at epoch 68 with best_epoch = 38 and best_val_0_logloss = 0.18882
[I 2025-07-29 07:07:57,908] Trial 36 finished with value: 0.9168440874057164 and parameters: {'n_d': 32, 'batch_size': 512, 'virtual_bs_ratio': 0.5, 'n_steps': 5, 'gamma': 1.0, 'lambda_sparse': 2.8208216588235186e-06, 'lr': 0.02393671515993508, 'weight_decay': 0.0005000809267307223, 'mask_type': 'sparsemax', 'cat_emb_dim': 2}. Best is trial 35 with value: 0.9465010950818717.

Early stopping occurred at epoch 78 with best_epoch = 48 and best_val_0_logloss = 0.39293

Early stopping occurred at epoch 96 with best_epoch = 66 and best_val_0_logloss = 0.18694

Early stopping occurred at epoch 92 with best_epoch = 62 and best_val_0_logloss = 0.37226

Early stopping occurred at epoch 100 with best_epoch = 70 and best_val_0_logloss = 0.17995

Early stopping occurred at epoch 119 with best_epoch = 89 and best_val_0_logloss = 0.19848
[I 2025-07-29 07:09:32,033] Trial 37 finished with value: 0.6460931417002947 and parameters: {'n_d': 16, 'batch_size': 1024, 'virtual_bs_ratio': 0.5, 'n_steps': 5, 'gamma': 1.0, 'lambda_sparse': 5.016758276916501e-06, 'lr': 0.01939507666542437, 'weight_decay': 0.00048155023234764717, 'mask_type': 'sparsemax', 'cat_emb_dim': 3}. Best is trial 35 with value: 0.9465010950818717.

Early stopping occurred at epoch 88 with best_epoch = 58 and best_val_0_logloss = 0.37003

Early stopping occurred at epoch 51 with best_epoch = 21 and best_val_0_logloss = 0.46151

Early stopping occurred at epoch 60 with best_epoch = 30 and best_val_0_logloss = 0.26545

Early stopping occurred at epoch 117 with best_epoch = 87 and best_val_0_logloss = 0.22941

Early stopping occurred at epoch 112 with best_epoch = 82 and best_val_0_logloss = 0.35333

Best trial: 35. Best value: 0.946501:  76%|███████▌  | 38/50 [1:16:08<26:42, 133.54s/it]
Best trial: 35. Best value: 0.946501:  76%|███████▌  | 38/50 [1:16:08<26:42, 133.54s/it]
Best trial: 35. Best value: 0.946501:  78%|███████▊  | 39/50 [1:16:08<20:00, 109.14s/it]
                                                                                        

Best trial: 35. Best value: 0.946501:  78%|███████▊  | 39/50 [1:18:40<20:00, 109.14s/it]
Best trial: 35. Best value: 0.946501:  78%|███████▊  | 39/50 [1:18:40<20:00, 109.14s/it]
Best trial: 35. Best value: 0.946501:  80%|████████  | 40/50 [1:18:40<20:20, 122.07s/it]
2025-07-29 07:14:00,924 - TabNetTrainer - WARNING - Trial 40 fold 3 failed: 

2025-07-29 07:14:27,014 - TabNetTrainer - WARNING - Trial 40 fold 4 failed: 

                                                                                        

Best trial: 35. Best value: 0.946501:  80%|████████  | 40/50 [1:20:11<20:20, 122.07s/it]
Best trial: 35. Best value: 0.946501:  80%|████████  | 40/50 [1:20:11<20:20, 122.07s/it]
Best trial: 35. Best value: 0.946501:  82%|████████▏ | 41/50 [1:20:11<16:53, 112.61s/it]
                                                                                        

Best trial: 35. Best value: 0.946501:  82%|████████▏ | 41/50 [1:22:27<16:53, 112.61s/it]
Best trial: 35. Best value: 0.946501:  82%|████████▏ | 41/50 [1:22:27<16:53, 112.61s/it]
Best trial: 35. Best value: 0.946501:  84%|████████▍ | 42/50 [1:22:27<15:57, 119.63s/it]
                                                                                        

Best trial: 35. Best value: 0.946501:  84%|████████▍ | 42/50 [1:25:11<15:57, 119.63s/it]
Best trial: 35. Best value: 0.946501:  84%|████████▍ | 42/50 [1:25:11<15:57, 119.63s/it]
Best trial: 35. Best value: 0.946501:  86%|████████▌ | 43/50 [1:25:11<15:30, 132.95s/it]
2025-07-29 07:20:44,398 - TabNetTrainer - WARNING - Trial 43 fold 3 failed: 

2025-07-29 07:21:10,397 - TabNetTrainer - WARNING - Trial 43 fold 4 failed: 

                                                                                        

Best trial: 35. Best value: 0.946501:  86%|████████▌ | 43/50 [1:26:54<15:30, 132.95s/it]
Best trial: 35. Best value: 0.946501:  86%|████████▌ | 43/50 [1:26:54<15:30, 132.95s/it]
Best trial: 35. Best value: 0.946501:  88%|████████▊ | 44/50 [1:26:54<12:24, 124.07s/it]
                                                                                        

Best trial: 35. Best value: 0.946501:  88%|████████▊ | 44/50 [1:29:42<12:24, 124.07s/it]
Best trial: 35. Best value: 0.946501:  88%|████████▊ | 44/50 [1:29:42<12:24, 124.07s/it]
Best trial: 35. Best value: 0.946501:  90%|█████████ | 45/50 [1:29:42<11:26, 137.24s/it]
2025-07-29 07:25:06,798 - TabNetTrainer - WARNING - Trial 45 fold 3 failed: 

2025-07-29 07:25:19,847 - TabNetTrainer - WARNING - Trial 45 fold 4 failed: 

                                                                                        

Best trial: 35. Best value: 0.946501:  90%|█████████ | 45/50 [1:31:04<11:26, 137.24s/it]
Best trial: 35. Best value: 0.946501:  90%|█████████ | 45/50 [1:31:04<11:26, 137.24s/it]
Best trial: 35. Best value: 0.946501:  92%|█████████▏| 46/50 [1:31:04<08:02, 120.51s/it]
2025-07-29 07:26:08,063 - TabNetTrainer - WARNING - Trial 46 fold 4 failed: 

                                                                                        

Best trial: 35. Best value: 0.946501:  92%|█████████▏| 46/50 [1:31:52<08:02, 120.51s/it]
Best trial: 35. Best value: 0.946501:  92%|█████████▏| 46/50 [1:31:52<08:02, 120.51s/it]
Best trial: 35. Best value: 0.946501:  94%|█████████▍| 47/50 [1:31:52<04:56, 98.82s/it] 
                                                                                       

Best trial: 35. Best value: 0.946501:  94%|█████████▍| 47/50 [1:34:07<04:56, 98.82s/it]
Best trial: 35. Best value: 0.946501:  94%|█████████▍| 47/50 [1:34:07<04:56, 98.82s/it]
Best trial: 35. Best value: 0.946501:  96%|█████████▌| 48/50 [1:34:07<03:39, 109.69s/it][I 2025-07-29 07:10:24,237] Trial 38 finished with value: 0.612272352389939 and parameters: {'n_d': 48, 'batch_size': 2048, 'virtual_bs_ratio': 0.5, 'n_steps': 5, 'gamma': 1.0, 'lambda_sparse': 2.4128831650266604e-05, 'lr': 0.026086153533846634, 'weight_decay': 0.0008479781326264864, 'mask_type': 'sparsemax', 'cat_emb_dim': 2}. Best is trial 35 with value: 0.9465010950818717.

Early stopping occurred at epoch 57 with best_epoch = 27 and best_val_0_logloss = 0.36991

Early stopping occurred at epoch 76 with best_epoch = 46 and best_val_0_logloss = 0.1606

Early stopping occurred at epoch 137 with best_epoch = 107 and best_val_0_logloss = 0.22948

Early stopping occurred at epoch 96 with best_epoch = 66 and best_val_0_logloss = 0.1518

Early stopping occurred at epoch 74 with best_epoch = 44 and best_val_0_logloss = 0.10827
[I 2025-07-29 07:12:56,465] Trial 39 finished with value: 0.9127327814266379 and parameters: {'n_d': 16, 'batch_size': 512, 'virtual_bs_ratio': 0.5, 'n_steps': 5, 'gamma': 1.0, 'lambda_sparse': 1.3637452294363471e-05, 'lr': 0.011607872486572184, 'weight_decay': 0.0002642795625776839, 'mask_type': 'sparsemax', 'cat_emb_dim': 3}. Best is trial 35 with value: 0.9465010950818717.

Early stopping occurred at epoch 96 with best_epoch = 66 and best_val_0_logloss = 0.44787

Early stopping occurred at epoch 119 with best_epoch = 89 and best_val_0_logloss = 0.43687

Early stopping occurred at epoch 147 with best_epoch = 117 and best_val_0_logloss = 0.41962

Early stopping occurred at epoch 131 with best_epoch = 101 and best_val_0_logloss = 0.37362

Early stopping occurred at epoch 185 with best_epoch = 155 and best_val_0_logloss = 0.22121
[I 2025-07-29 07:14:27,014] Trial 40 finished with value: 0.6116485864113091 and parameters: {'n_d': 32, 'batch_size': 2048, 'virtual_bs_ratio': 0.5, 'n_steps': 5, 'gamma': 1.4, 'lambda_sparse': 4.446164280470546e-06, 'lr': 0.002035175472373475, 'weight_decay': 0.00062502374370816, 'mask_type': 'sparsemax', 'cat_emb_dim': 3}. Best is trial 35 with value: 0.9465010950818717.

Early stopping occurred at epoch 92 with best_epoch = 62 and best_val_0_logloss = 0.24987

Early stopping occurred at epoch 66 with best_epoch = 36 and best_val_0_logloss = 0.2392

Early stopping occurred at epoch 148 with best_epoch = 118 and best_val_0_logloss = 0.19846

Early stopping occurred at epoch 77 with best_epoch = 47 and best_val_0_logloss = 0.2597

Early stopping occurred at epoch 66 with best_epoch = 36 and best_val_0_logloss = 0.20317
[I 2025-07-29 07:16:43,019] Trial 41 finished with value: 0.9099773526977748 and parameters: {'n_d': 16, 'batch_size': 512, 'virtual_bs_ratio': 0.5, 'n_steps': 4, 'gamma': 1.1, 'lambda_sparse': 1.8978288942618547e-05, 'lr': 0.018201496211654778, 'weight_decay': 0.00013728889190662834, 'mask_type': 'sparsemax', 'cat_emb_dim': 3}. Best is trial 35 with value: 0.9465010950818717.

Early stopping occurred at epoch 147 with best_epoch = 117 and best_val_0_logloss = 0.14228

Early stopping occurred at epoch 70 with best_epoch = 40 and best_val_0_logloss = 0.1915

Early stopping occurred at epoch 117 with best_epoch = 87 and best_val_0_logloss = 0.17606

Early stopping occurred at epoch 80 with best_epoch = 50 and best_val_0_logloss = 0.18031

Early stopping occurred at epoch 135 with best_epoch = 105 and best_val_0_logloss = 0.09505
[I 2025-07-29 07:19:27,038] Trial 42 finished with value: 0.940661163565552 and parameters: {'n_d': 16, 'batch_size': 512, 'virtual_bs_ratio': 0.5, 'n_steps': 4, 'gamma': 1.1, 'lambda_sparse': 7.947812010842653e-06, 'lr': 0.02263591089342963, 'weight_decay': 0.0003981191067384879, 'mask_type': 'entmax', 'cat_emb_dim': 3}. Best is trial 35 with value: 0.9465010950818717.

Early stopping occurred at epoch 53 with best_epoch = 23 and best_val_0_logloss = 0.30226

Early stopping occurred at epoch 68 with best_epoch = 38 and best_val_0_logloss = 0.23963

Early stopping occurred at epoch 61 with best_epoch = 31 and best_val_0_logloss = 0.37018

Early stopping occurred at epoch 74 with best_epoch = 44 and best_val_0_logloss = 0.41884

Early stopping occurred at epoch 87 with best_epoch = 57 and best_val_0_logloss = 0.13667
[I 2025-07-29 07:21:10,397] Trial 43 finished with value: 0.6348422111260259 and parameters: {'n_d': 16, 'batch_size': 512, 'virtual_bs_ratio': 0.5, 'n_steps': 4, 'gamma': 1.2, 'lambda_sparse': 1.074049223442739e-05, 'lr': 0.022667535113769188, 'weight_decay': 0.00038060074094008086, 'mask_type': 'sparsemax', 'cat_emb_dim': 3}. Best is trial 35 with value: 0.9465010950818717.

Early stopping occurred at epoch 170 with best_epoch = 140 and best_val_0_logloss = 0.12802

Early stopping occurred at epoch 130 with best_epoch = 100 and best_val_0_logloss = 0.07522

Early stopping occurred at epoch 115 with best_epoch = 85 and best_val_0_logloss = 0.2129

Early stopping occurred at epoch 102 with best_epoch = 72 and best_val_0_logloss = 0.22994

Early stopping occurred at epoch 56 with best_epoch = 26 and best_val_0_logloss = 0.17985
[I 2025-07-29 07:23:58,356] Trial 44 finished with value: 0.9301312653182252 and parameters: {'n_d': 16, 'batch_size': 512, 'virtual_bs_ratio': 0.5, 'n_steps': 4, 'gamma': 1.1, 'lambda_sparse': 7.808353866121266e-06, 'lr': 0.02988102635969139, 'weight_decay': 0.00047683634436867335, 'mask_type': 'sparsemax', 'cat_emb_dim': 3}. Best is trial 35 with value: 0.9465010950818717.

Early stopping occurred at epoch 56 with best_epoch = 26 and best_val_0_logloss = 0.30616

Early stopping occurred at epoch 80 with best_epoch = 50 and best_val_0_logloss = 0.18625

Early stopping occurred at epoch 92 with best_epoch = 62 and best_val_0_logloss = 0.34053

Early stopping occurred at epoch 122 with best_epoch = 92 and best_val_0_logloss = 0.15642

Early stopping occurred at epoch 70 with best_epoch = 40 and best_val_0_logloss = 0.17116
[I 2025-07-29 07:25:19,847] Trial 45 finished with value: 0.646159969748485 and parameters: {'n_d': 16, 'batch_size': 1024, 'virtual_bs_ratio': 0.25, 'n_steps': 4, 'gamma': 1.3, 'lambda_sparse': 5.083079376440666e-06, 'lr': 0.02007871138646277, 'weight_decay': 0.0007067941614022172, 'mask_type': 'entmax', 'cat_emb_dim': 3}. Best is trial 35 with value: 0.9465010950818717.

Early stopping occurred at epoch 132 with best_epoch = 102 and best_val_0_logloss = 0.2388

Early stopping occurred at epoch 61 with best_epoch = 31 and best_val_0_logloss = 0.3719

Early stopping occurred at epoch 77 with best_epoch = 47 and best_val_0_logloss = 0.44375

Early stopping occurred at epoch 85 with best_epoch = 55 and best_val_0_logloss = 0.29048

Early stopping occurred at epoch 102 with best_epoch = 72 and best_val_0_logloss = 0.17843
[I 2025-07-29 07:26:08,064] Trial 46 finished with value: 0.728588812988113 and parameters: {'n_d': 16, 'batch_size': 2048, 'virtual_bs_ratio': 0.5, 'n_steps': 4, 'gamma': 1.2, 'lambda_sparse': 3.160419823796823e-06, 'lr': 0.025224368991654034, 'weight_decay': 0.0009704304257330915, 'mask_type': 'sparsemax', 'cat_emb_dim': 3}. Best is trial 35 with value: 0.9465010950818717.

Early stopping occurred at epoch 74 with best_epoch = 44 and best_val_0_logloss = 0.34808

Early stopping occurred at epoch 182 with best_epoch = 152 and best_val_0_logloss = 0.14819

Early stopping occurred at epoch 67 with best_epoch = 37 and best_val_0_logloss = 0.35263

Early stopping occurred at epoch 81 with best_epoch = 51 and best_val_0_logloss = 0.30908

Early stopping occurred at epoch 69 with best_epoch = 39 and best_val_0_logloss = 0.22169
[I 2025-07-29 07:28:23,117] Trial 47 finished with value: 0.8956198528985041 and parameters: {'n_d': 16, 'batch_size': 512, 'virtual_bs_ratio': 0.25, 'n_steps': 3, 'gamma': 1.1, 'lambda_sparse': 1.258233075948817e-06, 'lr': 0.01303559409591518, 'weight_decay': 0.0005730049159897699, 'mask_type': 'entmax', 'cat_emb_dim': 3}. Best is trial 35 with value: 0.9465010950818717.

Early stopping occurred at epoch 82 with best_epoch = 52 and best_val_0_logloss = 0.32129

Early stopping occurred at epoch 60 with best_epoch = 30 and best_val_0_logloss = 0.30591

Early stopping occurred at epoch 94 with best_epoch = 64 and best_val_0_logloss = 0.40633

2025-07-29 07:30:01,979 - TabNetTrainer - WARNING - Trial 48 fold 3 failed: 

2025-07-29 07:30:23,315 - TabNetTrainer - WARNING - Trial 48 fold 4 failed: 

                                                                                        

Best trial: 35. Best value: 0.946501:  96%|█████████▌| 48/50 [1:36:07<03:39, 109.69s/it]
Best trial: 35. Best value: 0.946501:  96%|█████████▌| 48/50 [1:36:07<03:39, 109.69s/it]
Best trial: 35. Best value: 0.946501:  98%|█████████▊| 49/50 [1:36:07<01:52, 112.85s/it]
                                                                                        

Best trial: 35. Best value: 0.946501:  98%|█████████▊| 49/50 [1:39:22<01:52, 112.85s/it]
Best trial: 35. Best value: 0.946501:  98%|█████████▊| 49/50 [1:39:22<01:52, 112.85s/it]
Best trial: 35. Best value: 0.946501: 100%|██████████| 50/50 [1:39:22<00:00, 137.54s/it]
Best trial: 35. Best value: 0.946501: 100%|██████████| 50/50 [1:39:22<00:00, 119.26s/it]

2025-07-29 07:33:38,624 - TabNetTrainer - INFO - ✓ Optimization completed in 5962.9 seconds!

2025-07-29 07:33:38,625 - TabNetTrainer - INFO - Best F1-macro (CV): 0.9465 (±0.0225)

2025-07-29 07:33:38,625 - TabNetTrainer - INFO - Final model training with best hyperparameters...

2025-07-29 07:33:38,628 - TabNetTrainer - INFO - Training final TabNet model with optimized parameters...

Early stopping occurred at epoch 84 with best_epoch = 54 and best_val_0_logloss = 0.417

Early stopping occurred at epoch 73 with best_epoch = 43 and best_val_0_logloss = 0.18001
[I 2025-07-29 07:30:23,315] Trial 48 finished with value: 0.6229458495223884 and parameters: {'n_d': 32, 'batch_size': 512, 'virtual_bs_ratio': 0.5, 'n_steps': 4, 'gamma': 1.4, 'lambda_sparse': 5.2111433445543376e-05, 'lr': 0.005068275556649716, 'weight_decay': 0.00033439441064598934, 'mask_type': 'sparsemax', 'cat_emb_dim': 2}. Best is trial 35 with value: 0.9465010950818717.

Early stopping occurred at epoch 91 with best_epoch = 61 and best_val_0_logloss = 0.30775

Early stopping occurred at epoch 129 with best_epoch = 99 and best_val_0_logloss = 0.18916

Early stopping occurred at epoch 123 with best_epoch = 93 and best_val_0_logloss = 0.25786

Early stopping occurred at epoch 144 with best_epoch = 114 and best_val_0_logloss = 0.22044

Early stopping occurred at epoch 76 with best_epoch = 46 and best_val_0_logloss = 0.1385
