+ python main.py --compare --csv ../data/aims_dataset.csv --n-trials 30 --n-trials-tabnet 30

2025-07-28 21:38:09,544 - RandomForestTrainer - INFO - Starting Random Forest Training Pipeline...

2025-07-28 21:38:09,544 - RandomForestTrainer - INFO - Loading and preprocessing dataset from ../data/aims_dataset.csv ...

2025-07-28 21:38:09,681 - RandomForestTrainer - INFO - Applying Custom Weighted-Impact Labeling...

2025-07-28 21:38:10,105 - RandomForestTrainer - INFO - Splitting data into temporal-aware training and holdout sets...

2025-07-28 21:38:10,111 - RandomForestTrainer - INFO - Setting up output directory...

2025-07-28 21:38:11,705 - RandomForestTrainer - INFO - Creating base model pipeline...

2025-07-28 21:38:11,705 - RandomForestTrainer - INFO - Configure and Run Hyperparameter Optimization (HPO) with Optuna ...
[I 2025-07-28 21:38:11,706] A new study created in memory with name: no-name-466de140-ea87-47b3-b3e2-5f20fe030fab

2025-07-28 21:38:11,706 - RandomForestTrainer - INFO - Starting Optuna optimization with 30 trials...
================================================================================
AIMS FRAMEWORK - MODEL TRAINING ORCHESTRATOR
================================================================================
Start Time: 2025-07-28 21:38:09
Dataset: ../data/aims_dataset.csv
Random State: 42
--------------------------------------------------------------------------------

[1/3] Training Random Forest Classifier...
------------------------------------------------------------

================================================================================
RANDOM FOREST TRAINING PIPELINE - AIMS FRAMEWORK
================================================================================
Configuration:
  - Dataset: ../data/aims_dataset.csv
  - CV Folds: 5
  - Optuna Trials: 30
  - Random State: 42
  - Parallel Jobs: -1
================================================================================
------------------------------------------------------------
[Step 1/11] Loading and preprocessing dataset...
------------------------------------------------------------
✓ Raw dataset shape: (5400, 18)
✓ Preprocessed dataset shape: (5400, 25)
------------------------------------------------------------
[Step 2/11] Applying Custom Weighted-Impact Labeling...
------------------------------------------------------------
✓ Feature matrix shape : (5400, 25)
✓ Temporal groups      : 25
✓ Impact distribution :
   count  percent (%)
0    768        14.22
1   1013        18.76
2   2715        50.28
3    904        16.74
------------------------------------------------------------
[Step 3/11] Splitting data into temporal-aware training and holdout sets...
------------------------------------------------------------
✓ Numerical features: 20
✓ Categorical features: 5
✓ Training set : 4576 samples (84.7%)
✓ Holdout set  : 824 samples (15.3%)
------------------------------------------------------------
[Step 4/11] Setting up output directory...
------------------------------------------------------------
✓ Results will be saved to: /results/random_forest
✓ Saving artifact files (features, labels, groups, and class weights)...
✓ Features, labels, groups, and class weights saved.
------------------------------------------------------------
[Step 5/11] Creating base model pipeline...
------------------------------------------------------------
✓ Base model pipeline created: Preprocessor → RandomForestClassifier
------------------------------------------------------------
[Step 6/11] Configure and Run Hyperparameter Optimization (HPO) with Optuna ...
------------------------------------------------------------
Starting Optuna optimization with 30 trials...

  0%|          | 0/30 [00:00<?, ?it/s]
                                      

  0%|          | 0/30 [00:09<?, ?it/s]
Best trial: 0. Best value: 0.981586:   0%|          | 0/30 [00:09<?, ?it/s]
Best trial: 0. Best value: 0.981586:   3%|▎         | 1/30 [00:09<04:45,  9.85s/it]
                                                                                   

Best trial: 0. Best value: 0.981586:   3%|▎         | 1/30 [00:36<04:45,  9.85s/it]
Best trial: 0. Best value: 0.981586:   3%|▎         | 1/30 [00:36<04:45,  9.85s/it]
Best trial: 0. Best value: 0.981586:   7%|▋         | 2/30 [00:36<09:20, 20.02s/it]
                                                                                   

Best trial: 0. Best value: 0.981586:   7%|▋         | 2/30 [00:49<09:20, 20.02s/it]
Best trial: 0. Best value: 0.981586:   7%|▋         | 2/30 [00:49<09:20, 20.02s/it]
Best trial: 0. Best value: 0.981586:  10%|█         | 3/30 [00:49<07:31, 16.72s/it]
                                                                                   

Best trial: 0. Best value: 0.981586:  10%|█         | 3/30 [01:05<07:31, 16.72s/it]
Best trial: 3. Best value: 0.982002:  10%|█         | 3/30 [01:05<07:31, 16.72s/it]
Best trial: 3. Best value: 0.982002:  13%|█▎        | 4/30 [01:05<07:07, 16.45s/it]
                                                                                   

Best trial: 3. Best value: 0.982002:  13%|█▎        | 4/30 [01:15<07:07, 16.45s/it]
Best trial: 3. Best value: 0.982002:  13%|█▎        | 4/30 [01:15<07:07, 16.45s/it]
Best trial: 3. Best value: 0.982002:  17%|█▋        | 5/30 [01:15<05:49, 13.96s/it]
                                                                                   

Best trial: 3. Best value: 0.982002:  17%|█▋        | 5/30 [01:33<05:49, 13.96s/it]
Best trial: 3. Best value: 0.982002:  17%|█▋        | 5/30 [01:33<05:49, 13.96s/it]
Best trial: 3. Best value: 0.982002:  20%|██        | 6/30 [01:33<06:12, 15.54s/it]
                                                                                   

Best trial: 3. Best value: 0.982002:  20%|██        | 6/30 [01:56<06:12, 15.54s/it]
Best trial: 3. Best value: 0.982002:  20%|██        | 6/30 [01:56<06:12, 15.54s/it]
Best trial: 3. Best value: 0.982002:  23%|██▎       | 7/30 [01:56<06:49, 17.79s/it]
                                                                                   

Best trial: 3. Best value: 0.982002:  23%|██▎       | 7/30 [02:01<06:49, 17.79s/it]
Best trial: 3. Best value: 0.982002:  23%|██▎       | 7/30 [02:01<06:49, 17.79s/it]
Best trial: 3. Best value: 0.982002:  27%|██▋       | 8/30 [02:01<05:01, 13.72s/it]
                                                                                   

Best trial: 3. Best value: 0.982002:  27%|██▋       | 8/30 [02:06<05:01, 13.72s/it]
Best trial: 3. Best value: 0.982002:  27%|██▋       | 8/30 [02:06<05:01, 13.72s/it]
Best trial: 3. Best value: 0.982002:  30%|███       | 9/30 [02:06<03:49, 10.95s/it]
                                                                                   

Best trial: 3. Best value: 0.982002:  30%|███       | 9/30 [02:21<03:49, 10.95s/it]
Best trial: 3. Best value: 0.982002:  30%|███       | 9/30 [02:22<03:49, 10.95s/it]
Best trial: 3. Best value: 0.982002:  33%|███▎      | 10/30 [02:22<04:08, 12.44s/it]
                                                                                    

Best trial: 3. Best value: 0.982002:  33%|███▎      | 10/30 [02:38<04:08, 12.44s/it]
Best trial: 3. Best value: 0.982002:  33%|███▎      | 10/30 [02:38<04:08, 12.44s/it]
Best trial: 3. Best value: 0.982002:  37%|███▋      | 11/30 [02:38<04:17, 13.58s/it]
                                                                                    

Best trial: 3. Best value: 0.982002:  37%|███▋      | 11/30 [02:57<04:17, 13.58s/it]
Best trial: 3. Best value: 0.982002:  37%|███▋      | 11/30 [02:57<04:17, 13.58s/it]
Best trial: 3. Best value: 0.982002:  40%|████      | 12/30 [02:57<04:35, 15.29s/it]
                                                                                    

Best trial: 3. Best value: 0.982002:  40%|████      | 12/30 [03:03<04:35, 15.29s/it]
Best trial: 3. Best value: 0.982002:  40%|████      | 12/30 [03:04<04:35, 15.29s/it]
Best trial: 3. Best value: 0.982002:  43%|████▎     | 13/30 [03:04<03:35, 12.68s/it]
                                                                                    

Best trial: 3. Best value: 0.982002:  43%|████▎     | 13/30 [03:16<03:35, 12.68s/it]
Best trial: 3. Best value: 0.982002:  43%|████▎     | 13/30 [03:16<03:35, 12.68s/it]
Best trial: 3. Best value: 0.982002:  47%|████▋     | 14/30 [03:16<03:23, 12.70s/it]
                                                                                    

Best trial: 3. Best value: 0.982002:  47%|████▋     | 14/30 [03:35<03:23, 12.70s/it]
Best trial: 3. Best value: 0.982002:  47%|████▋     | 14/30 [03:35<03:23, 12.70s/it]
Best trial: 3. Best value: 0.982002:  50%|█████     | 15/30 [03:35<03:35, 14.39s/it]
                                                                                    

Best trial: 3. Best value: 0.982002:  50%|█████     | 15/30 [04:01<03:35, 14.39s/it]
Best trial: 3. Best value: 0.982002:  50%|█████     | 15/30 [04:01<03:35, 14.39s/it]
Best trial: 3. Best value: 0.982002:  53%|█████▎    | 16/30 [04:01<04:10, 17.90s/it]
                                                                                    

Best trial: 3. Best value: 0.982002:  53%|█████▎    | 16/30 [04:16<04:10, 17.90s/it]
Best trial: 3. Best value: 0.982002:  53%|█████▎    | 16/30 [04:16<04:10, 17.90s/it]
Best trial: 3. Best value: 0.982002:  57%|█████▋    | 17/30 [04:16<03:44, 17.26s/it]
                                                                                    

Best trial: 3. Best value: 0.982002:  57%|█████▋    | 17/30 [04:29<03:44, 17.26s/it]
Best trial: 3. Best value: 0.982002:  57%|█████▋    | 17/30 [04:29<03:44, 17.26s/it]
Best trial: 3. Best value: 0.982002:  60%|██████    | 18/30 [04:29<03:10, 15.84s/it]
                                                                                    

Best trial: 3. Best value: 0.982002:  60%|██████    | 18/30 [04:31<03:10, 15.84s/it]
Best trial: 3. Best value: 0.982002:  60%|██████    | 18/30 [04:31<03:10, 15.84s/it]
Best trial: 3. Best value: 0.982002:  63%|██████▎   | 19/30 [04:31<02:08, 11.64s/it]
                                                                                    

Best trial: 3. Best value: 0.982002:  63%|██████▎   | 19/30 [04:36<02:08, 11.64s/it]
Best trial: 3. Best value: 0.982002:  63%|██████▎   | 19/30 [04:36<02:08, 11.64s/it]
Best trial: 3. Best value: 0.982002:  67%|██████▋   | 20/30 [04:36<01:35,  9.58s/it]
                                                                                    

Best trial: 3. Best value: 0.982002:  67%|██████▋   | 20/30 [04:48<01:35,  9.58s/it]
Best trial: 3. Best value: 0.982002:  67%|██████▋   | 20/30 [04:49<01:35,  9.58s/it]
Best trial: 3. Best value: 0.982002:  70%|███████   | 21/30 [04:49<01:35, 10.58s/it]
                                                                                    

Best trial: 3. Best value: 0.982002:  70%|███████   | 21/30 [05:11<01:35, 10.58s/it]
Best trial: 3. Best value: 0.982002:  70%|███████   | 21/30 [05:11<01:35, 10.58s/it]
Best trial: 3. Best value: 0.982002:  73%|███████▎  | 22/30 [05:11<01:52, 14.04s/it]
                                                                                    

Best trial: 3. Best value: 0.982002:  73%|███████▎  | 22/30 [05:27<01:52, 14.04s/it]
Best trial: 3. Best value: 0.982002:  73%|███████▎  | 22/30 [05:27<01:52, 14.04s/it]
Best trial: 3. Best value: 0.982002:  77%|███████▋  | 23/30 [05:27<01:42, 14.66s/it]
                                                                                    

Best trial: 3. Best value: 0.982002:  77%|███████▋  | 23/30 [05:49<01:42, 14.66s/it]
Best trial: 3. Best value: 0.982002:  77%|███████▋  | 23/30 [05:49<01:42, 14.66s/it]
Best trial: 3. Best value: 0.982002:  80%|████████  | 24/30 [05:49<01:41, 16.97s/it]
                                                                                    

Best trial: 3. Best value: 0.982002:  80%|████████  | 24/30 [06:08<01:41, 16.97s/it]
Best trial: 3. Best value: 0.982002:  80%|████████  | 24/30 [06:08<01:41, 16.97s/it]
Best trial: 3. Best value: 0.982002:  83%|████████▎ | 25/30 [06:08<01:28, 17.66s/it]
                                                                                    

Best trial: 3. Best value: 0.982002:  83%|████████▎ | 25/30 [06:28<01:28, 17.66s/it]
Best trial: 3. Best value: 0.982002:  83%|████████▎ | 25/30 [06:28<01:28, 17.66s/it]
Best trial: 3. Best value: 0.982002:  87%|████████▋ | 26/30 [06:28<01:12, 18.13s/it]
                                                                                    

Best trial: 3. Best value: 0.982002:  87%|████████▋ | 26/30 [06:32<01:12, 18.13s/it]
Best trial: 3. Best value: 0.982002:  87%|████████▋ | 26/30 [06:33<01:12, 18.13s/it]
Best trial: 3. Best value: 0.982002:  90%|█████████ | 27/30 [06:33<00:42, 14.17s/it]
                                                                                    

Best trial: 3. Best value: 0.982002:  90%|█████████ | 27/30 [07:04<00:42, 14.17s/it]
Best trial: 3. Best value: 0.982002:  90%|█████████ | 27/30 [07:04<00:42, 14.17s/it]
Best trial: 3. Best value: 0.982002:  93%|█████████▎| 28/30 [07:04<00:38, 19.42s/it]
                                                                                    

Best trial: 3. Best value: 0.982002:  93%|█████████▎| 28/30 [07:10<00:38, 19.42s/it]
Best trial: 3. Best value: 0.982002:  93%|█████████▎| 28/30 [07:11<00:38, 19.42s/it]
Best trial: 3. Best value: 0.982002:  97%|█████████▋| 29/30 [07:11<00:15, 15.50s/it]
                                                                                    

Best trial: 3. Best value: 0.982002:  97%|█████████▋| 29/30 [07:23<00:15, 15.50s/it]
Best trial: 3. Best value: 0.982002:  97%|█████████▋| 29/30 [07:23<00:15, 15.50s/it]
Best trial: 3. Best value: 0.982002: 100%|██████████| 30/30 [07:23<00:00, 14.68s/it]
Best trial: 3. Best value: 0.982002: 100%|██████████| 30/30 [07:23<00:00, 14.79s/it]

2025-07-28 21:45:35,528 - RandomForestTrainer - INFO - ✓ Optimization completed in 443.8 seconds!

2025-07-28 21:45:35,529 - RandomForestTrainer - INFO - Best F1-macro (CV): 0.9820 (±0.0059)

2025-07-28 21:45:35,529 - RandomForestTrainer - INFO - Final model training with best hyperparameters...

2025-07-28 21:45:35,530 - RandomForestTrainer - INFO - Starting final fitting...

2025-07-28 21:45:39,376 - RandomForestTrainer - INFO - ✓ Final model fitting completed in 3.85 seconds!

2025-07-28 21:45:39,521 - RandomForestTrainer - INFO - ✓ Final model saved to: /results/random_forest/random_forest_model.pkl

2025-07-28 21:45:39,521 - RandomForestTrainer - INFO - Evaluating final model on the holdout set and saving results...

2025-07-28 21:45:39,658 - RandomForestTrainer - INFO - Save Results: CSV and JSON Files...
[I 2025-07-28 21:38:21,469] Trial 0 finished with value: 0.9815863628513164 and parameters: {'n_estimators': 300, 'max_depth': None, 'min_samples_leaf': 1, 'max_features': 0.5}. Best is trial 0 with value: 0.9815863628513164.
[I 2025-07-28 21:38:48,615] Trial 1 finished with value: 0.9789526389559473 and parameters: {'n_estimators': 600, 'max_depth': 10, 'min_samples_leaf': 1, 'max_features': 0.8}. Best is trial 0 with value: 0.9815863628513164.
[I 2025-07-28 21:39:01,397] Trial 2 finished with value: 0.9803581391760755 and parameters: {'n_estimators': 400, 'max_depth': 10, 'min_samples_leaf': 2, 'max_features': 0.5}. Best is trial 0 with value: 0.9815863628513164.
[I 2025-07-28 21:39:17,426] Trial 3 finished with value: 0.9820024999005295 and parameters: {'n_estimators': 500, 'max_depth': 20, 'min_samples_leaf': 1, 'max_features': 0.5}. Best is trial 3 with value: 0.9820024999005295.
[I 2025-07-28 21:39:26,994] Trial 4 finished with value: 0.9809656052597084 and parameters: {'n_estimators': 300, 'max_depth': 10, 'min_samples_leaf': 3, 'max_features': 0.5}. Best is trial 3 with value: 0.9820024999005295.
[I 2025-07-28 21:39:45,594] Trial 5 finished with value: 0.979432226306732 and parameters: {'n_estimators': 600, 'max_depth': 20, 'min_samples_leaf': 5, 'max_features': 0.5}. Best is trial 3 with value: 0.9820024999005295.
[I 2025-07-28 21:40:08,018] Trial 6 finished with value: 0.9813825597381263 and parameters: {'n_estimators': 500, 'max_depth': None, 'min_samples_leaf': 2, 'max_features': 0.8}. Best is trial 3 with value: 0.9820024999005295.
[I 2025-07-28 21:40:13,029] Trial 7 finished with value: 0.9721231090872227 and parameters: {'n_estimators': 300, 'max_depth': 30, 'min_samples_leaf': 1, 'max_features': 'sqrt'}. Best is trial 3 with value: 0.9820024999005295.
[I 2025-07-28 21:40:17,865] Trial 8 finished with value: 0.9788509115892785 and parameters: {'n_estimators': 100, 'max_depth': None, 'min_samples_leaf': 1, 'max_features': 0.8}. Best is trial 3 with value: 0.9820024999005295.
[I 2025-07-28 21:40:33,669] Trial 9 finished with value: 0.9791937640491017 and parameters: {'n_estimators': 500, 'max_depth': None, 'min_samples_leaf': 4, 'max_features': 0.5}. Best is trial 3 with value: 0.9820024999005295.
[I 2025-07-28 21:40:49,816] Trial 10 finished with value: 0.9820024999005295 and parameters: {'n_estimators': 500, 'max_depth': 20, 'min_samples_leaf': 1, 'max_features': 0.5}. Best is trial 3 with value: 0.9820024999005295.
[I 2025-07-28 21:41:09,008] Trial 11 finished with value: 0.9820024999005295 and parameters: {'n_estimators': 600, 'max_depth': 20, 'min_samples_leaf': 1, 'max_features': 0.5}. Best is trial 3 with value: 0.9820024999005295.
[I 2025-07-28 21:41:15,710] Trial 12 finished with value: 0.9787027396082921 and parameters: {'n_estimators': 200, 'max_depth': 20, 'min_samples_leaf': 1, 'max_features': 0.5}. Best is trial 3 with value: 0.9820024999005295.
[I 2025-07-28 21:41:28,453] Trial 13 finished with value: 0.9721672355654934 and parameters: {'n_estimators': 800, 'max_depth': 20, 'min_samples_leaf': 1, 'max_features': 'sqrt'}. Best is trial 3 with value: 0.9820024999005295.
[I 2025-07-28 21:41:46,767] Trial 14 finished with value: 0.9794074427421646 and parameters: {'n_estimators': 400, 'max_depth': 20, 'min_samples_leaf': 1, 'max_features': 0.8}. Best is trial 3 with value: 0.9820024999005295.
[I 2025-07-28 21:42:12,790] Trial 15 finished with value: 0.981702975547621 and parameters: {'n_estimators': 800, 'max_depth': 30, 'min_samples_leaf': 1, 'max_features': 0.5}. Best is trial 3 with value: 0.9820024999005295.
[I 2025-07-28 21:42:28,589] Trial 16 finished with value: 0.9808156340246915 and parameters: {'n_estimators': 500, 'max_depth': 20, 'min_samples_leaf': 3, 'max_features': 0.5}. Best is trial 3 with value: 0.9820024999005295.
[I 2025-07-28 21:42:41,119] Trial 17 finished with value: 0.9595070414313713 and parameters: {'n_estimators': 800, 'max_depth': None, 'min_samples_leaf': 4, 'max_features': 'sqrt'}. Best is trial 3 with value: 0.9820024999005295.
[I 2025-07-28 21:42:42,972] Trial 18 finished with value: 0.959873337200904 and parameters: {'n_estimators': 100, 'max_depth': None, 'min_samples_leaf': 4, 'max_features': 'sqrt'}. Best is trial 3 with value: 0.9820024999005295.
[I 2025-07-28 21:42:47,737] Trial 19 finished with value: 0.9789647060417839 and parameters: {'n_estimators': 100, 'max_depth': 30, 'min_samples_leaf': 4, 'max_features': 0.8}. Best is trial 3 with value: 0.9820024999005295.
[I 2025-07-28 21:43:00,638] Trial 20 finished with value: 0.980963122206177 and parameters: {'n_estimators': 400, 'max_depth': 30, 'min_samples_leaf': 1, 'max_features': 0.5}. Best is trial 3 with value: 0.9820024999005295.
[I 2025-07-28 21:43:22,781] Trial 21 finished with value: 0.9808734987742914 and parameters: {'n_estimators': 700, 'max_depth': 20, 'min_samples_leaf': 2, 'max_features': 0.5}. Best is trial 3 with value: 0.9820024999005295.
[I 2025-07-28 21:43:38,880] Trial 22 finished with value: 0.9820024999005295 and parameters: {'n_estimators': 500, 'max_depth': 20, 'min_samples_leaf': 1, 'max_features': 0.5}. Best is trial 3 with value: 0.9820024999005295.
[I 2025-07-28 21:44:01,234] Trial 23 finished with value: 0.9815804402737536 and parameters: {'n_estimators': 700, 'max_depth': 10, 'min_samples_leaf': 1, 'max_features': 0.5}. Best is trial 3 with value: 0.9820024999005295.
[I 2025-07-28 21:44:20,519] Trial 24 finished with value: 0.9820024999005295 and parameters: {'n_estimators': 600, 'max_depth': None, 'min_samples_leaf': 1, 'max_features': 0.5}. Best is trial 3 with value: 0.9820024999005295.
[I 2025-07-28 21:44:39,717] Trial 25 finished with value: 0.9820024999005295 and parameters: {'n_estimators': 600, 'max_depth': 20, 'min_samples_leaf': 1, 'max_features': 0.5}. Best is trial 3 with value: 0.9820024999005295.
[I 2025-07-28 21:44:44,660] Trial 26 finished with value: 0.9690559974190073 and parameters: {'n_estimators': 300, 'max_depth': 20, 'min_samples_leaf': 2, 'max_features': 'sqrt'}. Best is trial 3 with value: 0.9820024999005295.
[I 2025-07-28 21:45:16,346] Trial 27 finished with value: 0.9789319706925431 and parameters: {'n_estimators': 700, 'max_depth': 20, 'min_samples_leaf': 1, 'max_features': 0.8}. Best is trial 3 with value: 0.9820024999005295.
[I 2025-07-28 21:45:22,681] Trial 28 finished with value: 0.9603517175012423 and parameters: {'n_estimators': 400, 'max_depth': 10, 'min_samples_leaf': 5, 'max_features': 'sqrt'}. Best is trial 3 with value: 0.9820024999005295.
