[I 2025-07-29 05:55:54,864] Trial 0 finished with value: 0.8615035335832664 and parameters: {'n_d': 32, 'batch_size': 512, 'virtual_bs_ratio': 0.25, 'n_steps': 3, 'gamma': 1.5, 'lambda_sparse': 6.358358856676247e-05, 'lr': 0.01111498944309497, 'weight_decay': 1.0994335574766187e-05, 'mask_type': 'sparsemax', 'cat_emb_dim': 1}. Best is trial 0 with value: 0.8615035335832664.

Early stopping occurred at epoch 154 with best_epoch = 124 and best_val_0_logloss = 0.37681

Early stopping occurred at epoch 103 with best_epoch = 73 and best_val_0_logloss = 0.36618

Early stopping occurred at epoch 112 with best_epoch = 82 and best_val_0_logloss = 0.55279

Early stopping occurred at epoch 105 with best_epoch = 75 and best_val_0_logloss = 0.37628

Early stopping occurred at epoch 117 with best_epoch = 87 and best_val_0_logloss = 0.27702
[I 2025-07-29 05:57:05,292] Trial 1 finished with value: 0.8542075374559218 and parameters: {'n_d': 16, 'batch_size': 2048, 'virtual_bs_ratio': 0.25, 'n_steps': 4, 'gamma': 1.0, 'lambda_sparse': 7.523742884534855e-06, 'lr': 0.0034766491505926187, 'weight_decay': 8.168455894760161e-05, 'mask_type': 'sparsemax', 'cat_emb_dim': 2}. Best is trial 0 with value: 0.8615035335832664.

Early stopping occurred at epoch 57 with best_epoch = 27 and best_val_0_logloss = 0.50771

Early stopping occurred at epoch 140 with best_epoch = 110 and best_val_0_logloss = 0.35337

Early stopping occurred at epoch 120 with best_epoch = 90 and best_val_0_logloss = 0.49341

Early stopping occurred at epoch 70 with best_epoch = 40 and best_val_0_logloss = 0.57814

Early stopping occurred at epoch 125 with best_epoch = 95 and best_val_0_logloss = 0.37493
[I 2025-07-29 05:58:47,359] Trial 2 finished with value: 0.8316802431362091 and parameters: {'n_d': 48, 'batch_size': 1024, 'virtual_bs_ratio': 0.5, 'n_steps': 5, 'gamma': 1.4, 'lambda_sparse': 8.200518402245835e-06, 'lr': 0.0013940346079873232, 'weight_decay': 0.000233596350262616, 'mask_type': 'sparsemax', 'cat_emb_dim': 2}. Best is trial 0 with value: 0.8615035335832664.

Early stopping occurred at epoch 131 with best_epoch = 101 and best_val_0_logloss = 0.18337

Early stopping occurred at epoch 156 with best_epoch = 126 and best_val_0_logloss = 0.16342

Early stopping occurred at epoch 145 with best_epoch = 115 and best_val_0_logloss = 0.20296

Early stopping occurred at epoch 63 with best_epoch = 33 and best_val_0_logloss = 0.26922

Early stopping occurred at epoch 89 with best_epoch = 59 and best_val_0_logloss = 0.11371
[I 2025-07-29 06:01:34,623] Trial 3 finished with value: 0.9306822995103655 and parameters: {'n_d': 16, 'batch_size': 512, 'virtual_bs_ratio': 0.5, 'n_steps': 4, 'gamma': 1.1, 'lambda_sparse': 0.0008105016126411582, 'lr': 0.013962563737015753, 'weight_decay': 0.0007568292060167617, 'mask_type': 'sparsemax', 'cat_emb_dim': 3}. Best is trial 3 with value: 0.9306822995103655.

Early stopping occurred at epoch 136 with best_epoch = 106 and best_val_0_logloss = 0.29639
Stop training because you reached max_epochs = 200 with best_epoch = 199 and best_val_0_logloss = 0.23428

Early stopping occurred at epoch 160 with best_epoch = 130 and best_val_0_logloss = 0.44291

Early stopping occurred at epoch 62 with best_epoch = 32 and best_val_0_logloss = 0.46917

Early stopping occurred at epoch 135 with best_epoch = 105 and best_val_0_logloss = 0.20895
[I 2025-07-29 06:03:06,292] Trial 4 finished with value: 0.8885314855388105 and parameters: {'n_d': 16, 'batch_size': 2048, 'virtual_bs_ratio': 0.25, 'n_steps': 5, 'gamma': 1.2, 'lambda_sparse': 6.963114377829292e-06, 'lr': 0.006333268775321841, 'weight_decay': 1.913588048769229e-05, 'mask_type': 'sparsemax', 'cat_emb_dim': 3}. Best is trial 3 with value: 0.9306822995103655.

Early stopping occurred at epoch 61 with best_epoch = 31 and best_val_0_logloss = 0.56471

Early stopping occurred at epoch 89 with best_epoch = 59 and best_val_0_logloss = 0.43877

Early stopping occurred at epoch 74 with best_epoch = 44 and best_val_0_logloss = 0.58206

Early stopping occurred at epoch 84 with best_epoch = 54 and best_val_0_logloss = 0.48003

Early stopping occurred at epoch 92 with best_epoch = 62 and best_val_0_logloss = 0.25533
[I 2025-07-29 06:03:53,734] Trial 5 finished with value: 0.8270657916989614 and parameters: {'n_d': 64, 'batch_size': 2048, 'virtual_bs_ratio': 0.5, 'n_steps': 5, 'gamma': 1.0, 'lambda_sparse': 1.1895896737553539e-05, 'lr': 0.0014830392684568009, 'weight_decay': 0.0005323617594751496, 'mask_type': 'sparsemax', 'cat_emb_dim': 1}. Best is trial 3 with value: 0.9306822995103655.

Early stopping occurred at epoch 48 with best_epoch = 18 and best_val_0_logloss = 0.47888

Early stopping occurred at epoch 131 with best_epoch = 101 and best_val_0_logloss = 0.2588

Early stopping occurred at epoch 53 with best_epoch = 23 and best_val_0_logloss = 0.61057

Early stopping occurred at epoch 57 with best_epoch = 27 and best_val_0_logloss = 0.42637

Early stopping occurred at epoch 79 with best_epoch = 49 and best_val_0_logloss = 0.20814
[I 2025-07-29 06:04:54,324] Trial 6 finished with value: 0.8392538386272197 and parameters: {'n_d': 32, 'batch_size': 1024, 'virtual_bs_ratio': 0.25, 'n_steps': 3, 'gamma': 1.4, 'lambda_sparse': 0.00019158219548093185, 'lr': 0.006746437142284307, 'weight_decay': 0.0003482846706526881, 'mask_type': 'entmax', 'cat_emb_dim': 2}. Best is trial 3 with value: 0.9306822995103655.

Early stopping occurred at epoch 89 with best_epoch = 59 and best_val_0_logloss = 0.42291

Early stopping occurred at epoch 118 with best_epoch = 88 and best_val_0_logloss = 0.23724

Early stopping occurred at epoch 66 with best_epoch = 36 and best_val_0_logloss = 0.41757

Early stopping occurred at epoch 53 with best_epoch = 23 and best_val_0_logloss = 0.56415

Early stopping occurred at epoch 122 with best_epoch = 92 and best_val_0_logloss = 0.36022
[I 2025-07-29 06:05:46,815] Trial 7 finished with value: 0.849515446256748 and parameters: {'n_d': 16, 'batch_size': 2048, 'virtual_bs_ratio': 0.5, 'n_steps': 5, 'gamma': 1.1, 'lambda_sparse': 1.7027416886764403e-05, 'lr': 0.013062931388340918, 'weight_decay': 2.8681134821030064e-05, 'mask_type': 'entmax', 'cat_emb_dim': 1}. Best is trial 3 with value: 0.9306822995103655.

Early stopping occurred at epoch 88 with best_epoch = 58 and best_val_0_logloss = 0.2524

Early stopping occurred at epoch 99 with best_epoch = 69 and best_val_0_logloss = 0.22093

Early stopping occurred at epoch 91 with best_epoch = 61 and best_val_0_logloss = 0.40067

Early stopping occurred at epoch 77 with best_epoch = 47 and best_val_0_logloss = 0.23639

Early stopping occurred at epoch 95 with best_epoch = 65 and best_val_0_logloss = 0.22985
[I 2025-07-29 06:06:53,022] Trial 8 finished with value: 0.9138715342496079 and parameters: {'n_d': 64, 'batch_size': 2048, 'virtual_bs_ratio': 0.25, 'n_steps': 5, 'gamma': 1.3, 'lambda_sparse': 0.00026443593078398644, 'lr': 0.021068591627429092, 'weight_decay': 4.325207525386527e-05, 'mask_type': 'entmax', 'cat_emb_dim': 2}. Best is trial 3 with value: 0.9306822995103655.

Early stopping occurred at epoch 60 with best_epoch = 30 and best_val_0_logloss = 0.37202

Early stopping occurred at epoch 83 with best_epoch = 53 and best_val_0_logloss = 0.30621

Early stopping occurred at epoch 74 with best_epoch = 44 and best_val_0_logloss = 0.50126

Early stopping occurred at epoch 68 with best_epoch = 38 and best_val_0_logloss = 0.34052

Early stopping occurred at epoch 48 with best_epoch = 18 and best_val_0_logloss = 0.23765

Best trial: 3. Best value: 0.930682:  18%|█▊        | 9/50 [14:10<47:32, 69.58s/it]
Best trial: 3. Best value: 0.930682:  18%|█▊        | 9/50 [14:10<47:32, 69.58s/it]
Best trial: 3. Best value: 0.930682:  20%|██        | 10/50 [14:10<51:13, 76.83s/it]
                                                                                    

Best trial: 3. Best value: 0.930682:  20%|██        | 10/50 [15:23<51:13, 76.83s/it]
Best trial: 3. Best value: 0.930682:  20%|██        | 10/50 [15:23<51:13, 76.83s/it]
Best trial: 3. Best value: 0.930682:  22%|██▏       | 11/50 [15:23<49:15, 75.78s/it]
2025-07-29 06:10:20,057 - TabNetTrainer - WARNING - Trial 11 fold 4 failed: 

                                                                                    

Best trial: 3. Best value: 0.930682:  22%|██▏       | 11/50 [16:04<49:15, 75.78s/it]
Best trial: 3. Best value: 0.930682:  22%|██▏       | 11/50 [16:04<49:15, 75.78s/it]
Best trial: 3. Best value: 0.930682:  24%|██▍       | 12/50 [16:04<41:12, 65.07s/it]
                                                                                    

Best trial: 3. Best value: 0.930682:  24%|██▍       | 12/50 [17:49<41:12, 65.07s/it]
Best trial: 3. Best value: 0.930682:  24%|██▍       | 12/50 [17:49<41:12, 65.07s/it]
Best trial: 3. Best value: 0.930682:  26%|██▌       | 13/50 [17:49<47:35, 77.19s/it]
                                                                                    

Best trial: 3. Best value: 0.930682:  26%|██▌       | 13/50 [20:41<47:35, 77.19s/it]
Best trial: 3. Best value: 0.930682:  26%|██▌       | 13/50 [20:41<47:35, 77.19s/it]
Best trial: 3. Best value: 0.930682:  28%|██▊       | 14/50 [20:41<1:03:27, 105.75s/it]
                                                                                       

Best trial: 3. Best value: 0.930682:  28%|██▊       | 14/50 [23:41<1:03:27, 105.75s/it]
Best trial: 3. Best value: 0.930682:  28%|██▊       | 14/50 [23:41<1:03:27, 105.75s/it]
Best trial: 3. Best value: 0.930682:  30%|███       | 15/50 [23:41<1:14:46, 128.20s/it]
                                                                                       

Best trial: 3. Best value: 0.930682:  30%|███       | 15/50 [25:59<1:14:46, 128.20s/it]
Best trial: 3. Best value: 0.930682:  30%|███       | 15/50 [26:00<1:14:46, 128.20s/it]
Best trial: 3. Best value: 0.930682:  32%|███▏      | 16/50 [26:00<1:14:24, 131.30s/it]
                                                                                       

Best trial: 3. Best value: 0.930682:  32%|███▏      | 16/50 [28:04<1:14:24, 131.30s/it]
Best trial: 3. Best value: 0.930682:  32%|███▏      | 16/50 [28:04<1:14:24, 131.30s/it]
Best trial: 3. Best value: 0.930682:  34%|███▍      | 17/50 [28:04<1:11:04, 129.24s/it]
                                                                                       

Best trial: 3. Best value: 0.930682:  34%|███▍      | 17/50 [30:31<1:11:04, 129.24s/it]
Best trial: 3. Best value: 0.930682:  34%|███▍      | 17/50 [30:32<1:11:04, 129.24s/it]
Best trial: 3. Best value: 0.930682:  36%|███▌      | 18/50 [30:32<1:11:53, 134.78s/it]
                                                                                       

Best trial: 3. Best value: 0.930682:  36%|███▌      | 18/50 [32:32<1:11:53, 134.78s/it]
Best trial: 3. Best value: 0.930682:  36%|███▌      | 18/50 [32:32<1:11:53, 134.78s/it]
Best trial: 3. Best value: 0.930682:  38%|███▊      | 19/50 [32:32<1:07:27, 130.56s/it][I 2025-07-29 06:08:26,104] Trial 9 finished with value: 0.865974569987771 and parameters: {'n_d': 64, 'batch_size': 512, 'virtual_bs_ratio': 0.25, 'n_steps': 3, 'gamma': 1.2, 'lambda_sparse': 0.0006741074265640696, 'lr': 0.003001994695240296, 'weight_decay': 0.00010903884523201111, 'mask_type': 'sparsemax', 'cat_emb_dim': 3}. Best is trial 3 with value: 0.9306822995103655.

Early stopping occurred at epoch 84 with best_epoch = 54 and best_val_0_logloss = 0.40201

Early stopping occurred at epoch 69 with best_epoch = 39 and best_val_0_logloss = 0.33847

Early stopping occurred at epoch 59 with best_epoch = 29 and best_val_0_logloss = 0.41582

Early stopping occurred at epoch 79 with best_epoch = 49 and best_val_0_logloss = 0.3896

Early stopping occurred at epoch 87 with best_epoch = 57 and best_val_0_logloss = 0.26807
[I 2025-07-29 06:09:39,486] Trial 10 finished with value: 0.8622538012963995 and parameters: {'n_d': 64, 'batch_size': 1024, 'virtual_bs_ratio': 0.25, 'n_steps': 4, 'gamma': 1.3, 'lambda_sparse': 1.4270403521460853e-06, 'lr': 0.00257985094645041, 'weight_decay': 0.0006554382343546282, 'mask_type': 'sparsemax', 'cat_emb_dim': 2}. Best is trial 3 with value: 0.9306822995103655.

Early stopping occurred at epoch 103 with best_epoch = 73 and best_val_0_logloss = 0.40793

Early stopping occurred at epoch 55 with best_epoch = 25 and best_val_0_logloss = 0.49318

Early stopping occurred at epoch 57 with best_epoch = 27 and best_val_0_logloss = 0.71127

Early stopping occurred at epoch 133 with best_epoch = 103 and best_val_0_logloss = 0.42748

Early stopping occurred at epoch 61 with best_epoch = 31 and best_val_0_logloss = 0.38719
[I 2025-07-29 06:10:20,057] Trial 11 finished with value: 0.6782976105467471 and parameters: {'n_d': 64, 'batch_size': 2048, 'virtual_bs_ratio': 0.5, 'n_steps': 4, 'gamma': 1.3, 'lambda_sparse': 7.954064937683937e-05, 'lr': 0.006185918211556435, 'weight_decay': 1.5155823539597614e-05, 'mask_type': 'sparsemax', 'cat_emb_dim': 1}. Best is trial 3 with value: 0.9306822995103655.

Early stopping occurred at epoch 101 with best_epoch = 71 and best_val_0_logloss = 0.49385
Stop training because you reached max_epochs = 200 with best_epoch = 194 and best_val_0_logloss = 0.20057

Early stopping occurred at epoch 66 with best_epoch = 36 and best_val_0_logloss = 0.64258

Early stopping occurred at epoch 56 with best_epoch = 26 and best_val_0_logloss = 0.71608

Early stopping occurred at epoch 109 with best_epoch = 79 and best_val_0_logloss = 0.25841
[I 2025-07-29 06:12:05,122] Trial 12 finished with value: 0.8265871844548907 and parameters: {'n_d': 16, 'batch_size': 1024, 'virtual_bs_ratio': 0.25, 'n_steps': 4, 'gamma': 1.1, 'lambda_sparse': 0.00011825328508422651, 'lr': 0.003726104236509948, 'weight_decay': 0.0007472397689332936, 'mask_type': 'entmax', 'cat_emb_dim': 1}. Best is trial 3 with value: 0.9306822995103655.

Early stopping occurred at epoch 47 with best_epoch = 17 and best_val_0_logloss = 0.3045

Early stopping occurred at epoch 187 with best_epoch = 157 and best_val_0_logloss = 0.08138

Early stopping occurred at epoch 78 with best_epoch = 48 and best_val_0_logloss = 0.26581

Early stopping occurred at epoch 122 with best_epoch = 92 and best_val_0_logloss = 0.18475

Early stopping occurred at epoch 78 with best_epoch = 48 and best_val_0_logloss = 0.14747
[I 2025-07-29 06:14:56,879] Trial 13 finished with value: 0.9000659850022122 and parameters: {'n_d': 64, 'batch_size': 512, 'virtual_bs_ratio': 0.25, 'n_steps': 4, 'gamma': 1.1, 'lambda_sparse': 1.902428324748959e-06, 'lr': 0.02114932281416455, 'weight_decay': 0.0006321732490144021, 'mask_type': 'sparsemax', 'cat_emb_dim': 2}. Best is trial 3 with value: 0.9306822995103655.

Early stopping occurred at epoch 130 with best_epoch = 100 and best_val_0_logloss = 0.72164
Stop training because you reached max_epochs = 200 with best_epoch = 185 and best_val_0_logloss = 0.30746

Early stopping occurred at epoch 68 with best_epoch = 38 and best_val_0_logloss = 0.76803

Early stopping occurred at epoch 107 with best_epoch = 77 and best_val_0_logloss = 0.34178

Early stopping occurred at epoch 117 with best_epoch = 87 and best_val_0_logloss = 0.29226
[I 2025-07-29 06:17:57,102] Trial 14 finished with value: 0.8405233656841608 and parameters: {'n_d': 48, 'batch_size': 512, 'virtual_bs_ratio': 0.25, 'n_steps': 3, 'gamma': 1.5, 'lambda_sparse': 6.596099207886096e-05, 'lr': 0.0010317753795327884, 'weight_decay': 1.5956700210656615e-05, 'mask_type': 'sparsemax', 'cat_emb_dim': 1}. Best is trial 3 with value: 0.9306822995103655.

Early stopping occurred at epoch 78 with best_epoch = 48 and best_val_0_logloss = 0.22294

Early stopping occurred at epoch 111 with best_epoch = 81 and best_val_0_logloss = 0.18424

Early stopping occurred at epoch 53 with best_epoch = 23 and best_val_0_logloss = 0.35785

Early stopping occurred at epoch 73 with best_epoch = 43 and best_val_0_logloss = 0.2308

Early stopping occurred at epoch 75 with best_epoch = 45 and best_val_0_logloss = 0.14917
[I 2025-07-29 06:20:15,604] Trial 15 finished with value: 0.917253561622624 and parameters: {'n_d': 32, 'batch_size': 512, 'virtual_bs_ratio': 0.5, 'n_steps': 5, 'gamma': 1.2, 'lambda_sparse': 0.0005284384205738843, 'lr': 0.028348557934720253, 'weight_decay': 4.47608582981903e-05, 'mask_type': 'entmax', 'cat_emb_dim': 3}. Best is trial 3 with value: 0.9306822995103655.

Early stopping occurred at epoch 62 with best_epoch = 32 and best_val_0_logloss = 0.30357

Early stopping occurred at epoch 79 with best_epoch = 49 and best_val_0_logloss = 0.29083

Early stopping occurred at epoch 90 with best_epoch = 60 and best_val_0_logloss = 0.16479

Early stopping occurred at epoch 96 with best_epoch = 66 and best_val_0_logloss = 0.22096

Early stopping occurred at epoch 80 with best_epoch = 50 and best_val_0_logloss = 0.21013
[I 2025-07-29 06:22:20,036] Trial 16 finished with value: 0.9188446798120594 and parameters: {'n_d': 32, 'batch_size': 512, 'virtual_bs_ratio': 0.5, 'n_steps': 4, 'gamma': 1.2, 'lambda_sparse': 0.0007874906755535074, 'lr': 0.02949317608247478, 'weight_decay': 0.0001525342151796965, 'mask_type': 'entmax', 'cat_emb_dim': 3}. Best is trial 3 with value: 0.9306822995103655.

Early stopping occurred at epoch 58 with best_epoch = 28 and best_val_0_logloss = 0.27818

Early stopping occurred at epoch 176 with best_epoch = 146 and best_val_0_logloss = 0.13383

Early stopping occurred at epoch 90 with best_epoch = 60 and best_val_0_logloss = 0.24009

Early stopping occurred at epoch 101 with best_epoch = 71 and best_val_0_logloss = 0.20948

Early stopping occurred at epoch 66 with best_epoch = 36 and best_val_0_logloss = 0.24
[I 2025-07-29 06:24:47,738] Trial 17 finished with value: 0.9222185786637693 and parameters: {'n_d': 32, 'batch_size': 512, 'virtual_bs_ratio': 0.5, 'n_steps': 4, 'gamma': 1.1, 'lambda_sparse': 0.0009360707472765235, 'lr': 0.01226569690877057, 'weight_decay': 0.00019480005358814734, 'mask_type': 'entmax', 'cat_emb_dim': 3}. Best is trial 3 with value: 0.9306822995103655.

Early stopping occurred at epoch 63 with best_epoch = 33 and best_val_0_logloss = 0.23042

Early stopping occurred at epoch 98 with best_epoch = 68 and best_val_0_logloss = 0.18053

Early stopping occurred at epoch 71 with best_epoch = 41 and best_val_0_logloss = 0.28342

Early stopping occurred at epoch 70 with best_epoch = 40 and best_val_0_logloss = 0.15198

Early stopping occurred at epoch 70 with best_epoch = 40 and best_val_0_logloss = 0.18677
