[I 2025-07-29 07:44:27,669] Trial 46 finished with value: 0.9773806661866467 and parameters: {'depth': 10, 'learning_rate': 0.12440232668122969, 'l2_leaf_reg': 4.443292356682405, 'bootstrap_type': 'Bernoulli', 'subsample': 0.8}. Best is trial 13 with value: 0.9782146894128813.
[W 2025-07-29 07:44:27,820] The parameter 'subsample' in trial#47 is sampled independently instead of being sampled by multivariate TPE sampler. (optimization performance may be degraded). You can suppress this warning by setting `warn_independent_sampling` to `False` in the constructor of `TPESampler`, if this independent sampling is intended behavior.
[I 2025-07-29 07:44:40,975] Trial 47 finished with value: 0.9741619523189786 and parameters: {'depth': 10, 'learning_rate': 0.23050442421071354, 'l2_leaf_reg': 4.293664243662829, 'bootstrap_type': 'Bernoulli', 'subsample': 0.8}. Best is trial 13 with value: 0.9782146894128813.
[W 2025-07-29 07:44:41,138] The parameter 'subsample' in trial#48 is sampled independently instead of being sampled by multivariate TPE sampler. (optimization performance may be degraded). You can suppress this warning by setting `warn_independent_sampling` to `False` in the constructor of `TPESampler`, if this independent sampling is intended behavior.
[I 2025-07-29 07:44:59,434] Trial 48 finished with value: 0.9775198410816974 and parameters: {'depth': 10, 'learning_rate': 0.09958275258587157, 'l2_leaf_reg': 3.983316349865785, 'bootstrap_type': 'Bernoulli', 'subsample': 0.8}. Best is trial 13 with value: 0.9782146894128813.
[W 2025-07-29 07:44:59,588] The parameter 'subsample' in trial#49 is sampled independently instead of being sampled by multivariate TPE sampler. (optimization performance may be degraded). You can suppress this warning by setting `warn_independent_sampling` to `False` in the constructor of `TPESampler`, if this independent sampling is intended behavior.
[I 2025-07-29 07:45:17,099] Trial 49 finished with value: 0.9760916725878724 and parameters: {'depth': 10, 'learning_rate': 0.09488362356739728, 'l2_leaf_reg': 4.388635150059866, 'bootstrap_type': 'Bernoulli', 'subsample': 0.8}. Best is trial 13 with value: 0.9782146894128813.
✓ Optimization completed in 652.4 seconds!
Best trial: 13
Best parameters found:
  - depth: 10
  - learning_rate: 0.11404316737415264
  - l2_leaf_reg: 1.0632112533994797
  - bootstrap_type: Bernoulli
  - subsample: 0.8

Best F1-macro (CV): 0.9782 (±0.0126)
------------------------------------------------------------
[Step 7/11] Final model training with best hyperparameters...
------------------------------------------------------------
0:	learn: 0.9687600	test: 0.9651872	best: 0.9651872 (0)	total: 31.9ms	remaining: 1m 3s
2:	learn: 0.9705437	test: 0.9669804	best: 0.9709625 (1)	total: 87.2ms	remaining: 58.1s
4:	learn: 0.9713362	test: 0.9669804	best: 0.9709625 (1)	total: 143ms	remaining: 56.9s
6:	learn: 0.9731148	test: 0.9676796	best: 0.9709625 (1)	total: 199ms	remaining: 56.6s
8:	learn: 0.9744924	test: 0.9658869	best: 0.9709625 (1)	total: 256ms	remaining: 56.6s
10:	learn: 0.9738924	test: 0.9662754	best: 0.9709625 (1)	total: 311ms	remaining: 56.2s
12:	learn: 0.9756936	test: 0.9680734	best: 0.9709625 (1)	total: 365ms	remaining: 55.8s
14:	learn: 0.9829210	test: 0.9742408	best: 0.9742408 (14)	total: 421ms	remaining: 55.8s
16:	learn: 0.9906545	test: 0.9818773	best: 0.9818773 (16)	total: 479ms	remaining: 55.8s
18:	learn: 0.9918937	test: 0.9818773	best: 0.9847714 (17)	total: 538ms	remaining: 56.1s
20:	learn: 0.9919778	test: 0.9818773	best: 0.9847714 (17)	total: 597ms	remaining: 56.3s
22:	learn: 0.9923352	test: 0.9841372	best: 0.9847714 (17)	total: 655ms	remaining: 56.3s
24:	learn: 0.9927646	test: 0.9852222	best: 0.9852222 (24)	total: 715ms	remaining: 56.5s
26:	learn: 0.9924849	test: 0.9852222	best: 0.9852222 (24)	total: 775ms	remaining: 56.6s
28:	learn: 0.9938435	test: 0.9852222	best: 0.9852222 (24)	total: 835ms	remaining: 56.7s
30:	learn: 0.9940693	test: 0.9873387	best: 0.9873387 (29)	total: 894ms	remaining: 56.8s
32:	learn: 0.9955176	test: 0.9862585	best: 0.9873387 (29)	total: 954ms	remaining: 56.9s
34:	learn: 0.9961348	test: 0.9862585	best: 0.9873387 (29)	total: 1.01s	remaining: 57s
36:	learn: 0.9961348	test: 0.9862585	best: 0.9873387 (29)	total: 1.07s	remaining: 57s
38:	learn: 0.9961403	test: 0.9851781	best: 0.9873387 (29)	total: 1.13s	remaining: 57s
40:	learn: 0.9963800	test: 0.9851781	best: 0.9873387 (29)	total: 1.2s	remaining: 57.1s
42:	learn: 0.9964998	test: 0.9851781	best: 0.9873387 (29)	total: 1.25s	remaining: 57.1s
44:	learn: 0.9967449	test: 0.9851781	best: 0.9873387 (29)	total: 1.28s	remaining: 55.9s
46:	learn: 0.9968646	test: 0.9840976	best: 0.9873387 (29)	total: 1.34s	remaining: 55.9s
48:	learn: 0.9969844	test: 0.9840976	best: 0.9873387 (29)	total: 1.4s	remaining: 55.8s
50:	learn: 0.9969844	test: 0.9840976	best: 0.9873387 (29)	total: 1.46s	remaining: 55.7s
52:	learn: 0.9971042	test: 0.9851781	best: 0.9873387 (29)	total: 1.51s	remaining: 55.6s
54:	learn: 0.9971042	test: 0.9851781	best: 0.9873387 (29)	total: 1.54s	remaining: 54.6s
56:	learn: 0.9971042	test: 0.9840976	best: 0.9873387 (29)	total: 1.57s	remaining: 53.6s
58:	learn: 0.9971042	test: 0.9851781	best: 0.9873387 (29)	total: 1.6s	remaining: 52.7s
60:	learn: 0.9971042	test: 0.9840976	best: 0.9873387 (29)	total: 1.61s	remaining: 51.1s
62:	learn: 0.9976352	test: 0.9840976	best: 0.9873387 (29)	total: 1.64s	remaining: 50.3s
64:	learn: 0.9977604	test: 0.9840976	best: 0.9873387 (29)	total: 1.69s	remaining: 50.5s
66:	learn: 0.9981663	test: 0.9840976	best: 0.9873387 (29)	total: 1.75s	remaining: 50.5s

2025-07-29 07:45:19,551 - CatBoostTrainer - INFO - ✓ Final model fitting completed in 2.30 seconds!

2025-07-29 07:45:19,558 - CatBoostTrainer - INFO - ✓ Final model saved to: /results/catboost/catboost_model.pkl

2025-07-29 07:45:19,558 - CatBoostTrainer - INFO - Evaluating final model on the holdout set

2025-07-29 07:45:19,575 - CatBoostTrainer - INFO - Save Results: CSV and JSON Files...

2025-07-29 07:45:19,596 - CatBoostTrainer - INFO - Generating and saving visualizations...

2025-07-29 07:45:22,570 - CatBoostTrainer - INFO - All CATBOOST visualizations and results saved to: /results/catboost

2025-07-29 07:45:22,571 - CatBoostTrainer - INFO - CATBOOST COMPLETED! Total execution time: 11.0 minutes

2025-07-29 07:45:22,571 - CatBoostTrainer - INFO - All results saved to: /results/catboost. Generating summary...
68:	learn: 0.9981663	test: 0.9840976	best: 0.9873387 (29)	total: 1.81s	remaining: 50.6s
70:	learn: 0.9981663	test: 0.9840976	best: 0.9873387 (29)	total: 1.84s	remaining: 49.9s
72:	learn: 0.9982862	test: 0.9840976	best: 0.9873387 (29)	total: 1.87s	remaining: 49.3s
74:	learn: 0.9987275	test: 0.9840976	best: 0.9873387 (29)	total: 1.93s	remaining: 49.4s
76:	learn: 0.9987275	test: 0.9840976	best: 0.9873387 (29)	total: 1.96s	remaining: 48.8s
78:	learn: 0.9988474	test: 0.9840976	best: 0.9873387 (29)	total: 2.01s	remaining: 48.9s
bestTest = 0.9873386905
bestIteration = 29
Shrink model to first 30 iterations.
✓ Final model fitting completed in 2.30 seconds!
✓ Final model saved to: /results/catboost/catboost_model.pkl
✓ Best iteration: 29
✓ Number of trees: 30
✓ Max depth: 10
✓ Best epoch: -1
------------------------------------------------------------
[Step 8/11] Evaluating final model on the holdout set
------------------------------------------------------------

Classification Report:
              precision    recall  f1-score   support

    Adequate       1.00      0.99      0.99        71
     Warning       0.83      0.84      0.84       130
      Severe       0.94      0.93      0.93       445
    Critical       0.94      0.96      0.95       178

    accuracy                           0.93       824
   macro avg       0.93      0.93      0.93       824
weighted avg       0.93      0.93      0.93       824


Key Performance Indicators:
  • Overall Accuracy: 92.7%
  • Macro F1-Score: 92.9%
  • Weighted F1-Score: 92.7%

------------------------------------------------------------
[Step 9/11] Save Results: CSV and JSON Files...
------------------------------------------------------------
✓ Feature importance saved to: /results/catboost/feature_importance_catboost.csv
Saving comprehensive results...
✓ Results successfully saved to: /results/catboost/training_results_catboost.json
------------------------------------------------------------
[Step 10/11] Generating and saving visualizations...
------------------------------------------------------------
✓ Confusion matrix plot saved: /results/catboost/confusion_matrix_cb_raw.png
✓ Confusion matrix plot saved: /results/catboost/confusion_matrix_cb_normalized.png
✓ Optuna optimization history saved: /results/catboost/optuna_history_catboost.html
Generating feature importance barplot...
✓ Feature importance barplot saved: /results/catboost/feature_importance_catboost.png
Generating cumulative feature importance plot...
✓ Cumulative feature importance plot saved: /results/catboost/feature_importance_cumulative_catboost.png
Generating Final CatBoost Training Curves (Loss/Accuracy)...
✓ Final CatBoost Training & Validation Curves Plots Saved: /results/catboost/catboost_training_curves.png


✓ All CATBOOST visualizations and results saved to: /results/catboost
------------------------------------------------------------
[Step 11/11] CATBOOST COMPLETED! Total execution time: 11.0 minutes
All results saved to: /results/catboost. Generating summary...
------------------------------------------------------------

================================================================================
CATBOOST TRAINING SUMMARY
================================================================================
Model Library: catboost v1.2.8
Data: 4576 train / 824 holdout
CV Score (Macro F1): 0.9782
Holdout Accuracy: 0.9272
Holdout Macro F1: 0.9286
Total Run Time: 654.8s
================================================================================
✓ CatBoost training completed.

================================================================================
PIPELINE EXECUTION SUMMARY
================================================================================
Models successfully trained: 3/3 (RandomForest, TabNet, CatBoost)
Total execution time: 02:04:10
Results have been saved in their respective directories under '../results/'

================================================================================
MODEL COMPARISON ANALYSIS
================================================================================

================================================================================
MODEL COMPARISON SUMMARY
================================================================================

🏆 BEST PERFORMERS:
  • Best Test Accuracy: RandomForest (0.9454)
  • Best Test F1-Macro: RandomForest (0.9462)
  • Best F1 Critical: CatBoost (0.953)
  • Best Total Time (s): CatBoost (654.8)

📊 METRICS TABLE:
+--------------+-----------------+-----------------+---------------+--------------+-------------+---------------+------------------+----------+
| Model        |   Test Accuracy |   Test F1-Macro |   F1 Adequate |   F1 Warning |   F1 Severe |   F1 Critical |   Total Time (s) | Device   |
+==============+=================+=================+===============+==============+=============+===============+==================+==========+
| CatBoost     |          0.9272 |          0.9286 |         0.993 |        0.835 |       0.933 |         0.953 |            654.8 | GPU      |
+--------------+-----------------+-----------------+---------------+--------------+-------------+---------------+------------------+----------+
| RandomForest |          0.9454 |          0.9462 |         0.993 |        0.892 |       0.951 |         0.949 |            777.9 | CPU      |
+--------------+-----------------+-----------------+---------------+--------------+-------------+---------------+------------------+----------+
| TabNet       |          0.835  |          0.8108 |         0.946 |        0.489 |       0.858 |         0.951 |           6007.1 | GPU      |
+--------------+-----------------+-----------------+---------------+--------------+-------------+---------------+------------------+----------+
✓ Saved comparison plot to: ../results/model_comparison.png
✓ Exported comparison table to: ../results/model_comparison.csv
✓ Comparison report generated successfully.
================================================================================
Orchestration complete.
