[I 2025-07-29 06:26:48,457] Trial 18 finished with value: 0.9144039598289948 and parameters: {'n_d': 48, 'batch_size': 512, 'virtual_bs_ratio': 0.5, 'n_steps': 4, 'gamma': 1.0, 'lambda_sparse': 0.0002795669459715809, 'lr': 0.010656807302676586, 'weight_decay': 0.00033321033336416837, 'mask_type': 'entmax', 'cat_emb_dim': 3}. Best is trial 3 with value: 0.9306822995103655.

Early stopping occurred at epoch 89 with best_epoch = 59 and best_val_0_logloss = 0.14651

Early stopping occurred at epoch 63 with best_epoch = 33 and best_val_0_logloss = 0.19886

Early stopping occurred at epoch 106 with best_epoch = 76 and best_val_0_logloss = 0.28525

                                                                                       

Best trial: 3. Best value: 0.930682:  38%|███▊      | 19/50 [34:59<1:07:27, 130.56s/it]
Best trial: 3. Best value: 0.930682:  38%|███▊      | 19/50 [34:59<1:07:27, 130.56s/it]
Best trial: 3. Best value: 0.930682:  40%|████      | 20/50 [34:59<1:07:44, 135.49s/it]
                                                                                       

Best trial: 3. Best value: 0.930682:  40%|████      | 20/50 [36:50<1:07:44, 135.49s/it]
Best trial: 3. Best value: 0.930682:  40%|████      | 20/50 [36:50<1:07:44, 135.49s/it]
Best trial: 3. Best value: 0.930682:  42%|████▏     | 21/50 [36:50<1:01:50, 127.94s/it]
                                                                                       

Best trial: 3. Best value: 0.930682:  42%|████▏     | 21/50 [39:14<1:01:50, 127.94s/it]
Best trial: 3. Best value: 0.930682:  42%|████▏     | 21/50 [39:14<1:01:50, 127.94s/it]
Best trial: 3. Best value: 0.930682:  44%|████▍     | 22/50 [39:14<1:02:00, 132.87s/it]
                                                                                       

Best trial: 3. Best value: 0.930682:  44%|████▍     | 22/50 [41:47<1:02:00, 132.87s/it]
Best trial: 3. Best value: 0.930682:  44%|████▍     | 22/50 [41:47<1:02:00, 132.87s/it]
Best trial: 3. Best value: 0.930682:  46%|████▌     | 23/50 [41:47<1:02:30, 138.91s/it]
                                                                                       

Best trial: 3. Best value: 0.930682:  46%|████▌     | 23/50 [44:31<1:02:30, 138.91s/it]
Best trial: 3. Best value: 0.930682:  46%|████▌     | 23/50 [44:31<1:02:30, 138.91s/it]
Best trial: 3. Best value: 0.930682:  48%|████▊     | 24/50 [44:31<1:03:27, 146.43s/it]
                                                                                       

Best trial: 3. Best value: 0.930682:  48%|████▊     | 24/50 [47:13<1:03:27, 146.43s/it]
Best trial: 3. Best value: 0.930682:  48%|████▊     | 24/50 [47:13<1:03:27, 146.43s/it]
Best trial: 3. Best value: 0.930682:  50%|█████     | 25/50 [47:13<1:03:00, 151.23s/it]
                                                                                       

Best trial: 3. Best value: 0.930682:  50%|█████     | 25/50 [49:03<1:03:00, 151.23s/it]
Best trial: 3. Best value: 0.930682:  50%|█████     | 25/50 [49:03<1:03:00, 151.23s/it]
Best trial: 3. Best value: 0.930682:  52%|█████▏    | 26/50 [49:03<55:31, 138.82s/it]  
                                                                                     

Best trial: 3. Best value: 0.930682:  52%|█████▏    | 26/50 [50:51<55:31, 138.82s/it]
Best trial: 3. Best value: 0.930682:  52%|█████▏    | 26/50 [50:51<55:31, 138.82s/it]
Best trial: 3. Best value: 0.930682:  54%|█████▍    | 27/50 [50:51<49:39, 129.55s/it]
                                                                                     

Best trial: 3. Best value: 0.930682:  54%|█████▍    | 27/50 [53:25<49:39, 129.55s/it]
Best trial: 3. Best value: 0.930682:  54%|█████▍    | 27/50 [53:25<49:39, 129.55s/it]
Best trial: 3. Best value: 0.930682:  56%|█████▌    | 28/50 [53:25<50:12, 136.93s/it]
                                                                                     

Best trial: 3. Best value: 0.930682:  56%|█████▌    | 28/50 [55:49<50:12, 136.93s/it]
Best trial: 3. Best value: 0.930682:  56%|█████▌    | 28/50 [55:49<50:12, 136.93s/it]
Best trial: 3. Best value: 0.930682:  58%|█████▊    | 29/50 [55:49<48:38, 138.97s/it]
Early stopping occurred at epoch 139 with best_epoch = 109 and best_val_0_logloss = 0.17163

Early stopping occurred at epoch 90 with best_epoch = 60 and best_val_0_logloss = 0.12402
[I 2025-07-29 06:29:15,452] Trial 19 finished with value: 0.9258827804855073 and parameters: {'n_d': 16, 'batch_size': 512, 'virtual_bs_ratio': 0.5, 'n_steps': 4, 'gamma': 1.1, 'lambda_sparse': 0.0009087926205193971, 'lr': 0.015412556546789467, 'weight_decay': 0.00020357185830788412, 'mask_type': 'entmax', 'cat_emb_dim': 3}. Best is trial 3 with value: 0.9306822995103655.

Early stopping occurred at epoch 74 with best_epoch = 44 and best_val_0_logloss = 0.41934

Early stopping occurred at epoch 78 with best_epoch = 48 and best_val_0_logloss = 0.23041

Early stopping occurred at epoch 111 with best_epoch = 81 and best_val_0_logloss = 0.33401

Early stopping occurred at epoch 99 with best_epoch = 69 and best_val_0_logloss = 0.25997

Early stopping occurred at epoch 84 with best_epoch = 54 and best_val_0_logloss = 0.1307
[I 2025-07-29 06:31:05,780] Trial 20 finished with value: 0.9070520185082236 and parameters: {'n_d': 16, 'batch_size': 512, 'virtual_bs_ratio': 0.5, 'n_steps': 3, 'gamma': 1.1, 'lambda_sparse': 3.622276198735819e-05, 'lr': 0.017382062178166277, 'weight_decay': 0.0009211424652405641, 'mask_type': 'entmax', 'cat_emb_dim': 3}. Best is trial 3 with value: 0.9306822995103655.

Early stopping occurred at epoch 91 with best_epoch = 61 and best_val_0_logloss = 0.13688

Early stopping occurred at epoch 138 with best_epoch = 108 and best_val_0_logloss = 0.12823

Early stopping occurred at epoch 61 with best_epoch = 31 and best_val_0_logloss = 0.41022

Early stopping occurred at epoch 114 with best_epoch = 84 and best_val_0_logloss = 0.21951

Early stopping occurred at epoch 59 with best_epoch = 29 and best_val_0_logloss = 0.16924
[I 2025-07-29 06:33:30,162] Trial 21 finished with value: 0.9268915819645815 and parameters: {'n_d': 16, 'batch_size': 512, 'virtual_bs_ratio': 0.5, 'n_steps': 4, 'gamma': 1.1, 'lambda_sparse': 0.0008752413956650714, 'lr': 0.01446296394209622, 'weight_decay': 0.00019371419749259823, 'mask_type': 'entmax', 'cat_emb_dim': 3}. Best is trial 3 with value: 0.9306822995103655.

Early stopping occurred at epoch 147 with best_epoch = 117 and best_val_0_logloss = 0.1326

Early stopping occurred at epoch 101 with best_epoch = 71 and best_val_0_logloss = 0.14803

Early stopping occurred at epoch 83 with best_epoch = 53 and best_val_0_logloss = 0.30154

Early stopping occurred at epoch 65 with best_epoch = 35 and best_val_0_logloss = 0.2861

Early stopping occurred at epoch 100 with best_epoch = 70 and best_val_0_logloss = 0.1267
[I 2025-07-29 06:36:03,151] Trial 22 finished with value: 0.9121562606351652 and parameters: {'n_d': 16, 'batch_size': 512, 'virtual_bs_ratio': 0.5, 'n_steps': 4, 'gamma': 1.0, 'lambda_sparse': 0.00042386382738686683, 'lr': 0.008609659749969802, 'weight_decay': 0.0003685234000494678, 'mask_type': 'entmax', 'cat_emb_dim': 3}. Best is trial 3 with value: 0.9306822995103655.

Early stopping occurred at epoch 95 with best_epoch = 65 and best_val_0_logloss = 0.27136

Early stopping occurred at epoch 102 with best_epoch = 72 and best_val_0_logloss = 0.16598

Early stopping occurred at epoch 132 with best_epoch = 102 and best_val_0_logloss = 0.22498

Early stopping occurred at epoch 111 with best_epoch = 81 and best_val_0_logloss = 0.15983

Early stopping occurred at epoch 94 with best_epoch = 64 and best_val_0_logloss = 0.11796
[I 2025-07-29 06:38:47,126] Trial 23 finished with value: 0.927536389156811 and parameters: {'n_d': 16, 'batch_size': 512, 'virtual_bs_ratio': 0.5, 'n_steps': 4, 'gamma': 1.1, 'lambda_sparse': 0.00037435032830527236, 'lr': 0.015616720882933706, 'weight_decay': 8.806188881581683e-05, 'mask_type': 'entmax', 'cat_emb_dim': 3}. Best is trial 3 with value: 0.9306822995103655.

Early stopping occurred at epoch 125 with best_epoch = 95 and best_val_0_logloss = 0.19353

Early stopping occurred at epoch 127 with best_epoch = 97 and best_val_0_logloss = 0.139

Early stopping occurred at epoch 99 with best_epoch = 69 and best_val_0_logloss = 0.27944

Early stopping occurred at epoch 128 with best_epoch = 98 and best_val_0_logloss = 0.14624

Early stopping occurred at epoch 62 with best_epoch = 32 and best_val_0_logloss = 0.22637
[I 2025-07-29 06:41:29,571] Trial 24 finished with value: 0.9206015895347068 and parameters: {'n_d': 16, 'batch_size': 512, 'virtual_bs_ratio': 0.5, 'n_steps': 4, 'gamma': 1.0, 'lambda_sparse': 0.0003663352508147543, 'lr': 0.008676303203799444, 'weight_decay': 6.923705784164284e-05, 'mask_type': 'entmax', 'cat_emb_dim': 3}. Best is trial 3 with value: 0.9306822995103655.

Early stopping occurred at epoch 100 with best_epoch = 70 and best_val_0_logloss = 0.17961

Early stopping occurred at epoch 74 with best_epoch = 44 and best_val_0_logloss = 0.19481

Early stopping occurred at epoch 49 with best_epoch = 19 and best_val_0_logloss = 0.27971

Early stopping occurred at epoch 80 with best_epoch = 50 and best_val_0_logloss = 0.25974

Early stopping occurred at epoch 62 with best_epoch = 32 and best_val_0_logloss = 0.16112
[I 2025-07-29 06:43:19,420] Trial 25 finished with value: 0.9151493491515696 and parameters: {'n_d': 32, 'batch_size': 512, 'virtual_bs_ratio': 0.5, 'n_steps': 4, 'gamma': 1.2, 'lambda_sparse': 0.0001544686180779086, 'lr': 0.02141219321819014, 'weight_decay': 0.00011598286459788766, 'mask_type': 'entmax', 'cat_emb_dim': 3}. Best is trial 3 with value: 0.9306822995103655.

Early stopping occurred at epoch 65 with best_epoch = 35 and best_val_0_logloss = 0.31459

Early stopping occurred at epoch 78 with best_epoch = 48 and best_val_0_logloss = 0.22447

Early stopping occurred at epoch 59 with best_epoch = 29 and best_val_0_logloss = 0.4058

Early stopping occurred at epoch 140 with best_epoch = 110 and best_val_0_logloss = 0.29404

Early stopping occurred at epoch 104 with best_epoch = 74 and best_val_0_logloss = 0.15194
[I 2025-07-29 06:45:07,346] Trial 26 finished with value: 0.8983157912736969 and parameters: {'n_d': 16, 'batch_size': 512, 'virtual_bs_ratio': 0.5, 'n_steps': 3, 'gamma': 1.1, 'lambda_sparse': 0.0004741576959477325, 'lr': 0.016099761562166845, 'weight_decay': 5.894859472152521e-05, 'mask_type': 'entmax', 'cat_emb_dim': 3}. Best is trial 3 with value: 0.9306822995103655.

Early stopping occurred at epoch 67 with best_epoch = 37 and best_val_0_logloss = 0.3548

Early stopping occurred at epoch 196 with best_epoch = 166 and best_val_0_logloss = 0.16082

Early stopping occurred at epoch 103 with best_epoch = 73 and best_val_0_logloss = 0.28736

Early stopping occurred at epoch 94 with best_epoch = 64 and best_val_0_logloss = 0.24984

Early stopping occurred at epoch 58 with best_epoch = 28 and best_val_0_logloss = 0.22501
[I 2025-07-29 06:47:41,474] Trial 27 finished with value: 0.8978798711974563 and parameters: {'n_d': 16, 'batch_size': 512, 'virtual_bs_ratio': 0.5, 'n_steps': 4, 'gamma': 1.1, 'lambda_sparse': 0.00021465808212791726, 'lr': 0.004817133183574748, 'weight_decay': 0.0004177147055336219, 'mask_type': 'entmax', 'cat_emb_dim': 3}. Best is trial 3 with value: 0.9306822995103655.

Early stopping occurred at epoch 76 with best_epoch = 46 and best_val_0_logloss = 0.26289

Early stopping occurred at epoch 104 with best_epoch = 74 and best_val_0_logloss = 0.1643

Early stopping occurred at epoch 159 with best_epoch = 129 and best_val_0_logloss = 0.19541

Early stopping occurred at epoch 70 with best_epoch = 40 and best_val_0_logloss = 0.33089

Early stopping occurred at epoch 76 with best_epoch = 46 and best_val_0_logloss = 0.12908
[I 2025-07-29 06:50:05,207] Trial 28 finished with value: 0.912219674361878 and parameters: {'n_d': 32, 'batch_size': 512, 'virtual_bs_ratio': 0.5, 'n_steps': 4, 'gamma': 1.2, 'lambda_sparse': 0.0009971787362150154, 'lr': 0.008802805560762354, 'weight_decay': 0.00012268871692225412, 'mask_type': 'sparsemax', 'cat_emb_dim': 2}. Best is trial 3 with value: 0.9306822995103655.

Early stopping occurred at epoch 54 with best_epoch = 24 and best_val_0_logloss = 0.37023

2025-07-29 06:51:18,973 - TabNetTrainer - WARNING - Trial 29 fold 3 failed: 

2025-07-29 06:51:43,753 - TabNetTrainer - WARNING - Trial 29 fold 4 failed: 

                                                                                     

Best trial: 3. Best value: 0.930682:  58%|█████▊    | 29/50 [57:28<48:38, 138.97s/it]
Best trial: 3. Best value: 0.930682:  58%|█████▊    | 29/50 [57:28<48:38, 138.97s/it]
Best trial: 3. Best value: 0.930682:  60%|██████    | 30/50 [57:28<42:16, 126.84s/it]
                                                                                     

Best trial: 3. Best value: 0.930682:  60%|██████    | 30/50 [58:43<42:16, 126.84s/it]
Best trial: 3. Best value: 0.930682:  60%|██████    | 30/50 [58:44<42:16, 126.84s/it]
Best trial: 3. Best value: 0.930682:  62%|██████▏   | 31/50 [58:44<35:19, 111.57s/it]
                                                                                     

Best trial: 3. Best value: 0.930682:  62%|██████▏   | 31/50 [1:01:15<35:19, 111.57s/it]
Best trial: 31. Best value: 0.936068:  62%|██████▏   | 31/50 [1:01:15<35:19, 111.57s/it]
Best trial: 31. Best value: 0.936068:  64%|██████▍   | 32/50 [1:01:15<37:01, 123.43s/it]
                                                                                        

Best trial: 31. Best value: 0.936068:  64%|██████▍   | 32/50 [1:02:58<37:01, 123.43s/it]
Best trial: 31. Best value: 0.936068:  64%|██████▍   | 32/50 [1:02:58<37:01, 123.43s/it]
Best trial: 31. Best value: 0.936068:  66%|██████▌   | 33/50 [1:02:58<33:14, 117.35s/it]
                                                                                        

Best trial: 31. Best value: 0.936068:  66%|██████▌   | 33/50 [1:05:45<33:14, 117.35s/it]
Best trial: 33. Best value: 0.941627:  66%|██████▌   | 33/50 [1:05:45<33:14, 117.35s/it]
Best trial: 33. Best value: 0.941627:  68%|██████▊   | 34/50 [1:05:45<35:15, 132.21s/it]
                                                                                        

Best trial: 33. Best value: 0.941627:  68%|██████▊   | 34/50 [1:07:51<35:15, 132.21s/it]
Best trial: 33. Best value: 0.941627:  68%|██████▊   | 34/50 [1:07:51<35:15, 132.21s/it]
Best trial: 33. Best value: 0.941627:  70%|███████   | 35/50 [1:07:51<32:36, 130.44s/it]
                                                                                        

Best trial: 33. Best value: 0.941627:  70%|███████   | 35/50 [1:11:19<32:36, 130.44s/it]
Best trial: 35. Best value: 0.946501:  70%|███████   | 35/50 [1:11:19<32:36, 130.44s/it]
Best trial: 35. Best value: 0.946501:  72%|███████▏  | 36/50 [1:11:19<35:51, 153.66s/it]
                                                                                        

Best trial: 35. Best value: 0.946501:  72%|███████▏  | 36/50 [1:13:42<35:51, 153.66s/it]
Best trial: 35. Best value: 0.946501:  72%|███████▏  | 36/50 [1:13:42<35:51, 153.66s/it]
Best trial: 35. Best value: 0.946501:  74%|███████▍  | 37/50 [1:13:42<32:35, 150.44s/it]
2025-07-29 07:09:09,143 - TabNetTrainer - WARNING - Trial 37 fold 3 failed: 

2025-07-29 07:09:32,032 - TabNetTrainer - WARNING - Trial 37 fold 4 failed: 

                                                                                        

Best trial: 35. Best value: 0.946501:  74%|███████▍  | 37/50 [1:15:16<32:35, 150.44s/it]
Best trial: 35. Best value: 0.946501:  74%|███████▍  | 37/50 [1:15:16<32:35, 150.44s/it]
Best trial: 35. Best value: 0.946501:  76%|███████▌  | 38/50 [1:15:16<26:42, 133.54s/it]
2025-07-29 07:10:09,126 - TabNetTrainer - WARNING - Trial 38 fold 3 failed: 

2025-07-29 07:10:24,237 - TabNetTrainer - WARNING - Trial 38 fold 4 failed: 

                                                                                        
Early stopping occurred at epoch 99 with best_epoch = 69 and best_val_0_logloss = 0.23439

Early stopping occurred at epoch 82 with best_epoch = 52 and best_val_0_logloss = 0.3671

Early stopping occurred at epoch 53 with best_epoch = 23 and best_val_0_logloss = 0.3333

Early stopping occurred at epoch 102 with best_epoch = 72 and best_val_0_logloss = 0.16005
[I 2025-07-29 06:51:43,753] Trial 29 finished with value: 0.634823236114762 and parameters: {'n_d': 32, 'batch_size': 512, 'virtual_bs_ratio': 0.5, 'n_steps': 3, 'gamma': 1.0, 'lambda_sparse': 0.00011183147820048727, 'lr': 0.010619410323543684, 'weight_decay': 0.00016909930414359256, 'mask_type': 'sparsemax', 'cat_emb_dim': 3}. Best is trial 3 with value: 0.9306822995103655.

Early stopping occurred at epoch 75 with best_epoch = 45 and best_val_0_logloss = 0.39354

Early stopping occurred at epoch 92 with best_epoch = 62 and best_val_0_logloss = 0.19368

Early stopping occurred at epoch 64 with best_epoch = 34 and best_val_0_logloss = 0.40858

Early stopping occurred at epoch 70 with best_epoch = 40 and best_val_0_logloss = 0.29963

Early stopping occurred at epoch 129 with best_epoch = 99 and best_val_0_logloss = 0.1627
[I 2025-07-29 06:52:59,704] Trial 30 finished with value: 0.8996615750875951 and parameters: {'n_d': 16, 'batch_size': 1024, 'virtual_bs_ratio': 0.5, 'n_steps': 4, 'gamma': 1.1, 'lambda_sparse': 0.0003710231359782367, 'lr': 0.014149006779882926, 'weight_decay': 0.00026689955107533784, 'mask_type': 'entmax', 'cat_emb_dim': 3}. Best is trial 3 with value: 0.9306822995103655.

Early stopping occurred at epoch 75 with best_epoch = 45 and best_val_0_logloss = 0.22282

Early stopping occurred at epoch 101 with best_epoch = 71 and best_val_0_logloss = 0.18302

Early stopping occurred at epoch 153 with best_epoch = 123 and best_val_0_logloss = 0.12354

Early stopping occurred at epoch 88 with best_epoch = 58 and best_val_0_logloss = 0.26321

Early stopping occurred at epoch 80 with best_epoch = 50 and best_val_0_logloss = 0.15076
[I 2025-07-29 06:55:30,780] Trial 31 finished with value: 0.9360684480101078 and parameters: {'n_d': 16, 'batch_size': 512, 'virtual_bs_ratio': 0.5, 'n_steps': 4, 'gamma': 1.1, 'lambda_sparse': 0.0006048636791641001, 'lr': 0.01732176490523335, 'weight_decay': 0.00024902164066017973, 'mask_type': 'entmax', 'cat_emb_dim': 3}. Best is trial 31 with value: 0.9360684480101078.

Early stopping occurred at epoch 82 with best_epoch = 52 and best_val_0_logloss = 0.15712

Early stopping occurred at epoch 55 with best_epoch = 25 and best_val_0_logloss = 0.2215

Early stopping occurred at epoch 56 with best_epoch = 26 and best_val_0_logloss = 0.29518

Early stopping occurred at epoch 57 with best_epoch = 27 and best_val_0_logloss = 0.18477

Early stopping occurred at epoch 97 with best_epoch = 67 and best_val_0_logloss = 0.11635
[I 2025-07-29 06:57:13,939] Trial 32 finished with value: 0.9200302655667116 and parameters: {'n_d': 16, 'batch_size': 512, 'virtual_bs_ratio': 0.5, 'n_steps': 4, 'gamma': 1.0, 'lambda_sparse': 0.000608871910842837, 'lr': 0.024434128631193174, 'weight_decay': 8.0992232428546e-05, 'mask_type': 'entmax', 'cat_emb_dim': 3}. Best is trial 31 with value: 0.9360684480101078.

Early stopping occurred at epoch 59 with best_epoch = 29 and best_val_0_logloss = 0.21822
Stop training because you reached max_epochs = 200 with best_epoch = 184 and best_val_0_logloss = 0.09711

Early stopping occurred at epoch 91 with best_epoch = 61 and best_val_0_logloss = 0.17286

Early stopping occurred at epoch 67 with best_epoch = 37 and best_val_0_logloss = 0.22567

Early stopping occurred at epoch 137 with best_epoch = 107 and best_val_0_logloss = 0.12198
[I 2025-07-29 07:00:00,830] Trial 33 finished with value: 0.9416274598118013 and parameters: {'n_d': 16, 'batch_size': 512, 'virtual_bs_ratio': 0.5, 'n_steps': 4, 'gamma': 1.1, 'lambda_sparse': 3.471741013679581e-05, 'lr': 0.017516990330872388, 'weight_decay': 0.00026269823001954303, 'mask_type': 'entmax', 'cat_emb_dim': 3}. Best is trial 33 with value: 0.9416274598118013.

Early stopping occurred at epoch 109 with best_epoch = 79 and best_val_0_logloss = 0.20934

Early stopping occurred at epoch 91 with best_epoch = 61 and best_val_0_logloss = 0.20831

Early stopping occurred at epoch 78 with best_epoch = 48 and best_val_0_logloss = 0.30956

Early stopping occurred at epoch 70 with best_epoch = 40 and best_val_0_logloss = 0.2413

Early stopping occurred at epoch 64 with best_epoch = 34 and best_val_0_logloss = 0.13852
[I 2025-07-29 07:02:07,154] Trial 34 finished with value: 0.9160488295133439 and parameters: {'n_d': 16, 'batch_size': 512, 'virtual_bs_ratio': 0.5, 'n_steps': 4, 'gamma': 1.2, 'lambda_sparse': 4.055223748711312e-05, 'lr': 0.018143718562104966, 'weight_decay': 0.00028643717760932076, 'mask_type': 'entmax', 'cat_emb_dim': 2}. Best is trial 33 with value: 0.9416274598118013.

Early stopping occurred at epoch 101 with best_epoch = 71 and best_val_0_logloss = 0.15484
Stop training because you reached max_epochs = 200 with best_epoch = 178 and best_val_0_logloss = 0.12376

Early stopping occurred at epoch 79 with best_epoch = 49 and best_val_0_logloss = 0.16572

Early stopping occurred at epoch 120 with best_epoch = 90 and best_val_0_logloss = 0.18336

Early stopping occurred at epoch 100 with best_epoch = 70 and best_val_0_logloss = 0.06082
