[I 2025-07-30 01:41:13,386] Trial 14 finished with value: 0.8405233656841608 and parameters: {'n_d': 48, 'batch_size': 512, 'virtual_bs_ratio': 0.25, 'n_steps': 3, 'gamma': 1.5, 'lambda_sparse': 6.596099207886096e-05, 'lr': 0.0010317753795327884, 'weight_decay': 1.5956700210656615e-05, 'mask_type': 'sparsemax', 'cat_emb_dim': 1}. Best is trial 3 with value: 0.9306822995103655.
✓ Optimization completed in 1210.5 seconds!
Best trial: 3
Best parameters found:
  - n_d: 16
  - batch_size: 512
  - virtual_bs_ratio: 0.5
  - n_steps: 4
  - gamma: 1.1
  - lambda_sparse: 0.0008105016126411582
  - lr: 0.013962563737015753
  - weight_decay: 0.0007568292060167617
  - mask_type: sparsemax
  - cat_emb_dim: 3

Best F1-macro (CV): 0.9307 (±0.0222)
------------------------------------------------------------
[Step 7/11] Final model training with best hyperparameters...
------------------------------------------------------------
epoch 0  | loss: 1.18715 | valid_accuracy: 0.38542 | valid_logloss: 1.32891 |  0:00:00s
epoch 1  | loss: 0.6157  | valid_accuracy: 0.42083 | valid_logloss: 1.12741 |  0:00:00s
epoch 2  | loss: 0.46515 | valid_accuracy: 0.45625 | valid_logloss: 0.9165  |  0:00:00s
epoch 3  | loss: 0.34172 | valid_accuracy: 0.71667 | valid_logloss: 0.7682  |  0:00:00s
epoch 4  | loss: 0.29933 | valid_accuracy: 0.67083 | valid_logloss: 0.76128 |  0:00:01s
epoch 5  | loss: 0.22723 | valid_accuracy: 0.72917 | valid_logloss: 0.68462 |  0:00:01s
epoch 6  | loss: 0.21937 | valid_accuracy: 0.63125 | valid_logloss: 0.64405 |  0:00:01s
epoch 7  | loss: 0.21449 | valid_accuracy: 0.64375 | valid_logloss: 0.6005  |  0:00:01s
epoch 8  | loss: 0.17848 | valid_accuracy: 0.70833 | valid_logloss: 0.54788 |  0:00:02s
epoch 9  | loss: 0.16919 | valid_accuracy: 0.75    | valid_logloss: 0.55156 |  0:00:02s
epoch 10 | loss: 0.15655 | valid_accuracy: 0.76875 | valid_logloss: 0.42998 |  0:00:02s
epoch 11 | loss: 0.15171 | valid_accuracy: 0.78958 | valid_logloss: 0.44311 |  0:00:02s
epoch 12 | loss: 0.14899 | valid_accuracy: 0.80417 | valid_logloss: 0.39237 |  0:00:03s
epoch 13 | loss: 0.13749 | valid_accuracy: 0.74583 | valid_logloss: 0.45797 |  0:00:03s
epoch 14 | loss: 0.12677 | valid_accuracy: 0.7375  | valid_logloss: 0.62203 |  0:00:03s
epoch 15 | loss: 0.11307 | valid_accuracy: 0.74375 | valid_logloss: 0.65091 |  0:00:03s
epoch 16 | loss: 0.12729 | valid_accuracy: 0.72292 | valid_logloss: 0.68674 |  0:00:04s
epoch 17 | loss: 0.13815 | valid_accuracy: 0.77708 | valid_logloss: 0.52316 |  0:00:04s
epoch 18 | loss: 0.13392 | valid_accuracy: 0.80417 | valid_logloss: 0.42634 |  0:00:04s
epoch 19 | loss: 0.14338 | valid_accuracy: 0.72917 | valid_logloss: 0.63708 |  0:00:04s
epoch 20 | loss: 0.14718 | valid_accuracy: 0.82917 | valid_logloss: 0.36116 |  0:00:05s
epoch 21 | loss: 0.13206 | valid_accuracy: 0.76667 | valid_logloss: 0.57177 |  0:00:05s
epoch 22 | loss: 0.12874 | valid_accuracy: 0.83333 | valid_logloss: 0.45996 |  0:00:05s
epoch 23 | loss: 0.12106 | valid_accuracy: 0.8375  | valid_logloss: 0.43139 |  0:00:05s
epoch 24 | loss: 0.10987 | valid_accuracy: 0.81458 | valid_logloss: 0.4458  |  0:00:06s
epoch 25 | loss: 0.10262 | valid_accuracy: 0.81875 | valid_logloss: 0.38191 |  0:00:06s
epoch 26 | loss: 0.09439 | valid_accuracy: 0.825   | valid_logloss: 0.39427 |  0:00:06s
epoch 27 | loss: 0.1076  | valid_accuracy: 0.83333 | valid_logloss: 0.39561 |  0:00:06s
epoch 28 | loss: 0.09517 | valid_accuracy: 0.84375 | valid_logloss: 0.39781 |  0:00:07s
epoch 29 | loss: 0.08991 | valid_accuracy: 0.85833 | valid_logloss: 0.33143 |  0:00:07s
epoch 30 | loss: 0.12314 | valid_accuracy: 0.85    | valid_logloss: 0.32154 |  0:00:07s
epoch 31 | loss: 0.10055 | valid_accuracy: 0.86042 | valid_logloss: 0.29655 |  0:00:07s
epoch 32 | loss: 0.09317 | valid_accuracy: 0.83542 | valid_logloss: 0.47993 |  0:00:08s
epoch 33 | loss: 0.09535 | valid_accuracy: 0.82708 | valid_logloss: 0.4566  |  0:00:08s

2025-07-30 01:41:40,433 - TabNetTrainer - INFO - Final model training completed in 26.90 seconds.

2025-07-30 01:41:40,433 - TabNetTrainer - INFO - ✓ Final model fitting completed in 26.90 seconds!

2025-07-30 01:41:40,558 - TabNetTrainer - INFO - ✓ Final model saved to: /results/tabnet/tabnet_model.pkl

2025-07-30 01:41:40,558 - TabNetTrainer - INFO - Evaluating final model on the holdout set...

2025-07-30 01:41:40,597 - TabNetTrainer - INFO - Save Results: CSV and JSON Files...
epoch 34 | loss: 0.0865  | valid_accuracy: 0.83958 | valid_logloss: 0.35578 |  0:00:08s
epoch 35 | loss: 0.09414 | valid_accuracy: 0.83125 | valid_logloss: 0.35432 |  0:00:08s
epoch 36 | loss: 0.08894 | valid_accuracy: 0.81458 | valid_logloss: 0.37706 |  0:00:09s
epoch 37 | loss: 0.09848 | valid_accuracy: 0.81667 | valid_logloss: 0.42314 |  0:00:09s
epoch 38 | loss: 0.09168 | valid_accuracy: 0.82708 | valid_logloss: 0.33636 |  0:00:09s
epoch 39 | loss: 0.09706 | valid_accuracy: 0.85208 | valid_logloss: 0.38017 |  0:00:09s
epoch 40 | loss: 0.08625 | valid_accuracy: 0.83958 | valid_logloss: 0.43847 |  0:00:09s
epoch 41 | loss: 0.09805 | valid_accuracy: 0.875   | valid_logloss: 0.32089 |  0:00:10s
epoch 42 | loss: 0.11278 | valid_accuracy: 0.85417 | valid_logloss: 0.2966  |  0:00:10s
epoch 43 | loss: 0.14257 | valid_accuracy: 0.8375  | valid_logloss: 0.35443 |  0:00:10s
epoch 44 | loss: 0.10681 | valid_accuracy: 0.83125 | valid_logloss: 0.40955 |  0:00:10s
epoch 45 | loss: 0.0896  | valid_accuracy: 0.83958 | valid_logloss: 0.39935 |  0:00:11s
epoch 46 | loss: 0.07952 | valid_accuracy: 0.86042 | valid_logloss: 0.32584 |  0:00:11s
epoch 47 | loss: 0.08826 | valid_accuracy: 0.84375 | valid_logloss: 0.39202 |  0:00:11s
epoch 48 | loss: 0.08552 | valid_accuracy: 0.8625  | valid_logloss: 0.31981 |  0:00:11s
epoch 49 | loss: 0.07505 | valid_accuracy: 0.84167 | valid_logloss: 0.40077 |  0:00:12s
epoch 50 | loss: 0.07705 | valid_accuracy: 0.83958 | valid_logloss: 0.3095  |  0:00:12s
epoch 51 | loss: 0.08253 | valid_accuracy: 0.85208 | valid_logloss: 0.29428 |  0:00:12s
epoch 52 | loss: 0.07334 | valid_accuracy: 0.77917 | valid_logloss: 0.39262 |  0:00:12s
epoch 53 | loss: 0.08712 | valid_accuracy: 0.86458 | valid_logloss: 0.26506 |  0:00:13s
epoch 54 | loss: 0.07822 | valid_accuracy: 0.87708 | valid_logloss: 0.34417 |  0:00:13s
epoch 55 | loss: 0.07628 | valid_accuracy: 0.86458 | valid_logloss: 0.33486 |  0:00:13s
epoch 56 | loss: 0.07614 | valid_accuracy: 0.86875 | valid_logloss: 0.28964 |  0:00:13s
epoch 57 | loss: 0.0654  | valid_accuracy: 0.88125 | valid_logloss: 0.27427 |  0:00:14s
epoch 58 | loss: 0.07449 | valid_accuracy: 0.87292 | valid_logloss: 0.38572 |  0:00:14s
epoch 59 | loss: 0.08576 | valid_accuracy: 0.87083 | valid_logloss: 0.28501 |  0:00:14s
epoch 60 | loss: 0.07476 | valid_accuracy: 0.86667 | valid_logloss: 0.30547 |  0:00:14s
epoch 61 | loss: 0.08483 | valid_accuracy: 0.87292 | valid_logloss: 0.32923 |  0:00:14s
epoch 62 | loss: 0.07717 | valid_accuracy: 0.85833 | valid_logloss: 0.31446 |  0:00:15s
epoch 63 | loss: 0.10525 | valid_accuracy: 0.8875  | valid_logloss: 0.25836 |  0:00:15s
epoch 64 | loss: 0.08903 | valid_accuracy: 0.81458 | valid_logloss: 0.338   |  0:00:15s
epoch 65 | loss: 0.09048 | valid_accuracy: 0.88333 | valid_logloss: 0.3474  |  0:00:15s
epoch 66 | loss: 0.07125 | valid_accuracy: 0.88542 | valid_logloss: 0.30763 |  0:00:16s
epoch 67 | loss: 0.1002  | valid_accuracy: 0.88125 | valid_logloss: 0.26807 |  0:00:16s
epoch 68 | loss: 0.09463 | valid_accuracy: 0.86042 | valid_logloss: 0.45009 |  0:00:16s
epoch 69 | loss: 0.07957 | valid_accuracy: 0.87917 | valid_logloss: 0.34895 |  0:00:16s
epoch 70 | loss: 0.09005 | valid_accuracy: 0.85    | valid_logloss: 0.5267  |  0:00:17s
epoch 71 | loss: 0.08434 | valid_accuracy: 0.85833 | valid_logloss: 0.33157 |  0:00:17s
epoch 72 | loss: 0.08198 | valid_accuracy: 0.8625  | valid_logloss: 0.29551 |  0:00:17s
epoch 73 | loss: 0.0947  | valid_accuracy: 0.86667 | valid_logloss: 0.3253  |  0:00:17s
epoch 74 | loss: 0.07968 | valid_accuracy: 0.85208 | valid_logloss: 0.33576 |  0:00:18s
epoch 75 | loss: 0.07358 | valid_accuracy: 0.87708 | valid_logloss: 0.28762 |  0:00:18s
epoch 76 | loss: 0.08118 | valid_accuracy: 0.86875 | valid_logloss: 0.33429 |  0:00:18s
epoch 77 | loss: 0.07297 | valid_accuracy: 0.87917 | valid_logloss: 0.34958 |  0:00:18s
epoch 78 | loss: 0.06575 | valid_accuracy: 0.875   | valid_logloss: 0.33114 |  0:00:18s
epoch 79 | loss: 0.0563  | valid_accuracy: 0.86875 | valid_logloss: 0.30432 |  0:00:19s
epoch 80 | loss: 0.05681 | valid_accuracy: 0.87292 | valid_logloss: 0.34632 |  0:00:19s
epoch 81 | loss: 0.06674 | valid_accuracy: 0.88333 | valid_logloss: 0.24205 |  0:00:19s
epoch 82 | loss: 0.05499 | valid_accuracy: 0.88125 | valid_logloss: 0.28099 |  0:00:19s
epoch 83 | loss: 0.06259 | valid_accuracy: 0.88333 | valid_logloss: 0.24435 |  0:00:20s
epoch 84 | loss: 0.05618 | valid_accuracy: 0.86667 | valid_logloss: 0.38234 |  0:00:20s
epoch 85 | loss: 0.05345 | valid_accuracy: 0.88542 | valid_logloss: 0.29458 |  0:00:20s
epoch 86 | loss: 0.06523 | valid_accuracy: 0.8875  | valid_logloss: 0.32449 |  0:00:20s
epoch 87 | loss: 0.06069 | valid_accuracy: 0.87292 | valid_logloss: 0.39146 |  0:00:21s
epoch 88 | loss: 0.05904 | valid_accuracy: 0.87917 | valid_logloss: 0.35521 |  0:00:21s
epoch 89 | loss: 0.06951 | valid_accuracy: 0.88958 | valid_logloss: 0.3171  |  0:00:21s
epoch 90 | loss: 0.06216 | valid_accuracy: 0.86667 | valid_logloss: 0.33783 |  0:00:21s
epoch 91 | loss: 0.05632 | valid_accuracy: 0.87708 | valid_logloss: 0.37062 |  0:00:22s
epoch 92 | loss: 0.0608  | valid_accuracy: 0.87917 | valid_logloss: 0.32329 |  0:00:22s
epoch 93 | loss: 0.05982 | valid_accuracy: 0.86875 | valid_logloss: 0.31559 |  0:00:22s
epoch 94 | loss: 0.05552 | valid_accuracy: 0.87292 | valid_logloss: 0.33504 |  0:00:22s
epoch 95 | loss: 0.06394 | valid_accuracy: 0.875   | valid_logloss: 0.35531 |  0:00:23s
epoch 96 | loss: 0.06932 | valid_accuracy: 0.85417 | valid_logloss: 0.4421  |  0:00:23s
epoch 97 | loss: 0.06191 | valid_accuracy: 0.87292 | valid_logloss: 0.38201 |  0:00:23s
epoch 98 | loss: 0.0687  | valid_accuracy: 0.86667 | valid_logloss: 0.36089 |  0:00:23s
epoch 99 | loss: 0.06269 | valid_accuracy: 0.87708 | valid_logloss: 0.31276 |  0:00:23s
epoch 100| loss: 0.05892 | valid_accuracy: 0.87708 | valid_logloss: 0.35057 |  0:00:24s
epoch 101| loss: 0.06406 | valid_accuracy: 0.87292 | valid_logloss: 0.37458 |  0:00:24s
epoch 102| loss: 0.0519  | valid_accuracy: 0.87917 | valid_logloss: 0.35649 |  0:00:24s
epoch 103| loss: 0.06695 | valid_accuracy: 0.87083 | valid_logloss: 0.36723 |  0:00:24s
epoch 104| loss: 0.05482 | valid_accuracy: 0.87917 | valid_logloss: 0.32695 |  0:00:25s
epoch 105| loss: 0.04798 | valid_accuracy: 0.88125 | valid_logloss: 0.32024 |  0:00:25s
epoch 106| loss: 0.0517  | valid_accuracy: 0.88125 | valid_logloss: 0.32563 |  0:00:25s
epoch 107| loss: 0.05527 | valid_accuracy: 0.88125 | valid_logloss: 0.37354 |  0:00:25s
epoch 108| loss: 0.0526  | valid_accuracy: 0.87917 | valid_logloss: 0.39657 |  0:00:26s
epoch 109| loss: 0.05677 | valid_accuracy: 0.88125 | valid_logloss: 0.35331 |  0:00:26s
epoch 110| loss: 0.05149 | valid_accuracy: 0.88333 | valid_logloss: 0.3564  |  0:00:26s
epoch 111| loss: 0.04935 | valid_accuracy: 0.87917 | valid_logloss: 0.37546 |  0:00:26s

Early stopping occurred at epoch 111 with best_epoch = 81 and best_valid_logloss = 0.24205
✓ Final model fitting completed in 26.90 seconds!
✓ Final model saved to: /results/tabnet/tabnet_model.pkl
✓ Best epoch: 81
✓ Number of epochs trained: 112
------------------------------------------------------------
[Step 8/11] Evaluating final model on the holdout set...
------------------------------------------------------------

Classification Report:
              precision    recall  f1-score   support

    Adequate       0.93      0.99      0.96        71
     Warning       0.50      0.49      0.50       130
      Severe       0.85      0.83      0.84       445
    Critical       0.94      0.97      0.95       178

    accuracy                           0.82       824
   macro avg       0.80      0.82      0.81       824
weighted avg       0.82      0.82      0.82       824


Key Performance Indicators:
  • Overall Accuracy: 82.2%
  • Macro F1-Score: 81.2%
  • Weighted F1-Score: 82.0%

------------------------------------------------------------
[Step 9/11] Save Results: CSV and JSON Files...
------------------------------------------------------------
✓ Feature importance saved to: /results/tabnet/feature_importances_tabnet.csv
Saving comprehensive results...

2025-07-30 01:41:40,612 - TabNetTrainer - INFO - Generating and saving visualizations...

2025-07-30 01:41:43,430 - TabNetTrainer - INFO - All TABNET visualizations and results saved to: /results/tabnet

2025-07-30 01:41:43,430 - TabNetTrainer - INFO - TABNET COMPLETED! Total execution time: 20.7 minutes

2025-07-30 01:41:43,430 - TabNetTrainer - INFO - All results saved to: /results/tabnet. Generating summary...

2025-07-30 01:41:43,431 - CatBoostTrainer - INFO - Starting Catboost Training Pipeline...

2025-07-30 01:41:43,431 - CatBoostTrainer - INFO - Loading and preprocessing dataset from ../data/aims_dataset.csv ...

2025-07-30 01:41:43,532 - CatBoostTrainer - INFO - Applying Custom Weighted-Impact Labeling...

2025-07-30 01:41:43,958 - CatBoostTrainer - INFO - Splitting data into temporal-aware training and holdout sets...

2025-07-30 01:41:43,964 - CatBoostTrainer - INFO - Setting up output directory...

2025-07-30 01:41:44,125 - CatBoostTrainer - INFO - Creating base model...

2025-07-30 01:41:44,125 - CatBoostTrainer - INFO - CUDA-enabled GPU detected: Tesla T4 (14.6 GB). Setting task_type to 'GPU'.

2025-07-30 01:41:44,125 - CatBoostTrainer - INFO - Configure and Run Hyperparameter Optimization (HPO) with Optuna ...
[I 2025-07-30 01:41:44,126] A new study created in memory with name: no-name-c451e87a-5c6b-446c-ad10-2020ec2ed65c

2025-07-30 01:41:44,126 - CatBoostTrainer - INFO - Starting Optuna optimization with 15 trials...
✓ Results successfully saved to: /results/tabnet/training_results_tabnet.json
------------------------------------------------------------
[Step 10/11] Generating and saving visualizations...
------------------------------------------------------------
✓ Confusion matrix plot saved: /results/tabnet/confusion_matrix_tb_raw.png
✓ Confusion matrix plot saved: /results/tabnet/confusion_matrix_tb_normalized.png
✓ Optuna optimization history saved: /results/tabnet/optuna_history_tb.html
Generating feature importance barplot...
✓ Feature importance barplot saved: /results/tabnet/feature_importance_tabnet.png
✓ Cumulative feature importance plot saved: /results/tabnet/feature_importance_cumulative_tabnet.png
Generating Final TabNet Training Curves (Loss/Accuracy)...
✓ Final TabNet Training & Validation Curves Plots Saved: /results/tabnet/tabnet_training_curves.png


✓ All TABNET visualizations and results saved to: /results/tabnet
------------------------------------------------------------
[Step 11/11] TABNET COMPLETED! Total execution time: 20.7 minutes
All results saved to: /results/tabnet. Generating summary...
------------------------------------------------------------

================================================================================
TABNET TRAINING SUMMARY
================================================================================
Model Library: pytorch-tabnet v4.1.0
Data: 4576 train / 824 holdout
CV Score (Macro F1): 0.9307
Holdout Accuracy: 0.8216
Holdout Macro F1: 0.8120
Total Run Time: 1239.0s
================================================================================
✓ TabNet training completed.

[3/3] Training CatBoost Classifier...
------------------------------------------------------------

================================================================================
CATBOOST TRAINING PIPELINE - AIMS FRAMEWORK
================================================================================
Configuration:
  - Dataset: ../data/aims_dataset.csv
  - CV Folds: 5
  - Optuna Trials: 15
  - Random State: 42
  - Parallel Jobs: -1
================================================================================
------------------------------------------------------------
[Step 1/11] Loading and preprocessing dataset...
------------------------------------------------------------
✓ Raw dataset shape: (5400, 18)
✓ Preprocessed dataset shape: (5400, 25)
------------------------------------------------------------
[Step 2/11] Applying Custom Weighted-Impact Labeling...
------------------------------------------------------------
✓ Feature matrix shape : (5400, 25)
✓ Temporal groups      : 25
✓ Impact distribution :
   count  percent (%)
0    768        14.22
1   1013        18.76
2   2715        50.28
3    904        16.74
------------------------------------------------------------
[Step 3/11] Splitting data into temporal-aware training and holdout sets...
------------------------------------------------------------
✓ Numerical features: 20
✓ Categorical features: 5
✓ Training set : 4576 samples (84.7%)
✓ Holdout set  : 824 samples (15.3%)
------------------------------------------------------------
[Step 4/11] Setting up output directory...
------------------------------------------------------------
✓ Results will be saved to: /results/catboost
✓ Saving artifact files (features, labels, groups, and class weights)...
✓ Features, labels, groups, and class weights saved.
------------------------------------------------------------
[Step 5/11] Creating base model...
------------------------------------------------------------
CUDA-enabled GPU detected: Tesla T4 (14.6 GB). Setting task_type to 'GPU'.
✓ Using GPU acceleration
------------------------------------------------------------
[Step 6/11] Configure and Run Hyperparameter Optimization (HPO) with Optuna ...
------------------------------------------------------------
Starting Optuna optimization with 15 trials...

  0%|          | 0/15 [00:00<?, ?it/s]
                                      

  0%|          | 0/15 [00:05<?, ?it/s]
Best trial: 0. Best value: 0.968226:   0%|          | 0/15 [00:05<?, ?it/s]
Best trial: 0. Best value: 0.968226:   7%|▋         | 1/15 [00:05<01:21,  5.82s/it]
                                                                                   

Best trial: 0. Best value: 0.968226:   7%|▋         | 1/15 [00:09<01:21,  5.82s/it]
Best trial: 1. Best value: 0.971182:   7%|▋         | 1/15 [00:10<01:21,  5.82s/it]
Best trial: 1. Best value: 0.971182:  13%|█▎        | 2/15 [00:10<01:03,  4.91s/it]
                                                                                   

Best trial: 1. Best value: 0.971182:  13%|█▎        | 2/15 [00:18<01:03,  4.91s/it]
Best trial: 1. Best value: 0.971182:  13%|█▎        | 2/15 [00:18<01:03,  4.91s/it]
Best trial: 1. Best value: 0.971182:  20%|██        | 3/15 [00:18<01:17,  6.44s/it]
                                                                                   

Best trial: 1. Best value: 0.971182:  20%|██        | 3/15 [00:23<01:17,  6.44s/it]
Best trial: 1. Best value: 0.971182:  20%|██        | 3/15 [00:23<01:17,  6.44s/it]
Best trial: 1. Best value: 0.971182:  27%|██▋       | 4/15 [00:23<01:06,  6.07s/it]
                                                                                   

Best trial: 1. Best value: 0.971182:  27%|██▋       | 4/15 [00:30<01:06,  6.07s/it]
Best trial: 4. Best value: 0.972106:  27%|██▋       | 4/15 [00:30<01:06,  6.07s/it]
Best trial: 4. Best value: 0.972106:  33%|███▎      | 5/15 [00:30<01:02,  6.25s/it]
                                                                                   

Best trial: 4. Best value: 0.972106:  33%|███▎      | 5/15 [00:38<01:02,  6.25s/it]
Best trial: 4. Best value: 0.972106:  33%|███▎      | 5/15 [00:39<01:02,  6.25s/it]
Best trial: 4. Best value: 0.972106:  40%|████      | 6/15 [00:39<01:03,  7.08s/it]
                                                                                   

Best trial: 4. Best value: 0.972106:  40%|████      | 6/15 [00:43<01:03,  7.08s/it]
Best trial: 4. Best value: 0.972106:  40%|████      | 6/15 [00:44<01:03,  7.08s/it]
Best trial: 4. Best value: 0.972106:  47%|████▋     | 7/15 [00:44<00:50,  6.37s/it]
                                                                                   

Best trial: 4. Best value: 0.972106:  47%|████▋     | 7/15 [00:47<00:50,  6.37s/it]
Best trial: 4. Best value: 0.972106:  47%|████▋     | 7/15 [00:48<00:50,  6.37s/it]
Best trial: 4. Best value: 0.972106:  53%|█████▎    | 8/15 [00:48<00:39,  5.61s/it]
                                                                                   

Best trial: 4. Best value: 0.972106:  53%|█████▎    | 8/15 [00:53<00:39,  5.61s/it]
Best trial: 4. Best value: 0.972106:  53%|█████▎    | 8/15 [00:53<00:39,  5.61s/it]
Best trial: 4. Best value: 0.972106:  60%|██████    | 9/15 [00:53<00:33,  5.57s/it]
                                                                                   

Best trial: 4. Best value: 0.972106:  60%|██████    | 9/15 [01:01<00:33,  5.57s/it]
Best trial: 4. Best value: 0.972106:  60%|██████    | 9/15 [01:01<00:33,  5.57s/it]
Best trial: 4. Best value: 0.972106:  67%|██████▋   | 10/15 [01:01<00:31,  6.22s/it]
                                                                                    

Best trial: 4. Best value: 0.972106:  67%|██████▋   | 10/15 [01:01<00:31,  6.22s/it]
                                                                                    

Best trial: 4. Best value: 0.972106:  67%|██████▋   | 10/15 [01:11<00:31,  6.22s/it]
Best trial: 4. Best value: 0.972106:  67%|██████▋   | 10/15 [01:11<00:31,  6.22s/it]
Best trial: 4. Best value: 0.972106:  73%|███████▎  | 11/15 [01:11<00:30,  7.58s/it]
                                                                                    

Best trial: 4. Best value: 0.972106:  73%|███████▎  | 11/15 [01:11<00:30,  7.58s/it]
                                    