[I 2025-07-30 01:41:49,802] Trial 0 finished with value: 0.9682259622296486 and parameters: {'depth': 6, 'learning_rate': 0.2536999076681772, 'l2_leaf_reg': 5.395030966670228, 'bootstrap_type': 'Bayesian', 'bagging_temperature': 0.15599452033620265}. Best is trial 0 with value: 0.9682259622296486.
[I 2025-07-30 01:41:54,080] Trial 1 finished with value: 0.9711823194279375 and parameters: {'depth': 4, 'learning_rate': 0.19030368381735815, 'l2_leaf_reg': 3.9913058785616786, 'bootstrap_type': 'Bayesian', 'bagging_temperature': 0.9699098521619943}. Best is trial 1 with value: 0.9711823194279375.
[I 2025-07-30 01:42:02,329] Trial 2 finished with value: 0.9419212883625597 and parameters: {'depth': 9, 'learning_rate': 0.020589728197687916, 'l2_leaf_reg': 1.5199348301309807, 'bootstrap_type': 'Bernoulli', 'subsample': 0.8}. Best is trial 1 with value: 0.9711823194279375.
[I 2025-07-30 01:42:07,819] Trial 3 finished with value: 0.9366927244411217 and parameters: {'depth': 7, 'learning_rate': 0.02692655251486473, 'l2_leaf_reg': 4.091220574443785, 'bootstrap_type': 'Bernoulli', 'subsample': 0.7}. Best is trial 1 with value: 0.9711823194279375.
[I 2025-07-30 01:42:14,406] Trial 4 finished with value: 0.9721061592153779 and parameters: {'depth': 7, 'learning_rate': 0.14447746112718687, 'l2_leaf_reg': 1.5837031559118748, 'bootstrap_type': 'Bernoulli', 'subsample': 0.6}. Best is trial 4 with value: 0.9721061592153779.
[I 2025-07-30 01:42:23,107] Trial 5 finished with value: 0.9468132303438676 and parameters: {'depth': 8, 'learning_rate': 0.0178601378893971, 'l2_leaf_reg': 1.1615865989246452, 'bootstrap_type': 'Bernoulli', 'subsample': 1.0}. Best is trial 4 with value: 0.9721061592153779.
[I 2025-07-30 01:42:28,009] Trial 6 finished with value: 0.9195065420431339 and parameters: {'depth': 6, 'learning_rate': 0.013940346079873234, 'l2_leaf_reg': 4.833180632488465, 'bootstrap_type': 'Bayesian', 'bagging_temperature': 0.4951769101112702}. Best is trial 4 with value: 0.9721061592153779.
[I 2025-07-30 01:42:31,985] Trial 7 finished with value: 0.9717703695731528 and parameters: {'depth': 4, 'learning_rate': 0.22038218939289875, 'l2_leaf_reg': 1.8145961353490248, 'bootstrap_type': 'Bayesian', 'bagging_temperature': 0.5200680211778108}. Best is trial 4 with value: 0.9721061592153779.
[I 2025-07-30 01:42:37,463] Trial 8 finished with value: 0.9262648051237269 and parameters: {'depth': 7, 'learning_rate': 0.01875220945578641, 'l2_leaf_reg': 9.32362135178148, 'bootstrap_type': 'Bernoulli', 'subsample': 1.0}. Best is trial 4 with value: 0.9721061592153779.
[I 2025-07-30 01:42:45,163] Trial 9 finished with value: 0.9705841156464683 and parameters: {'depth': 8, 'learning_rate': 0.22999586428143728, 'l2_leaf_reg': 1.2260057359187524, 'bootstrap_type': 'Bayesian', 'bagging_temperature': 0.32533033076326434}. Best is trial 4 with value: 0.9721061592153779.
[W 2025-07-30 01:42:45,301] The parameter 'subsample' in trial#10 is sampled independently instead of being sampled by multivariate TPE sampler. (optimization performance may be degraded). You can suppress this warning by setting `warn_independent_sampling` to `False` in the constructor of `TPESampler`, if this independent sampling is intended behavior.
[I 2025-07-30 01:42:55,813] Trial 10 finished with value: 0.9714791431001103 and parameters: {'depth': 9, 'learning_rate': 0.22117152465560366, 'l2_leaf_reg': 2.9110678846417657, 'bootstrap_type': 'Bernoulli', 'subsample': 0.6}. Best is trial 4 with value: 0.9721061592153779.
[W 2025-07-30 01:42:55,952] The parameter 'bagging_temperature' in trial#11 is sampled independently instead of being sampled by multivariate TPE sampler. (optimization performance may be degraded). You can suppress this warning by setting `warn_independent_sampling` to `False` in the constructor of `TPESampler`, if this independent sampling is intended behavior.
[I 2025-07-30 01:43:01,021] Trial 11 finished with value: 0.9720813665880004 and parameters: {'depth': 5, 'learning_rate': 0.11782243408756986, 'l2_leaf_reg': 1.0319334565028342, 'bootstrap_type': 'Bayesian', 'bagging_temperature': 0.6740764180881379}. Best is trial 4 with value: 0.9721061592153779.
[W 2025-07-30 01:43:01,170] The parameter 'bagging_temperature' in trial#12 is sampled independently instead of being sampled by multivariate TPE sampler. (optimization performance may be degraded). You can suppress this warning by setting `warn_independent_sampling` to `False` in the constructor of `TPESampler`, if this independent sampling is intended behavior.
[I 2025-07-30 01:43:06,588] Trial 12 finished with value: 0.9652824287468746 and parameters: {'depth': 5, 'learning_rate': 0.0346479110059374, 'l2_leaf_reg': 1.2514475414029915, 'bootstrap_type': 'Bayesian', 'bagging_temperature': 0.7483352155324731}. Best is trial 4 with value: 0.9721061592153779.
[W 2025-07-30 01:43:06,728] The parameter 'subsample' in trial#13 is sampled independently instead of being sampled by multivariate TPE sampler. (optimization performance may be degraded). You can suppress this warning by setting `warn_independent_sampling` to `False` in the constructor of `TPESampler`, if this independent sampling is intended behavior.
[I 2025-07-30 01:43:11,825] Trial 13 finished with value: 0.9745331803712773 and parameters: {'depth': 5, 'learning_rate': 0.12923478458987997, 'l2_leaf_reg': 1.101365249055053, 'bootstrap_type': 'Bernoulli', 'subsample': 0.6}. Best is trial 13 with value: 0.9745331803712773.
[W 2025-07-30 01:43:11,965] The parameter 'subsample' in trial#14 is sampled independently instead of being sampled by multivariate TPE sampler. (optimization performance may be degraded). You can suppress this warning by setting `warn_independent_sampling` to `False` in the constructor of `TPESampler`, if this independent sampling is intended behavior.
[I 2025-07-30 01:43:17,893] Trial 14 finished with value: 0.976595445140422 and parameters: {'depth': 6, 'learning_rate': 0.11763142623142481, 'l2_leaf_reg': 1.5827422899184271, 'bootstrap_type': 'Bernoulli', 'subsample': 0.6}. Best is trial 14 with value: 0.976595445140422.
✓ Optimization completed in 93.9 seconds!
Best trial: 14
Best parameters found:
  - depth: 6
  - learning_rate: 0.11763142623142481
  - l2_leaf_reg: 1.5827422899184271
  - bootstrap_type: Bernoulli
  - subsample: 0.6

Best F1-macro (CV): 0.9766 (±0.0098)
------------------------------------------------------------
[Step 7/11] Final model training with best hyperparameters...
------------------------------------------------------------
0:	learn: 0.9345077	test: 0.9267163	best: 0.9267163 (0)	total: 7.31ms	remaining: 14.6s
2:	learn: 0.9347533	test: 0.9370762	best: 0.9370762 (2)	total: 19.2ms	remaining: 12.8s
4:	learn: 0.9582248	test: 0.9674925	best: 0.9674925 (4)	total: 31ms	remaining: 12.4s
6:	learn: 0.9637902	test: 0.9593999	best: 0.9674925 (4)	total: 42.8ms	remaining: 12.2s
8:	learn: 0.9632944	test: 0.9583096	best: 0.9674925 (4)	total: 54.5ms	remaining: 12.1s
10:	learn: 0.9634657	test: 0.9598947	best: 0.9674925 (4)	total: 66.5ms	remaining: 12s
12:	learn: 0.9633898	test: 0.9638764	best: 0.9674925 (4)	total: 78.1ms	remaining: 11.9s
14:	learn: 0.9750862	test: 0.9703787	best: 0.9703787 (14)	total: 90.1ms	remaining: 11.9s
16:	learn: 0.9761384	test: 0.9732788	best: 0.9732788 (16)	total: 102ms	remaining: 11.9s
18:	learn: 0.9777185	test: 0.9740070	best: 0.9750918 (17)	total: 114ms	remaining: 11.9s
20:	learn: 0.9773154	test: 0.9740070	best: 0.9750918 (17)	total: 126ms	remaining: 11.9s
22:	learn: 0.9787559	test: 0.9740070	best: 0.9750918 (17)	total: 138ms	remaining: 11.9s
24:	learn: 0.9829894	test: 0.9758161	best: 0.9758161 (24)	total: 150ms	remaining: 11.9s
26:	learn: 0.9827865	test: 0.9758161	best: 0.9758161 (24)	total: 162ms	remaining: 11.9s
28:	learn: 0.9843991	test: 0.9758161	best: 0.9758161 (24)	total: 175ms	remaining: 11.9s
30:	learn: 0.9842390	test: 0.9758161	best: 0.9758161 (24)	total: 187ms	remaining: 11.9s
32:	learn: 0.9843524	test: 0.9758161	best: 0.9758161 (24)	total: 195ms	remaining: 11.6s
34:	learn: 0.9850038	test: 0.9758161	best: 0.9758161 (24)	total: 207ms	remaining: 11.6s

2025-07-30 01:43:18,870 - CatBoostTrainer - INFO - ✓ Final model fitting completed in 0.84 seconds!

2025-07-30 01:43:18,873 - CatBoostTrainer - INFO - ✓ Final model saved to: /results/catboost/catboost_model.pkl

2025-07-30 01:43:18,873 - CatBoostTrainer - INFO - Evaluating final model on the holdout set

2025-07-30 01:43:18,889 - CatBoostTrainer - INFO - Save Results: CSV and JSON Files...

2025-07-30 01:43:18,903 - CatBoostTrainer - INFO - Generating and saving visualizations...

2025-07-30 01:43:21,735 - CatBoostTrainer - INFO - All CATBOOST visualizations and results saved to: /results/catboost

2025-07-30 01:43:21,735 - CatBoostTrainer - INFO - CATBOOST COMPLETED! Total execution time: 1.6 minutes

2025-07-30 01:43:21,735 - CatBoostTrainer - INFO - All results saved to: /results/catboost. Generating summary...
36:	learn: 0.9855656	test: 0.9769017	best: 0.9769017 (35)	total: 219ms	remaining: 11.6s
38:	learn: 0.9867594	test: 0.9779870	best: 0.9779870 (38)	total: 231ms	remaining: 11.6s
40:	learn: 0.9866397	test: 0.9779870	best: 0.9779870 (38)	total: 243ms	remaining: 11.6s
42:	learn: 0.9872015	test: 0.9801571	best: 0.9801571 (42)	total: 255ms	remaining: 11.6s
44:	learn: 0.9880857	test: 0.9812418	best: 0.9812418 (44)	total: 267ms	remaining: 11.6s
46:	learn: 0.9883963	test: 0.9812418	best: 0.9812418 (44)	total: 279ms	remaining: 11.6s
48:	learn: 0.9900897	test: 0.9812418	best: 0.9812418 (44)	total: 291ms	remaining: 11.6s
50:	learn: 0.9902388	test: 0.9812418	best: 0.9812418 (44)	total: 303ms	remaining: 11.6s
52:	learn: 0.9912294	test: 0.9812418	best: 0.9812418 (44)	total: 315ms	remaining: 11.6s
54:	learn: 0.9917031	test: 0.9812418	best: 0.9812418 (44)	total: 328ms	remaining: 11.6s
56:	learn: 0.9925495	test: 0.9812418	best: 0.9812418 (44)	total: 339ms	remaining: 11.6s
58:	learn: 0.9925124	test: 0.9812418	best: 0.9812418 (44)	total: 347ms	remaining: 11.4s
60:	learn: 0.9929540	test: 0.9812418	best: 0.9812418 (44)	total: 359ms	remaining: 11.4s
62:	learn: 0.9930737	test: 0.9812418	best: 0.9812418 (44)	total: 371ms	remaining: 11.4s
64:	learn: 0.9930737	test: 0.9812418	best: 0.9812418 (44)	total: 383ms	remaining: 11.4s
66:	learn: 0.9926321	test: 0.9812418	best: 0.9812418 (44)	total: 395ms	remaining: 11.4s
68:	learn: 0.9929415	test: 0.9812418	best: 0.9812418 (44)	total: 407ms	remaining: 11.4s
70:	learn: 0.9929415	test: 0.9812418	best: 0.9812418 (44)	total: 419ms	remaining: 11.4s
72:	learn: 0.9930612	test: 0.9812418	best: 0.9812418 (44)	total: 431ms	remaining: 11.4s
74:	learn: 0.9936681	test: 0.9812418	best: 0.9812418 (44)	total: 443ms	remaining: 11.4s
76:	learn: 0.9939133	test: 0.9812418	best: 0.9812418 (44)	total: 455ms	remaining: 11.4s
78:	learn: 0.9944437	test: 0.9812418	best: 0.9812418 (44)	total: 467ms	remaining: 11.3s
80:	learn: 0.9943239	test: 0.9812418	best: 0.9812418 (44)	total: 478ms	remaining: 11.3s
82:	learn: 0.9946331	test: 0.9812418	best: 0.9812418 (44)	total: 490ms	remaining: 11.3s
84:	learn: 0.9946331	test: 0.9812418	best: 0.9812418 (44)	total: 502ms	remaining: 11.3s
86:	learn: 0.9946331	test: 0.9812418	best: 0.9812418 (44)	total: 514ms	remaining: 11.3s
88:	learn: 0.9946331	test: 0.9812418	best: 0.9812418 (44)	total: 526ms	remaining: 11.3s
90:	learn: 0.9946331	test: 0.9812418	best: 0.9812418 (44)	total: 538ms	remaining: 11.3s
92:	learn: 0.9946331	test: 0.9812418	best: 0.9812418 (44)	total: 550ms	remaining: 11.3s
94:	learn: 0.9947529	test: 0.9812418	best: 0.9812418 (44)	total: 562ms	remaining: 11.3s
bestTest = 0.9812418451
bestIteration = 44
Shrink model to first 45 iterations.
✓ Final model fitting completed in 0.84 seconds!
✓ Final model saved to: /results/catboost/catboost_model.pkl
✓ Best iteration: 44
✓ Number of trees: 45
✓ Max depth: 6
✓ Best epoch: -1
------------------------------------------------------------
[Step 8/11] Evaluating final model on the holdout set
------------------------------------------------------------

Classification Report:
              precision    recall  f1-score   support

    Adequate       1.00      0.99      0.99        71
     Warning       0.83      0.88      0.85       130
      Severe       0.95      0.93      0.94       445
    Critical       0.95      0.98      0.96       178

    accuracy                           0.94       824
   macro avg       0.93      0.94      0.94       824
weighted avg       0.94      0.94      0.94       824


Key Performance Indicators:
  • Overall Accuracy: 93.6%
  • Macro F1-Score: 93.7%
  • Weighted F1-Score: 93.6%

------------------------------------------------------------
[Step 9/11] Save Results: CSV and JSON Files...
------------------------------------------------------------
✓ Feature importance saved to: /results/catboost/feature_importance_catboost.csv
Saving comprehensive results...
✓ Results successfully saved to: /results/catboost/training_results_catboost.json
------------------------------------------------------------
[Step 10/11] Generating and saving visualizations...
------------------------------------------------------------
✓ Confusion matrix plot saved: /results/catboost/confusion_matrix_cb_raw.png
✓ Confusion matrix plot saved: /results/catboost/confusion_matrix_cb_normalized.png
✓ Optuna optimization history saved: /results/catboost/optuna_history_catboost.html
Generating feature importance barplot...
✓ Feature importance barplot saved: /results/catboost/feature_importance_catboost.png
Generating cumulative feature importance plot...
✓ Cumulative feature importance plot saved: /results/catboost/feature_importance_cumulative_catboost.png
Generating Final CatBoost Training Curves (Loss/Accuracy)...
✓ Final CatBoost Training & Validation Curves Plots Saved: /results/catboost/catboost_training_curves.png


✓ All CATBOOST visualizations and results saved to: /results/catboost
------------------------------------------------------------
[Step 11/11] CATBOOST COMPLETED! Total execution time: 1.6 minutes
All results saved to: /results/catboost. Generating summary...
------------------------------------------------------------

================================================================================
CATBOOST TRAINING SUMMARY
================================================================================
Model Library: catboost v1.2.8
Data: 4576 train / 824 holdout
CV Score (Macro F1): 0.9766
Holdout Accuracy: 0.9357
Holdout Macro F1: 0.9372
Total Run Time: 94.8s
================================================================================
✓ CatBoost training completed.

================================================================================
PIPELINE EXECUTION SUMMARY
================================================================================
Models successfully trained: 3/3 (RandomForest, TabNet, CatBoost)
Total execution time: 00:26:03
Results have been saved in their respective directories under '../results/'

================================================================================
MODEL COMPARISON ANALYSIS
================================================================================

================================================================================
MODEL COMPARISON SUMMARY
================================================================================

🏆 BEST PERFORMERS:
  • Best Test Accuracy: RandomForest (0.9454)
  • Best Test F1-Macro: RandomForest (0.9462)
  • Best F1 Critical: CatBoost (0.961)
  • Best Total Time (s): CatBoost (94.8)

📊 METRICS TABLE:
+--------------+-----------------+-----------------+---------------+--------------+-------------+---------------+------------------+----------+
| Model        |   Test Accuracy |   Test F1-Macro |   F1 Adequate |   F1 Warning |   F1 Severe |   F1 Critical |   Total Time (s) | Device   |
+==============+=================+=================+===============+==============+=============+===============+==================+==========+
| CatBoost     |          0.9357 |          0.9372 |         0.993 |        0.854 |       0.941 |         0.961 |             94.8 | GPU      |
+--------------+-----------------+-----------------+---------------+--------------+-------------+---------------+------------------+----------+
| RandomForest |          0.9454 |          0.9462 |         0.993 |        0.892 |       0.951 |         0.949 |            219.6 | CPU      |
+--------------+-----------------+-----------------+---------------+--------------+-------------+---------------+------------------+----------+
| TabNet       |          0.8216 |          0.812  |         0.959 |        0.496 |       0.84  |         0.953 |           1239   | GPU      |
+--------------+-----------------+-----------------+---------------+--------------+-------------+---------------+------------------+----------+
✓ Saved comparison plot to: ../results/model_comparison.png
✓ Exported comparison table to: ../results/model_comparison.csv
✓ Comparison report generated successfully.
================================================================================
Orchestration complete.