[I 2025-07-29 07:34:30,518] Trial 0 finished with value: 0.9682259622296486 and parameters: {'depth': 6, 'learning_rate': 0.2536999076681772, 'l2_leaf_reg': 5.395030966670228, 'bootstrap_type': 'Bayesian', 'bagging_temperature': 0.15599452033620265}. Best is trial 0 with value: 0.9682259622296486.
[I 2025-07-29 07:34:34,795] Trial 1 finished with value: 0.9711823194279375 and parameters: {'depth': 4, 'learning_rate': 0.19030368381735815, 'l2_leaf_reg': 3.9913058785616786, 'bootstrap_type': 'Bayesian', 'bagging_temperature': 0.9699098521619943}. Best is trial 1 with value: 0.9711823194279375.
[I 2025-07-29 07:34:43,010] Trial 2 finished with value: 0.9419212883625597 and parameters: {'depth': 9, 'learning_rate': 0.020589728197687916, 'l2_leaf_reg': 1.5199348301309807, 'bootstrap_type': 'Bernoulli', 'subsample': 0.8}. Best is trial 1 with value: 0.9711823194279375.
[I 2025-07-29 07:34:48,440] Trial 3 finished with value: 0.9366927244411217 and parameters: {'depth': 7, 'learning_rate': 0.02692655251486473, 'l2_leaf_reg': 4.091220574443785, 'bootstrap_type': 'Bernoulli', 'subsample': 0.7}. Best is trial 1 with value: 0.9711823194279375.
[I 2025-07-29 07:34:55,939] Trial 4 finished with value: 0.9733035345647701 and parameters: {'depth': 7, 'learning_rate': 0.14447746112718687, 'l2_leaf_reg': 1.5837031559118748, 'bootstrap_type': 'Bernoulli', 'subsample': 0.6}. Best is trial 4 with value: 0.9733035345647701.
[I 2025-07-29 07:35:04,729] Trial 5 finished with value: 0.9468132303438676 and parameters: {'depth': 8, 'learning_rate': 0.0178601378893971, 'l2_leaf_reg': 1.1615865989246452, 'bootstrap_type': 'Bernoulli', 'subsample': 1.0}. Best is trial 4 with value: 0.9733035345647701.
[I 2025-07-29 07:35:09,631] Trial 6 finished with value: 0.9195065420431339 and parameters: {'depth': 6, 'learning_rate': 0.013940346079873234, 'l2_leaf_reg': 4.833180632488465, 'bootstrap_type': 'Bayesian', 'bagging_temperature': 0.4951769101112702}. Best is trial 4 with value: 0.9733035345647701.
[I 2025-07-29 07:35:13,563] Trial 7 finished with value: 0.9717703695731528 and parameters: {'depth': 4, 'learning_rate': 0.22038218939289875, 'l2_leaf_reg': 1.8145961353490248, 'bootstrap_type': 'Bayesian', 'bagging_temperature': 0.5200680211778108}. Best is trial 4 with value: 0.9733035345647701.
[I 2025-07-29 07:35:19,027] Trial 8 finished with value: 0.9262648051237269 and parameters: {'depth': 7, 'learning_rate': 0.01875220945578641, 'l2_leaf_reg': 9.32362135178148, 'bootstrap_type': 'Bernoulli', 'subsample': 1.0}. Best is trial 4 with value: 0.9733035345647701.
[I 2025-07-29 07:35:25,790] Trial 9 finished with value: 0.9701749337958452 and parameters: {'depth': 8, 'learning_rate': 0.22999586428143728, 'l2_leaf_reg': 1.2260057359187524, 'bootstrap_type': 'Bayesian', 'bagging_temperature': 0.32533033076326434}. Best is trial 4 with value: 0.9733035345647701.
[W 2025-07-29 07:35:25,935] The parameter 'subsample' in trial#10 is sampled independently instead of being sampled by multivariate TPE sampler. (optimization performance may be degraded). You can suppress this warning by setting `warn_independent_sampling` to `False` in the constructor of `TPESampler`, if this independent sampling is intended behavior.
[I 2025-07-29 07:35:36,272] Trial 10 finished with value: 0.9709564862197707 and parameters: {'depth': 9, 'learning_rate': 0.22117152465560366, 'l2_leaf_reg': 2.9110678846417657, 'bootstrap_type': 'Bernoulli', 'subsample': 0.6}. Best is trial 4 with value: 0.9733035345647701.
[W 2025-07-29 07:35:36,418] The parameter 'bagging_temperature' in trial#11 is sampled independently instead of being sampled by multivariate TPE sampler. (optimization performance may be degraded). You can suppress this warning by setting `warn_independent_sampling` to `False` in the constructor of `TPESampler`, if this independent sampling is intended behavior.
[I 2025-07-29 07:35:41,257] Trial 11 finished with value: 0.9713304835082998 and parameters: {'depth': 5, 'learning_rate': 0.11782243408756986, 'l2_leaf_reg': 1.0319334565028342, 'bootstrap_type': 'Bayesian', 'bagging_temperature': 0.6740764180881379}. Best is trial 4 with value: 0.9733035345647701.
[W 2025-07-29 07:35:41,401] The parameter 'subsample' in trial#12 is sampled independently instead of being sampled by multivariate TPE sampler. (optimization performance may be degraded). You can suppress this warning by setting `warn_independent_sampling` to `False` in the constructor of `TPESampler`, if this independent sampling is intended behavior.
[I 2025-07-29 07:35:47,104] Trial 12 finished with value: 0.9712224192053837 and parameters: {'depth': 5, 'learning_rate': 0.055452299986531214, 'l2_leaf_reg': 1.8967834555144123, 'bootstrap_type': 'Bernoulli', 'subsample': 0.6}. Best is trial 4 with value: 0.9733035345647701.
[W 2025-07-29 07:35:47,254] The parameter 'subsample' in trial#13 is sampled independently instead of being sampled by multivariate TPE sampler. (optimization performance may be degraded). You can suppress this warning by setting `warn_independent_sampling` to `False` in the constructor of `TPESampler`, if this independent sampling is intended behavior.
[I 2025-07-29 07:36:05,160] Trial 13 finished with value: 0.9782146894128813 and parameters: {'depth': 10, 'learning_rate': 0.11404316737415264, 'l2_leaf_reg': 1.0632112533994797, 'bootstrap_type': 'Bernoulli', 'subsample': 0.8}. Best is trial 13 with value: 0.9782146894128813.
[W 2025-07-29 07:36:05,312] The parameter 'subsample' in trial#14 is sampled independently instead of being sampled by multivariate TPE sampler. (optimization performance may be degraded). You can suppress this warning by setting `warn_independent_sampling` to `False` in the constructor of `TPESampler`, if this independent sampling is intended behavior.
[I 2025-07-29 07:36:18,975] Trial 14 finished with value: 0.9741358780450943 and parameters: {'depth': 9, 'learning_rate': 0.09278501804489081, 'l2_leaf_reg': 1.026685560143113, 'bootstrap_type': 'Bernoulli', 'subsample': 0.8}. Best is trial 13 with value: 0.9782146894128813.
[W 2025-07-29 07:36:19,130] The parameter 'subsample' in trial#15 is sampled independently instead of being sampled by multivariate TPE sampler. (optimization performance may be degraded). You can suppress this warning by setting `warn_independent_sampling` to `False` in the constructor of `TPESampler`, if this independent sampling is intended behavior.
[I 2025-07-29 07:36:40,148] Trial 15 finished with value: 0.977633942450819 and parameters: {'depth': 10, 'learning_rate': 0.06265410156845308, 'l2_leaf_reg': 1.2624725862649437, 'bootstrap_type': 'Bernoulli', 'subsample': 0.8}. Best is trial 13 with value: 0.9782146894128813.
[W 2025-07-29 07:36:40,293] The parameter 'subsample' in trial#16 is sampled independently instead of being sampled by multivariate TPE sampler. (optimization performance may be degraded). You can suppress this warning by setting `warn_independent_sampling` to `False` in the constructor of `TPESampler`, if this independent sampling is intended behavior.
[I 2025-07-29 07:37:04,594] Trial 16 finished with value: 0.9760970025058231 and parameters: {'depth': 10, 'learning_rate': 0.050982882557119864, 'l2_leaf_reg': 3.2982566512742197, 'bootstrap_type': 'Bernoulli', 'subsample': 0.9}. Best is trial 13 with value: 0.9782146894128813.
[W 2025-07-29 07:37:04,735] The parameter 'bagging_temperature' in trial#17 is sampled independently instead of being sampled by multivariate TPE sampler. (optimization performance may be degraded). You can suppress this warning by setting `warn_independent_sampling` to `False` in the constructor of `TPESampler`, if this independent sampling is intended behavior.
[I 2025-07-29 07:37:24,161] Trial 17 finished with value: 0.9757179585483255 and parameters: {'depth': 10, 'learning_rate': 0.07056692776364547, 'l2_leaf_reg': 1.236565671391403, 'bootstrap_type': 'Bayesian', 'bagging_temperature': 0.03307046226619226}. Best is trial 13 with value: 0.9782146894128813.

Best trial: 13. Best value: 0.978215:  36%|███▌      | 18/50 [02:59<09:33, 17.93s/it]
                                                                                     

Best trial: 13. Best value: 0.978215:  36%|███▌      | 18/50 [03:16<09:33, 17.93s/it]
Best trial: 13. Best value: 0.978215:  36%|███▌      | 18/50 [03:16<09:33, 17.93s/it]
Best trial: 13. Best value: 0.978215:  38%|███▊      | 19/50 [03:16<09:05, 17.60s/it]
                                                                                     

Best trial: 13. Best value: 0.978215:  38%|███▊      | 19/50 [03:16<09:05, 17.60s/it]
                                                                                     

Best trial: 13. Best value: 0.978215:  38%|███▊      | 19/50 [03:37<09:05, 17.60s/it]
Best trial: 13. Best value: 0.978215:  38%|███▊      | 19/50 [03:37<09:05, 17.60s/it]
Best trial: 13. Best value: 0.978215:  40%|████      | 20/50 [03:37<09:19, 18.66s/it]
                                                                                     

Best trial: 13. Best value: 0.978215:  40%|████      | 20/50 [03:37<09:19, 18.66s/it]
                                                                                     

Best trial: 13. Best value: 0.978215:  40%|████      | 20/50 [03:49<09:19, 18.66s/it]
Best trial: 13. Best value: 0.978215:  40%|████      | 20/50 [03:49<09:19, 18.66s/it]
Best trial: 13. Best value: 0.978215:  42%|████▏     | 21/50 [03:49<08:04, 16.70s/it]
                                                                                     

Best trial: 13. Best value: 0.978215:  42%|████▏     | 21/50 [03:49<08:04, 16.70s/it]
                                                                                     

Best trial: 13. Best value: 0.978215:  42%|████▏     | 21/50 [04:09<08:04, 16.70s/it]
Best trial: 13. Best value: 0.978215:  42%|████▏     | 21/50 [04:09<08:04, 16.70s/it]
Best trial: 13. Best value: 0.978215:  44%|████▍     | 22/50 [04:09<08:17, 17.78s/it]
                                                                                     

Best trial: 13. Best value: 0.978215:  44%|████▍     | 22/50 [04:09<08:17, 17.78s/it]
                                                                                     

Best trial: 13. Best value: 0.978215:  44%|████▍     | 22/50 [04:36<08:17, 17.78s/it]
Best trial: 13. Best value: 0.978215:  44%|████▍     | 22/50 [04:36<08:17, 17.78s/it]
Best trial: 13. Best value: 0.978215:  46%|████▌     | 23/50 [04:36<09:09, 20.36s/it]
                                                                                     

Best trial: 13. Best value: 0.978215:  46%|████▌     | 23/50 [04:36<09:09, 20.36s/it]
                                                                                     

Best trial: 13. Best value: 0.978215:  46%|████▌     | 23/50 [04:49<09:09, 20.36s/it]
Best trial: 13. Best value: 0.978215:  46%|████▌     | 23/50 [04:49<09:09, 20.36s/it]
Best trial: 13. Best value: 0.978215:  48%|████▊     | 24/50 [04:49<07:52, 18.19s/it]
                                                                                     

Best trial: 13. Best value: 0.978215:  48%|████▊     | 24/50 [04:49<07:52, 18.19s/it]
                                                                                     

Best trial: 13. Best value: 0.978215:  48%|████▊     | 24/50 [04:53<07:52, 18.19s/it]
Best trial: 13. Best value: 0.978215:  48%|████▊     | 24/50 [04:53<07:52, 18.19s/it]
Best trial: 13. Best value: 0.978215:  50%|█████     | 25/50 [04:53<05:47, 13.88s/it]
                                                                                     

Best trial: 13. Best value: 0.978215:  50%|█████     | 25/50 [04:53<05:47, 13.88s/it]
                                                                                     

Best trial: 13. Best value: 0.978215:  50%|█████     | 25/50 [05:11<05:47, 13.88s/it]
Best trial: 13. Best value: 0.978215:  50%|█████     | 25/50 [05:11<05:47, 13.88s/it]
Best trial: 13. Best value: 0.978215:  52%|█████▏    | 26/50 [05:11<06:08, 15.34s/it]
                                                                                     

Best trial: 13. Best value: 0.978215:  52%|█████▏    | 26/50 [05:11<06:08, 15.34s/it]
                                                                                     

Best trial: 13. Best value: 0.978215:  52%|█████▏    | 26/50 [05:22<06:08, 15.34s/it]
Best trial: 13. Best value: 0.978215:  52%|█████▏    | 26/50 [05:22<06:08, 15.34s/it]
Best trial: 13. Best value: 0.978215:  54%|█████▍    | 27/50 [05:22<05:21, 13.96s/it]
                                                                                     

Best trial: 13. Best value: 0.978215:  54%|█████▍    | 27/50 [05:22<05:21, 13.96s/it]
                                                                                     

Best trial: 13. Best value: 0.978215:  54%|█████▍    | 27/50 [05:36<05:21, 13.96s/it]
Best trial: 13. Best value: 0.978215:  54%|█████▍    | 27/50 [05:36<05:21, 13.96s/it]
Best trial: 13. Best value: 0.978215:  56%|█████▌    | 28/50 [05:36<05:08, 14.04s/it]
                                                                                     

Best trial: 13. Best value: 0.978215:  56%|█████▌    | 28/50 [05:36<05:08, 14.04s/it]
                                                                                     

Best trial: 13. Best value: 0.978215:  56%|█████▌    | 28/50 [05:46<05:08, 14.04s/it]
Best trial: 13. Best value: 0.978215:  56%|█████▌    | 28/50 [05:46<05:08, 14.04s/it]
Best trial: 13. Best value: 0.978215:  58%|█████▊    | 29/50 [05:46<04:24, 12.60s/it]
                                                                                     

Best trial: 13. Best value: 0.978215:  58%|█████▊    | 29/50 [05:46<04:24, 12.60s/it]
                                                                                     

Best trial: 13. Best value: 0.978215:  58%|█████▊    | 29/50 [06:08<04:24, 12.60s/it]
Best trial: 13. Best value: 0.978215:  58%|█████▊    | 29/50 [06:08<04:24, 12.60s/it]
Best trial: 13. Best value: 0.978215:  60%|██████    | 30/50 [06:08<05:10, 15.54s/it]
                                                                                     

Best trial: 13. Best value: 0.978215:  60%|██████    | 30/50 [06:08<05:10, 15.54s/it]
                                                                                     
[W 2025-07-29 07:37:24,311] The parameter 'subsample' in trial#18 is sampled independently instead of being sampled by multivariate TPE sampler. (optimization performance may be degraded). You can suppress this warning by setting `warn_independent_sampling` to `False` in the constructor of `TPESampler`, if this independent sampling is intended behavior.
[I 2025-07-29 07:37:40,991] Trial 18 finished with value: 0.9672911134168073 and parameters: {'depth': 10, 'learning_rate': 0.18769023026285198, 'l2_leaf_reg': 1.6566693533046242, 'bootstrap_type': 'Bernoulli', 'subsample': 0.8}. Best is trial 13 with value: 0.9782146894128813.
[W 2025-07-29 07:37:41,136] The parameter 'subsample' in trial#19 is sampled independently instead of being sampled by multivariate TPE sampler. (optimization performance may be degraded). You can suppress this warning by setting `warn_independent_sampling` to `False` in the constructor of `TPESampler`, if this independent sampling is intended behavior.
[I 2025-07-29 07:38:02,125] Trial 19 finished with value: 0.974216096833476 and parameters: {'depth': 10, 'learning_rate': 0.06576532267054706, 'l2_leaf_reg': 1.5146409276756538, 'bootstrap_type': 'Bernoulli', 'subsample': 0.8}. Best is trial 13 with value: 0.9782146894128813.
[W 2025-07-29 07:38:02,274] The parameter 'subsample' in trial#20 is sampled independently instead of being sampled by multivariate TPE sampler. (optimization performance may be degraded). You can suppress this warning by setting `warn_independent_sampling` to `False` in the constructor of `TPESampler`, if this independent sampling is intended behavior.
[I 2025-07-29 07:38:14,237] Trial 20 finished with value: 0.9713650060189398 and parameters: {'depth': 9, 'learning_rate': 0.11155910845576655, 'l2_leaf_reg': 7.6859182743744805, 'bootstrap_type': 'Bernoulli', 'subsample': 0.9}. Best is trial 13 with value: 0.9782146894128813.
[W 2025-07-29 07:38:14,384] The parameter 'subsample' in trial#21 is sampled independently instead of being sampled by multivariate TPE sampler. (optimization performance may be degraded). You can suppress this warning by setting `warn_independent_sampling` to `False` in the constructor of `TPESampler`, if this independent sampling is intended behavior.
[I 2025-07-29 07:38:34,553] Trial 21 finished with value: 0.9744684883384405 and parameters: {'depth': 10, 'learning_rate': 0.05936201985382718, 'l2_leaf_reg': 2.709655476741193, 'bootstrap_type': 'Bernoulli', 'subsample': 0.9}. Best is trial 13 with value: 0.9782146894128813.
[W 2025-07-29 07:38:34,700] The parameter 'subsample' in trial#22 is sampled independently instead of being sampled by multivariate TPE sampler. (optimization performance may be degraded). You can suppress this warning by setting `warn_independent_sampling` to `False` in the constructor of `TPESampler`, if this independent sampling is intended behavior.
[I 2025-07-29 07:39:00,936] Trial 22 finished with value: 0.9671667652974685 and parameters: {'depth': 10, 'learning_rate': 0.02679290738995879, 'l2_leaf_reg': 4.153984906513656, 'bootstrap_type': 'Bernoulli', 'subsample': 0.9}. Best is trial 13 with value: 0.9782146894128813.
[W 2025-07-29 07:39:01,088] The parameter 'bagging_temperature' in trial#23 is sampled independently instead of being sampled by multivariate TPE sampler. (optimization performance may be degraded). You can suppress this warning by setting `warn_independent_sampling` to `False` in the constructor of `TPESampler`, if this independent sampling is intended behavior.
[I 2025-07-29 07:39:14,057] Trial 23 finished with value: 0.9717497434624685 and parameters: {'depth': 9, 'learning_rate': 0.06930967623820494, 'l2_leaf_reg': 3.2063764952519764, 'bootstrap_type': 'Bayesian', 'bagging_temperature': 0.7434777351682917}. Best is trial 13 with value: 0.9782146894128813.
[W 2025-07-29 07:39:14,209] The parameter 'subsample' in trial#24 is sampled independently instead of being sampled by multivariate TPE sampler. (optimization performance may be degraded). You can suppress this warning by setting `warn_independent_sampling` to `False` in the constructor of `TPESampler`, if this independent sampling is intended behavior.
[I 2025-07-29 07:39:17,878] Trial 24 finished with value: 0.945310165259625 and parameters: {'depth': 4, 'learning_rate': 0.03268305328238256, 'l2_leaf_reg': 7.833922190416996, 'bootstrap_type': 'Bernoulli', 'subsample': 0.8}. Best is trial 13 with value: 0.9782146894128813.
[W 2025-07-29 07:39:18,034] The parameter 'subsample' in trial#25 is sampled independently instead of being sampled by multivariate TPE sampler. (optimization performance may be degraded). You can suppress this warning by setting `warn_independent_sampling` to `False` in the constructor of `TPESampler`, if this independent sampling is intended behavior.
[I 2025-07-29 07:39:36,645] Trial 25 finished with value: 0.9713928761077646 and parameters: {'depth': 10, 'learning_rate': 0.057029005211188796, 'l2_leaf_reg': 1.041005380360406, 'bootstrap_type': 'Bernoulli', 'subsample': 0.9}. Best is trial 13 with value: 0.9782146894128813.
[W 2025-07-29 07:39:36,791] The parameter 'subsample' in trial#26 is sampled independently instead of being sampled by multivariate TPE sampler. (optimization performance may be degraded). You can suppress this warning by setting `warn_independent_sampling` to `False` in the constructor of `TPESampler`, if this independent sampling is intended behavior.
[I 2025-07-29 07:39:47,370] Trial 26 finished with value: 0.9724588897669216 and parameters: {'depth': 9, 'learning_rate': 0.2516355579667054, 'l2_leaf_reg': 1.0896949938762113, 'bootstrap_type': 'Bernoulli', 'subsample': 0.7}. Best is trial 13 with value: 0.9782146894128813.
[W 2025-07-29 07:39:47,517] The parameter 'bagging_temperature' in trial#27 is sampled independently instead of being sampled by multivariate TPE sampler. (optimization performance may be degraded). You can suppress this warning by setting `warn_independent_sampling` to `False` in the constructor of `TPESampler`, if this independent sampling is intended behavior.
[I 2025-07-29 07:40:01,575] Trial 27 finished with value: 0.9714035389784661 and parameters: {'depth': 8, 'learning_rate': 0.032228722046868524, 'l2_leaf_reg': 1.525334900762451, 'bootstrap_type': 'Bayesian', 'bagging_temperature': 0.9002148367830048}. Best is trial 13 with value: 0.9782146894128813.
[W 2025-07-29 07:40:01,737] The parameter 'subsample' in trial#28 is sampled independently instead of being sampled by multivariate TPE sampler. (optimization performance may be degraded). You can suppress this warning by setting `warn_independent_sampling` to `False` in the constructor of `TPESampler`, if this independent sampling is intended behavior.
[I 2025-07-29 07:40:10,832] Trial 28 finished with value: 0.9632936998358297 and parameters: {'depth': 8, 'learning_rate': 0.06134839149929794, 'l2_leaf_reg': 4.458385910108544, 'bootstrap_type': 'Bernoulli', 'subsample': 0.8}. Best is trial 13 with value: 0.9782146894128813.
[W 2025-07-29 07:40:10,993] The parameter 'bagging_temperature' in trial#29 is sampled independently instead of being sampled by multivariate TPE sampler. (optimization performance may be degraded). You can suppress this warning by setting `warn_independent_sampling` to `False` in the constructor of `TPESampler`, if this independent sampling is intended behavior.
