+ python main.py --compare --csv ../data/aims_dataset.csv --n-trials 15 --n-trials-tabnet 15

2025-07-30 01:17:18,144 - RandomForestTrainer - INFO - Starting Random Forest Training Pipeline...

2025-07-30 01:17:18,144 - RandomForestTrainer - INFO - Loading and preprocessing dataset from ../data/aims_dataset.csv ...

2025-07-30 01:17:18,291 - RandomForestTrainer - INFO - Applying Custom Weighted-Impact Labeling...

2025-07-30 01:17:18,713 - RandomForestTrainer - INFO - Splitting data into temporal-aware training and holdout sets...

2025-07-30 01:17:18,719 - RandomForestTrainer - INFO - Setting up output directory...

2025-07-30 01:17:20,374 - RandomForestTrainer - INFO - Creating base model pipeline...

2025-07-30 01:17:20,374 - RandomForestTrainer - INFO - Configure and Run Hyperparameter Optimization (HPO) with Optuna ...
[I 2025-07-30 01:17:20,375] A new study created in memory with name: no-name-9b958a25-7c43-4b0e-9b6e-08065fc2966f

2025-07-30 01:17:20,375 - RandomForestTrainer - INFO - Starting Optuna optimization with 15 trials...
================================================================================
AIMS FRAMEWORK - MODEL TRAINING ORCHESTRATOR
================================================================================
Start Time: 2025-07-30 01:17:18
Dataset: ../data/aims_dataset.csv
Random State: 42
--------------------------------------------------------------------------------

[1/3] Training Random Forest Classifier...
------------------------------------------------------------

================================================================================
RANDOM FOREST TRAINING PIPELINE - AIMS FRAMEWORK
================================================================================
Configuration:
  - Dataset: ../data/aims_dataset.csv
  - CV Folds: 5
  - Optuna Trials: 15
  - Random State: 42
  - Parallel Jobs: -1
================================================================================
------------------------------------------------------------
[Step 1/11] Loading and preprocessing dataset...
------------------------------------------------------------
✓ Raw dataset shape: (5400, 18)
✓ Preprocessed dataset shape: (5400, 25)
------------------------------------------------------------
[Step 2/11] Applying Custom Weighted-Impact Labeling...
------------------------------------------------------------
✓ Feature matrix shape : (5400, 25)
✓ Temporal groups      : 25
✓ Impact distribution :
   count  percent (%)
0    768        14.22
1   1013        18.76
2   2715        50.28
3    904        16.74
------------------------------------------------------------
[Step 3/11] Splitting data into temporal-aware training and holdout sets...
------------------------------------------------------------
✓ Numerical features: 20
✓ Categorical features: 5
✓ Training set : 4576 samples (84.7%)
✓ Holdout set  : 824 samples (15.3%)
------------------------------------------------------------
[Step 4/11] Setting up output directory...
------------------------------------------------------------
✓ Results will be saved to: /results/random_forest
✓ Saving artifact files (features, labels, groups, and class weights)...
✓ Features, labels, groups, and class weights saved.
------------------------------------------------------------
[Step 5/11] Creating base model pipeline...
------------------------------------------------------------
✓ Base model pipeline created: Preprocessor → RandomForestClassifier
------------------------------------------------------------
[Step 6/11] Configure and Run Hyperparameter Optimization (HPO) with Optuna ...
------------------------------------------------------------
Starting Optuna optimization with 15 trials...

  0%|          | 0/15 [00:00<?, ?it/s]
                                      

  0%|          | 0/15 [00:09<?, ?it/s]
Best trial: 0. Best value: 0.981586:   0%|          | 0/15 [00:09<?, ?it/s]
Best trial: 0. Best value: 0.981586:   7%|▋         | 1/15 [00:09<02:15,  9.68s/it]
                                                                                   

Best trial: 0. Best value: 0.981586:   7%|▋         | 1/15 [00:36<02:15,  9.68s/it]
Best trial: 0. Best value: 0.981586:   7%|▋         | 1/15 [00:36<02:15,  9.68s/it]
Best trial: 0. Best value: 0.981586:  13%|█▎        | 2/15 [00:36<04:18, 19.90s/it]
                                                                                   

Best trial: 0. Best value: 0.981586:  13%|█▎        | 2/15 [00:49<04:18, 19.90s/it]
Best trial: 0. Best value: 0.981586:  13%|█▎        | 2/15 [00:49<04:18, 19.90s/it]
Best trial: 0. Best value: 0.981586:  20%|██        | 3/15 [00:49<03:19, 16.59s/it]
                                                                                   

Best trial: 0. Best value: 0.981586:  20%|██        | 3/15 [01:05<03:19, 16.59s/it]
Best trial: 3. Best value: 0.982002:  20%|██        | 3/15 [01:05<03:19, 16.59s/it]
Best trial: 3. Best value: 0.982002:  27%|██▋       | 4/15 [01:05<03:01, 16.51s/it]
                                                                                   

Best trial: 3. Best value: 0.982002:  27%|██▋       | 4/15 [01:15<03:01, 16.51s/it]
Best trial: 3. Best value: 0.982002:  27%|██▋       | 4/15 [01:15<03:01, 16.51s/it]
Best trial: 3. Best value: 0.982002:  33%|███▎      | 5/15 [01:15<02:19, 13.97s/it]
                                                                                   

Best trial: 3. Best value: 0.982002:  33%|███▎      | 5/15 [01:33<02:19, 13.97s/it]
Best trial: 3. Best value: 0.982002:  33%|███▎      | 5/15 [01:33<02:19, 13.97s/it]
Best trial: 3. Best value: 0.982002:  40%|████      | 6/15 [01:33<02:19, 15.50s/it]
                                                                                   

Best trial: 3. Best value: 0.982002:  40%|████      | 6/15 [01:56<02:19, 15.50s/it]
Best trial: 3. Best value: 0.982002:  40%|████      | 6/15 [01:56<02:19, 15.50s/it]
Best trial: 3. Best value: 0.982002:  47%|████▋     | 7/15 [01:56<02:22, 17.76s/it]
                                                                                   

Best trial: 3. Best value: 0.982002:  47%|████▋     | 7/15 [02:00<02:22, 17.76s/it]
Best trial: 3. Best value: 0.982002:  47%|████▋     | 7/15 [02:01<02:22, 17.76s/it]
Best trial: 3. Best value: 0.982002:  53%|█████▎    | 8/15 [02:01<01:35, 13.67s/it]
                                                                                   

Best trial: 3. Best value: 0.982002:  53%|█████▎    | 8/15 [02:05<01:35, 13.67s/it]
Best trial: 3. Best value: 0.982002:  53%|█████▎    | 8/15 [02:05<01:35, 13.67s/it]
Best trial: 3. Best value: 0.982002:  60%|██████    | 9/15 [02:05<01:05, 10.90s/it]
                                                                                   

Best trial: 3. Best value: 0.982002:  60%|██████    | 9/15 [02:21<01:05, 10.90s/it]
Best trial: 3. Best value: 0.982002:  60%|██████    | 9/15 [02:21<01:05, 10.90s/it]
Best trial: 3. Best value: 0.982002:  67%|██████▋   | 10/15 [02:21<01:01, 12.35s/it]
                                                                                    

Best trial: 3. Best value: 0.982002:  67%|██████▋   | 10/15 [02:37<01:01, 12.35s/it]
Best trial: 3. Best value: 0.982002:  67%|██████▋   | 10/15 [02:37<01:01, 12.35s/it]
Best trial: 3. Best value: 0.982002:  73%|███████▎  | 11/15 [02:37<00:53, 13.45s/it]
                                                                                    

Best trial: 3. Best value: 0.982002:  73%|███████▎  | 11/15 [02:56<00:53, 13.45s/it]
Best trial: 3. Best value: 0.982002:  73%|███████▎  | 11/15 [02:56<00:53, 13.45s/it]
Best trial: 3. Best value: 0.982002:  80%|████████  | 12/15 [02:56<00:45, 15.18s/it]
                                                                                    

Best trial: 3. Best value: 0.982002:  80%|████████  | 12/15 [03:03<00:45, 15.18s/it]
Best trial: 3. Best value: 0.982002:  80%|████████  | 12/15 [03:03<00:45, 15.18s/it]
Best trial: 3. Best value: 0.982002:  87%|████████▋ | 13/15 [03:03<00:25, 12.58s/it]
                                                                                    

Best trial: 3. Best value: 0.982002:  87%|████████▋ | 13/15 [03:15<00:25, 12.58s/it]
Best trial: 3. Best value: 0.982002:  87%|████████▋ | 13/15 [03:15<00:25, 12.58s/it]
Best trial: 3. Best value: 0.982002:  93%|█████████▎| 14/15 [03:15<00:12, 12.60s/it]
                                                                                    

Best trial: 3. Best value: 0.982002:  93%|█████████▎| 14/15 [03:33<00:12, 12.60s/it]
Best trial: 3. Best value: 0.982002:  93%|█████████▎| 14/15 [03:33<00:12, 12.60s/it]
Best trial: 3. Best value: 0.982002: 100%|██████████| 15/15 [03:33<00:00, 14.29s/it]
Best trial: 3. Best value: 0.982002: 100%|██████████| 15/15 [03:33<00:00, 14.27s/it]

2025-07-30 01:20:54,354 - RandomForestTrainer - INFO - ✓ Optimization completed in 214.0 seconds!

2025-07-30 01:20:54,354 - RandomForestTrainer - INFO - Best F1-macro (CV): 0.9820 (±0.0059)

2025-07-30 01:20:54,354 - RandomForestTrainer - INFO - Final model training with best hyperparameters...

2025-07-30 01:20:54,355 - RandomForestTrainer - INFO - Starting final fitting...

2025-07-30 01:20:58,175 - RandomForestTrainer - INFO - ✓ Final model fitting completed in 3.82 seconds!

2025-07-30 01:20:58,321 - RandomForestTrainer - INFO - ✓ Final model saved to: /results/random_forest/random_forest_model.pkl

2025-07-30 01:20:58,321 - RandomForestTrainer - INFO - Evaluating final model on the holdout set and saving results...

2025-07-30 01:20:58,446 - RandomForestTrainer - INFO - Save Results: CSV and JSON Files...

2025-07-30 01:20:58,514 - RandomForestTrainer - INFO - Generating and saving visualizations...

2025-07-30 01:21:00,850 - RandomForestTrainer - INFO - All RANDOM FOREST visualizations and results saved to: /results/random_forest

2025-07-30 01:21:00,850 - RandomForestTrainer - INFO - RANDOM FOREST COMPLETED! Total execution time: 3.7 minutes

2025-07-30 01:21:00,850 - RandomForestTrainer - INFO - All results saved to: /results/random_forest. Generating summary...

2025-07-30 01:21:00,852 - TabNetTrainer - INFO - Starting TabNet Training Pipeline...

2025-07-30 01:21:00,852 - TabNetTrainer - INFO - Loading and preprocessing dataset from ../data/aims_dataset.csv ...

2025-07-30 01:21:00,952 - TabNetTrainer - INFO - Applying Custom Weighted-Impact Labeling...

2025-07-30 01:21:01,383 - TabNetTrainer - INFO - Splitting data into temporal‑aware training and hold‑out sets...
[I 2025-07-30 01:17:29,963] Trial 0 finished with value: 0.9815863628513164 and parameters: {'n_estimators': 300, 'max_depth': None, 'min_samples_leaf': 1, 'max_features': 0.5}. Best is trial 0 with value: 0.9815863628513164.
[I 2025-07-30 01:17:57,012] Trial 1 finished with value: 0.9789526389559473 and parameters: {'n_estimators': 600, 'max_depth': 10, 'min_samples_leaf': 1, 'max_features': 0.8}. Best is trial 0 with value: 0.9815863628513164.
[I 2025-07-30 01:18:09,677] Trial 2 finished with value: 0.9803581391760755 and parameters: {'n_estimators': 400, 'max_depth': 10, 'min_samples_leaf': 2, 'max_features': 0.5}. Best is trial 0 with value: 0.9815863628513164.
[I 2025-07-30 01:18:26,055] Trial 3 finished with value: 0.9820024999005295 and parameters: {'n_estimators': 500, 'max_depth': 20, 'min_samples_leaf': 1, 'max_features': 0.5}. Best is trial 3 with value: 0.9820024999005295.
[I 2025-07-30 01:18:35,517] Trial 4 finished with value: 0.9809656052597084 and parameters: {'n_estimators': 300, 'max_depth': 10, 'min_samples_leaf': 3, 'max_features': 0.5}. Best is trial 3 with value: 0.9820024999005295.
[I 2025-07-30 01:18:53,987] Trial 5 finished with value: 0.979432226306732 and parameters: {'n_estimators': 600, 'max_depth': 20, 'min_samples_leaf': 5, 'max_features': 0.5}. Best is trial 3 with value: 0.9820024999005295.
[I 2025-07-30 01:19:16,402] Trial 6 finished with value: 0.9813825597381263 and parameters: {'n_estimators': 500, 'max_depth': None, 'min_samples_leaf': 2, 'max_features': 0.8}. Best is trial 3 with value: 0.9820024999005295.
[I 2025-07-30 01:19:21,314] Trial 7 finished with value: 0.9721231090872227 and parameters: {'n_estimators': 300, 'max_depth': 30, 'min_samples_leaf': 1, 'max_features': 'sqrt'}. Best is trial 3 with value: 0.9820024999005295.
[I 2025-07-30 01:19:26,115] Trial 8 finished with value: 0.9788509115892785 and parameters: {'n_estimators': 100, 'max_depth': None, 'min_samples_leaf': 1, 'max_features': 0.8}. Best is trial 3 with value: 0.9820024999005295.
[I 2025-07-30 01:19:41,728] Trial 9 finished with value: 0.9791937640491017 and parameters: {'n_estimators': 500, 'max_depth': None, 'min_samples_leaf': 4, 'max_features': 0.5}. Best is trial 3 with value: 0.9820024999005295.
[I 2025-07-30 01:19:57,654] Trial 10 finished with value: 0.9820024999005295 and parameters: {'n_estimators': 500, 'max_depth': 20, 'min_samples_leaf': 1, 'max_features': 0.5}. Best is trial 3 with value: 0.9820024999005295.
[I 2025-07-30 01:20:16,810] Trial 11 finished with value: 0.9820024999005295 and parameters: {'n_estimators': 600, 'max_depth': 20, 'min_samples_leaf': 1, 'max_features': 0.5}. Best is trial 3 with value: 0.9820024999005295.
[I 2025-07-30 01:20:23,396] Trial 12 finished with value: 0.9787027396082921 and parameters: {'n_estimators': 200, 'max_depth': 20, 'min_samples_leaf': 1, 'max_features': 0.5}. Best is trial 3 with value: 0.9820024999005295.
[I 2025-07-30 01:20:36,041] Trial 13 finished with value: 0.9721672355654934 and parameters: {'n_estimators': 800, 'max_depth': 20, 'min_samples_leaf': 1, 'max_features': 'sqrt'}. Best is trial 3 with value: 0.9820024999005295.
